[I 2024-10-13 11:29:27,052] Trial 377 finished with value: 1.4 and parameters: {'x_0_0': 'oo', 'x_0_1': 'oo', 'x_0_2': 'oo', 'x_1_0': 'cd', 'x_1_1': 'ac', 'x_1_2': 'bd'}. Best is trial 359 with value: 0.9333333333333333.
[I 2024-10-13 11:29:27,072] Trial 378 finished with value: 1.1222222222222222 and parameters: {'x_0_0': 'ac', 'x_0_1': 'ad', 'x_0_2': 'ad', 'x_1_0': 'ac', 'x_1_1': 'bd', 'x_1_2': 'oo'}. Best is trial 359 with value: 0.9333333333333333.
[I 2024-10-13 11:29:27,090] Trial 379 finished with value: 1.5 and parameters: {'x_0_0': 'oo', 'x_0_1': 'oo', 'x_0_2': 'cd', 'x_1_0': 'cd', 'x_1_1': 'ab', 'x_1_2': 'ab'}. Best is trial 359 with value: 0.9333333333333333.
[I 2024-10-13 11:29:27,109] Trial 380 finished with value: 1.2777777777777777 and parameters: {'x_0_0': 'ab', 'x_0_1': 'oo', 'x_0_2': 'oo', 'x_1_0': 'ad', 'x_1_1': 'ac', 'x_1_2': 'ab'}. Best is trial 359 with value: 0.9333333333333333.
[I 2024-10-13 11:29:27,128] Trial 381 finished with value: 2.0 and parameters: {'x_0_0': 'cd', 'x_0_1': 'cd', 'x_0_2': 'ac', 'x_1_0': 'bd', 'x_1_1': 'bd', 'x_1_2': 'ac'}. Best is trial 359 with value: 0.9333333333333333.
[I 2024-10-13 11:29:27,148] Trial 382 finished with value: 1.4444444444444444 and parameters: {'x_0_0': 'bd', 'x_0_1': 'ac', 'x_0_2': 'bc', 'x_1_0': 'bc', 'x_1_1': 'bd', 'x_1_2': 'cd'}. Best is trial 359 with value: 0.9333333333333333.
[I 2024-10-13 11:29:27,167] Trial 383 finished with value: 1.9 and parameters: {'x_0_0': 'cd', 'x_0_1': 'bd', 'x_0_2': 'bc', 'x_1_0': 'ab', 'x_1_1': 'oo', 'x_1_2': 'bc'}. Best is trial 359 with value: 0.9333333333333333.
[I 2024-10-13 11:29:27,186] Trial 384 finished with value: 0.6222222222222222 and parameters: {'x_0_0': 'bd', 'x_0_1': 'oo', 'x_0_2': 'oo', 'x_1_0': 'bc', 'x_1_1': 'ac', 'x_1_2': 'oo'}. Best is trial 384 with value: 0.6222222222222222.
[I 2024-10-13 11:29:27,206] Trial 385 finished with value: 1.5666666666666667 and parameters: {'x_0_0': 'bd', 'x_0_1': 'cd', 'x_0_2': 'ad', 'x_1_0': 'ac', 'x_1_1': 'oo', 'x_1_2': 'bc'}. Best is trial 384 with value: 0.6222222222222222.
[I 2024-10-13 11:29:27,225] Trial 386 finished with value: 1.7 and parameters: {'x_0_0': 'oo', 'x_0_1': 'ad', 'x_0_2': 'bc', 'x_1_0': 'oo', 'x_1_1': 'ad', 'x_1_2': 'bc'}. Best is trial 384 with value: 0.6222222222222222.
[I 2024-10-13 11:29:27,245] Trial 387 finished with value: 1.6666666666666665 and parameters: {'x_0_0': 'ac', 'x_0_1': 'bd', 'x_0_2': 'cd', 'x_1_0': 'ab', 'x_1_1': 'ab', 'x_1_2': 'ac'}. Best is trial 384 with value: 0.6222222222222222.
[I 2024-10-13 11:29:27,264] Trial 388 finished with value: 1.5555555555555556 and parameters: {'x_0_0': 'bd', 'x_0_1': 'bd', 'x_0_2': 'cd', 'x_1_0': 'ab', 'x_1_1': 'ac', 'x_1_2': 'bc'}. Best is trial 384 with value: 0.6222222222222222.
[I 2024-10-13 11:29:27,283] Trial 389 finished with value: 1.2666666666666666 and parameters: {'x_0_0': 'ad', 'x_0_1': 'oo', 'x_0_2': 'bc', 'x_1_0': 'ad', 'x_1_1': 'cd', 'x_1_2': 'ad'}. Best is trial 384 with value: 0.6222222222222222.
[I 2024-10-13 11:29:27,303] Trial 390 finished with value: 1.6666666666666665 and parameters: {'x_0_0': 'ad', 'x_0_1': 'ab', 'x_0_2': 'ad', 'x_1_0': 'ad', 'x_1_1': 'bd', 'x_1_2': 'ab'}. Best is trial 384 with value: 0.6222222222222222.
[I 2024-10-13 11:29:27,323] Trial 391 finished with value: 1.3666666666666667 and parameters: {'x_0_0': 'ad', 'x_0_1': 'ab', 'x_0_2': 'oo', 'x_1_0': 'oo', 'x_1_1': 'ab', 'x_1_2': 'ad'}. Best is trial 384 with value: 0.6222222222222222.
[I 2024-10-13 11:29:27,342] Trial 392 finished with value: 1.3333333333333333 and parameters: {'x_0_0': 'bc', 'x_0_1': 'ad', 'x_0_2': 'ad', 'x_1_0': 'cd', 'x_1_1': 'ab', 'x_1_2': 'bd'}. Best is trial 384 with value: 0.6222222222222222.
[I 2024-10-13 11:29:27,361] Trial 393 finished with value: 1.6777777777777778 and parameters: {'x_0_0': 'ab', 'x_0_1': 'bd', 'x_0_2': 'ac', 'x_1_0': 'ab', 'x_1_1': 'bc', 'x_1_2': 'oo'}. Best is trial 384 with value: 0.6222222222222222.
[I 2024-10-13 11:29:27,380] Trial 394 finished with value: 1.4444444444444444 and parameters: {'x_0_0': 'ad', 'x_0_1': 'ad', 'x_0_2': 'cd', 'x_1_0': 'bd', 'x_1_1': 'ad', 'x_1_2': 'ab'}. Best is trial 384 with value: 0.6222222222222222.
[I 2024-10-13 11:29:27,399] Trial 395 finished with value: 1.5 and parameters: {'x_0_0': 'oo', 'x_0_1': 'oo', 'x_0_2': 'cd', 'x_1_0': 'ac', 'x_1_1': 'ad', 'x_1_2': 'ad'}. Best is trial 384 with value: 0.6222222222222222.
[I 2024-10-13 11:29:27,417] Trial 396 finished with value: 1.2444444444444445 and parameters: {'x_0_0': 'ad', 'x_0_1': 'cd', 'x_0_2': 'oo', 'x_1_0': 'bc', 'x_1_1': 'oo', 'x_1_2': 'ab'}. Best is trial 384 with value: 0.6222222222222222.
[I 2024-10-13 11:29:27,436] Trial 397 finished with value: 1.5555555555555556 and parameters: {'x_0_0': 'ad', 'x_0_1': 'bd', 'x_0_2': 'ac', 'x_1_0': 'ab', 'x_1_1': 'cd', 'x_1_2': 'bd'}. Best is trial 384 with value: 0.6222222222222222.
[I 2024-10-13 11:29:27,455] Trial 398 finished with value: 1.8 and parameters: {'x_0_0': 'oo', 'x_0_1': 'bc', 'x_0_2': 'oo', 'x_1_0': 'bc', 'x_1_1': 'bd', 'x_1_2': 'ac'}. Best is trial 384 with value: 0.6222222222222222.
[I 2024-10-13 11:29:27,474] Trial 399 finished with value: 1.0 and parameters: {'x_0_0': 'ac', 'x_0_1': 'ad', 'x_0_2': 'bc', 'x_1_0': 'bc', 'x_1_1': 'bc', 'x_1_2': 'ac'}. Best is trial 384 with value: 0.6222222222222222.
[I 2024-10-13 11:29:27,493] Trial 400 finished with value: 1.7000000000000002 and parameters: {'x_0_0': 'oo', 'x_0_1': 'bd', 'x_0_2': 'oo', 'x_1_0': 'cd', 'x_1_1': 'ac', 'x_1_2': 'oo'}. Best is trial 384 with value: 0.6222222222222222.
[I 2024-10-13 11:29:27,514] Trial 401 finished with value: 2.0 and parameters: {'x_0_0': 'cd', 'x_0_1': 'cd', 'x_0_2': 'ac', 'x_1_0': 'ad', 'x_1_1': 'cd', 'x_1_2': 'bc'}. Best is trial 384 with value: 0.6222222222222222.
[I 2024-10-13 11:29:27,536] Trial 402 finished with value: 1.9 and parameters: {'x_0_0': 'oo', 'x_0_1': 'bd', 'x_0_2': 'cd', 'x_1_0': 'ad', 'x_1_1': 'bc', 'x_1_2': 'bc'}. Best is trial 384 with value: 0.6222222222222222.
[I 2024-10-13 11:29:27,555] Trial 403 finished with value: 1.2222222222222223 and parameters: {'x_0_0': 'ac', 'x_0_1': 'ad', 'x_0_2': 'bd', 'x_1_0': 'bd', 'x_1_1': 'bc', 'x_1_2': 'bc'}. Best is trial 384 with value: 0.6222222222222222.
[I 2024-10-13 11:29:27,577] Trial 404 finished with value: 1.4555555555555557 and parameters: {'x_0_0': 'bc', 'x_0_1': 'ab', 'x_0_2': 'cd', 'x_1_0': 'ac', 'x_1_1': 'oo', 'x_1_2': 'cd'}. Best is trial 384 with value: 0.6222222222222222.
[I 2024-10-13 11:29:27,597] Trial 405 finished with value: 1.3444444444444446 and parameters: {'x_0_0': 'bc', 'x_0_1': 'ac', 'x_0_2': 'bd', 'x_1_0': 'bc', 'x_1_1': 'oo', 'x_1_2': 'bc'}. Best is trial 384 with value: 0.6222222222222222.
[I 2024-10-13 11:29:27,618] Trial 406 finished with value: 2.0 and parameters: {'x_0_0': 'cd', 'x_0_1': 'ac', 'x_0_2': 'bd', 'x_1_0': 'bc', 'x_1_1': 'cd', 'x_1_2': 'ad'}. Best is trial 384 with value: 0.6222222222222222.
[I 2024-10-13 11:29:27,640] Trial 407 finished with value: 2.0 and parameters: {'x_0_0': 'cd', 'x_0_1': 'cd', 'x_0_2': 'bd', 'x_1_0': 'cd', 'x_1_1': 'bd', 'x_1_2': 'bd'}. Best is trial 384 with value: 0.6222222222222222.
[I 2024-10-13 11:29:27,662] Trial 408 finished with value: 1.6777777777777778 and parameters: {'x_0_0': 'ab', 'x_0_1': 'bd', 'x_0_2': 'ab', 'x_1_0': 'bc', 'x_1_1': 'oo', 'x_1_2': 'ab'}. Best is trial 384 with value: 0.6222222222222222.
[I 2024-10-13 11:29:27,714] Trial 409 finished with value: 1.4666666666666666 and parameters: {'x_0_0': 'ad', 'x_0_1': 'ad', 'x_0_2': 'bc', 'x_1_0': 'oo', 'x_1_1': 'ad', 'x_1_2': 'ab'}. Best is trial 384 with value: 0.6222222222222222.
[I 2024-10-13 11:29:27,735] Trial 410 finished with value: 1.4666666666666666 and parameters: {'x_0_0': 'bc', 'x_0_1': 'cd', 'x_0_2': 'oo', 'x_1_0': 'ad', 'x_1_1': 'oo', 'x_1_2': 'bc'}. Best is trial 384 with value: 0.6222222222222222.
[I 2024-10-13 11:29:27,754] Trial 411 finished with value: 1.7999999999999998 and parameters: {'x_0_0': 'oo', 'x_0_1': 'ab', 'x_0_2': 'ac', 'x_1_0': 'ab', 'x_1_1': 'bd', 'x_1_2': 'oo'}. Best is trial 384 with value: 0.6222222222222222.
[I 2024-10-13 11:29:27,775] Trial 412 finished with value: 1.4444444444444444 and parameters: {'x_0_0': 'bc', 'x_0_1': 'ad', 'x_0_2': 'bd', 'x_1_0': 'bc', 'x_1_1': 'ac', 'x_1_2': 'cd'}. Best is trial 384 with value: 0.6222222222222222.
[I 2024-10-13 11:29:27,794] Trial 413 finished with value: 1.6666666666666665 and parameters: {'x_0_0': 'bd', 'x_0_1': 'ad', 'x_0_2': 'bd', 'x_1_0': 'ad', 'x_1_1': 'ab', 'x_1_2': 'bd'}. Best is trial 384 with value: 0.6222222222222222.
[I 2024-10-13 11:29:27,814] Trial 414 finished with value: 1.9 and parameters: {'x_0_0': 'oo', 'x_0_1': 'cd', 'x_0_2': 'ab', 'x_1_0': 'ab', 'x_1_1': 'ab', 'x_1_2': 'ab'}. Best is trial 384 with value: 0.6222222222222222.
[I 2024-10-13 11:29:27,834] Trial 415 finished with value: 1.7777777777777777 and parameters: {'x_0_0': 'ab', 'x_0_1': 'ad', 'x_0_2': 'ad', 'x_1_0': 'bc', 'x_1_1': 'bc', 'x_1_2': 'ab'}. Best is trial 384 with value: 0.6222222222222222.
[I 2024-10-13 11:29:27,854] Trial 416 finished with value: 1.3444444444444446 and parameters: {'x_0_0': 'ac', 'x_0_1': 'ad', 'x_0_2': 'bd', 'x_1_0': 'cd', 'x_1_1': 'oo', 'x_1_2': 'ad'}. Best is trial 384 with value: 0.6222222222222222.
[I 2024-10-13 11:29:27,873] Trial 417 finished with value: 1.9 and parameters: {'x_0_0': 'oo', 'x_0_1': 'cd', 'x_0_2': 'bd', 'x_1_0': 'bd', 'x_1_1': 'cd', 'x_1_2': 'bd'}. Best is trial 384 with value: 0.6222222222222222.
[I 2024-10-13 11:29:27,892] Trial 418 finished with value: 1.6 and parameters: {'x_0_0': 'cd', 'x_0_1': 'cd', 'x_0_2': 'oo', 'x_1_0': 'oo', 'x_1_1': 'ac', 'x_1_2': 'oo'}. Best is trial 384 with value: 0.6222222222222222.
[I 2024-10-13 11:29:27,911] Trial 419 finished with value: 1.4666666666666666 and parameters: {'x_0_0': 'bd', 'x_0_1': 'cd', 'x_0_2': 'ad', 'x_1_0': 'oo', 'x_1_1': 'ad', 'x_1_2': 'ab'}. Best is trial 384 with value: 0.6222222222222222.
[I 2024-10-13 11:29:27,930] Trial 420 finished with value: 2.0 and parameters: {'x_0_0': 'cd', 'x_0_1': 'cd', 'x_0_2': 'ab', 'x_1_0': 'cd', 'x_1_1': 'bc', 'x_1_2': 'ab'}. Best is trial 384 with value: 0.6222222222222222.
[I 2024-10-13 11:29:27,949] Trial 421 finished with value: 1.6666666666666665 and parameters: {'x_0_0': 'bd', 'x_0_1': 'ab', 'x_0_2': 'cd', 'x_1_0': 'cd', 'x_1_1': 'ab', 'x_1_2': 'ab'}. Best is trial 384 with value: 0.6222222222222222.
[I 2024-10-13 11:29:27,969] Trial 422 finished with value: 1.9 and parameters: {'x_0_0': 'oo', 'x_0_1': 'ac', 'x_0_2': 'ab', 'x_1_0': 'ab', 'x_1_1': 'ad', 'x_1_2': 'bd'}. Best is trial 384 with value: 0.6222222222222222.
[I 2024-10-13 11:29:27,987] Trial 423 finished with value: 1.6666666666666665 and parameters: {'x_0_0': 'ad', 'x_0_1': 'cd', 'x_0_2': 'ab', 'x_1_0': 'cd', 'x_1_1': 'bd', 'x_1_2': 'ab'}. Best is trial 384 with value: 0.6222222222222222.
[I 2024-10-13 11:29:28,006] Trial 424 finished with value: 1.4555555555555557 and parameters: {'x_0_0': 'bd', 'x_0_1': 'bd', 'x_0_2': 'cd', 'x_1_0': 'ab', 'x_1_1': 'cd', 'x_1_2': 'oo'}. Best is trial 384 with value: 0.6222222222222222.
[I 2024-10-13 11:29:28,026] Trial 425 finished with value: 2.0 and parameters: {'x_0_0': 'cd', 'x_0_1': 'bd', 'x_0_2': 'ab', 'x_1_0': 'bc', 'x_1_1': 'ac', 'x_1_2': 'bc'}. Best is trial 384 with value: 0.6222222222222222.
[I 2024-10-13 11:29:28,045] Trial 426 finished with value: 2.0 and parameters: {'x_0_0': 'cd', 'x_0_1': 'ad', 'x_0_2': 'cd', 'x_1_0': 'bc', 'x_1_1': 'bc', 'x_1_2': 'bc'}. Best is trial 384 with value: 0.6222222222222222.
[I 2024-10-13 11:29:28,064] Trial 427 finished with value: 1.5666666666666667 and parameters: {'x_0_0': 'bc', 'x_0_1': 'bc', 'x_0_2': 'bd', 'x_1_0': 'cd', 'x_1_1': 'ab', 'x_1_2': 'oo'}. Best is trial 384 with value: 0.6222222222222222.
[I 2024-10-13 11:29:28,086] Trial 428 finished with value: 1.7777777777777777 and parameters: {'x_0_0': 'ab', 'x_0_1': 'cd', 'x_0_2': 'bc', 'x_1_0': 'ac', 'x_1_1': 'bc', 'x_1_2': 'cd'}. Best is trial 384 with value: 0.6222222222222222.
[I 2024-10-13 11:29:28,107] Trial 429 finished with value: 1.5555555555555556 and parameters: {'x_0_0': 'ad', 'x_0_1': 'ad', 'x_0_2': 'ab', 'x_1_0': 'ab', 'x_1_1': 'ad', 'x_1_2': 'bc'}. Best is trial 384 with value: 0.6222222222222222.
[I 2024-10-13 11:29:28,128] Trial 430 finished with value: 1.6666666666666665 and parameters: {'x_0_0': 'ac', 'x_0_1': 'bd', 'x_0_2': 'bc', 'x_1_0': 'cd', 'x_1_1': 'bc', 'x_1_2': 'cd'}. Best is trial 384 with value: 0.6222222222222222.
[I 2024-10-13 11:29:28,148] Trial 431 finished with value: 1.6666666666666665 and parameters: {'x_0_0': 'bd', 'x_0_1': 'ab', 'x_0_2': 'ab', 'x_1_0': 'cd', 'x_1_1': 'ad', 'x_1_2': 'ac'}. Best is trial 384 with value: 0.6222222222222222.
[I 2024-10-13 11:29:28,171] Trial 432 finished with value: 1.5666666666666667 and parameters: {'x_0_0': 'ad', 'x_0_1': 'bc', 'x_0_2': 'bc', 'x_1_0': 'ad', 'x_1_1': 'oo', 'x_1_2': 'ad'}. Best is trial 384 with value: 0.6222222222222222.
[I 2024-10-13 11:29:28,191] Trial 433 finished with value: 1.5666666666666664 and parameters: {'x_0_0': 'bd', 'x_0_1': 'ab', 'x_0_2': 'oo', 'x_1_0': 'ad', 'x_1_1': 'bd', 'x_1_2': 'cd'}. Best is trial 384 with value: 0.6222222222222222.
[I 2024-10-13 11:29:28,213] Trial 434 finished with value: 1.7777777777777777 and parameters: {'x_0_0': 'ab', 'x_0_1': 'ac', 'x_0_2': 'ac', 'x_1_0': 'ad', 'x_1_1': 'bc', 'x_1_2': 'bd'}. Best is trial 384 with value: 0.6222222222222222.
[I 2024-10-13 11:29:28,241] Trial 435 finished with value: 1.8 and parameters: {'x_0_0': 'oo', 'x_0_1': 'ac', 'x_0_2': 'oo', 'x_1_0': 'ac', 'x_1_1': 'ad', 'x_1_2': 'bd'}. Best is trial 384 with value: 0.6222222222222222.
[I 2024-10-13 11:29:28,261] Trial 436 finished with value: 1.7777777777777777 and parameters: {'x_0_0': 'ab', 'x_0_1': 'ab', 'x_0_2': 'cd', 'x_1_0': 'bd', 'x_1_1': 'bd', 'x_1_2': 'bc'}. Best is trial 384 with value: 0.6222222222222222.
[I 2024-10-13 11:29:28,282] Trial 437 finished with value: 1.5 and parameters: {'x_0_0': 'oo', 'x_0_1': 'oo', 'x_0_2': 'bd', 'x_1_0': 'bc', 'x_1_1': 'ac', 'x_1_2': 'cd'}. Best is trial 384 with value: 0.6222222222222222.
[I 2024-10-13 11:29:28,301] Trial 438 finished with value: 1.5666666666666667 and parameters: {'x_0_0': 'ad', 'x_0_1': 'cd', 'x_0_2': 'bc', 'x_1_0': 'cd', 'x_1_1': 'ab', 'x_1_2': 'oo'}. Best is trial 384 with value: 0.6222222222222222.
[I 2024-10-13 11:29:28,321] Trial 439 finished with value: 1.5 and parameters: {'x_0_0': 'cd', 'x_0_1': 'oo', 'x_0_2': 'cd', 'x_1_0': 'ad', 'x_1_1': 'ac', 'x_1_2': 'oo'}. Best is trial 384 with value: 0.6222222222222222.
[I 2024-10-13 11:29:28,341] Trial 440 finished with value: 1.6666666666666665 and parameters: {'x_0_0': 'ac', 'x_0_1': 'bc', 'x_0_2': 'ad', 'x_1_0': 'bd', 'x_1_1': 'ac', 'x_1_2': 'cd'}. Best is trial 384 with value: 0.6222222222222222.
[I 2024-10-13 11:29:28,360] Trial 441 finished with value: 1.5666666666666664 and parameters: {'x_0_0': 'bd', 'x_0_1': 'ad', 'x_0_2': 'oo', 'x_1_0': 'ad', 'x_1_1': 'bc', 'x_1_2': 'ac'}. Best is trial 384 with value: 0.6222222222222222.
[I 2024-10-13 11:29:28,380] Trial 442 finished with value: 1.7777777777777777 and parameters: {'x_0_0': 'ab', 'x_0_1': 'ad', 'x_0_2': 'ac', 'x_1_0': 'bc', 'x_1_1': 'bd', 'x_1_2': 'ac'}. Best is trial 384 with value: 0.6222222222222222.
[I 2024-10-13 11:29:28,399] Trial 443 finished with value: 1.2666666666666666 and parameters: {'x_0_0': 'ac', 'x_0_1': 'oo', 'x_0_2': 'bd', 'x_1_0': 'ab', 'x_1_1': 'bc', 'x_1_2': 'ac'}. Best is trial 384 with value: 0.6222222222222222.
[I 2024-10-13 11:29:28,418] Trial 444 finished with value: 1.3666666666666667 and parameters: {'x_0_0': 'ac', 'x_0_1': 'cd', 'x_0_2': 'ad', 'x_1_0': 'oo', 'x_1_1': 'bc', 'x_1_2': 'oo'}. Best is trial 384 with value: 0.6222222222222222.
[I 2024-10-13 11:29:28,437] Trial 445 finished with value: 1.6777777777777776 and parameters: {'x_0_0': 'ab', 'x_0_1': 'ac', 'x_0_2': 'oo', 'x_1_0': 'ad', 'x_1_1': 'ab', 'x_1_2': 'cd'}. Best is trial 384 with value: 0.6222222222222222.
[I 2024-10-13 11:29:28,457] Trial 446 finished with value: 1.0444444444444443 and parameters: {'x_0_0': 'bd', 'x_0_1': 'oo', 'x_0_2': 'ac', 'x_1_0': 'bc', 'x_1_1': 'cd', 'x_1_2': 'cd'}. Best is trial 384 with value: 0.6222222222222222.
[I 2024-10-13 11:29:28,476] Trial 447 finished with value: 2.0 and parameters: {'x_0_0': 'cd', 'x_0_1': 'ad', 'x_0_2': 'cd', 'x_1_0': 'bc', 'x_1_1': 'bc', 'x_1_2': 'ad'}. Best is trial 384 with value: 0.6222222222222222.
[I 2024-10-13 11:29:28,500] Trial 448 finished with value: 1.3555555555555556 and parameters: {'x_0_0': 'ad', 'x_0_1': 'cd', 'x_0_2': 'oo', 'x_1_0': 'ab', 'x_1_1': 'oo', 'x_1_2': 'ac'}. Best is trial 384 with value: 0.6222222222222222.
[I 2024-10-13 11:29:28,521] Trial 449 finished with value: 1.7999999999999998 and parameters: {'x_0_0': 'cd', 'x_0_1': 'ab', 'x_0_2': 'ad', 'x_1_0': 'oo', 'x_1_1': 'ad', 'x_1_2': 'bd'}. Best is trial 384 with value: 0.6222222222222222.
[I 2024-10-13 11:29:28,543] Trial 450 finished with value: 1.7999999999999998 and parameters: {'x_0_0': 'cd', 'x_0_1': 'bc', 'x_0_2': 'oo', 'x_1_0': 'bd', 'x_1_1': 'ad', 'x_1_2': 'oo'}. Best is trial 384 with value: 0.6222222222222222.
[I 2024-10-13 11:29:28,564] Trial 451 finished with value: 1.6666666666666665 and parameters: {'x_0_0': 'ad', 'x_0_1': 'ab', 'x_0_2': 'cd', 'x_1_0': 'ac', 'x_1_1': 'cd', 'x_1_2': 'ad'}. Best is trial 384 with value: 0.6222222222222222.
[I 2024-10-13 11:29:28,585] Trial 452 finished with value: 1.6777777777777778 and parameters: {'x_0_0': 'ab', 'x_0_1': 'cd', 'x_0_2': 'bc', 'x_1_0': 'bc', 'x_1_1': 'bd', 'x_1_2': 'oo'}. Best is trial 384 with value: 0.6222222222222222.
[I 2024-10-13 11:29:28,607] Trial 453 finished with value: 1.0666666666666667 and parameters: {'x_0_0': 'bd', 'x_0_1': 'oo', 'x_0_2': 'cd', 'x_1_0': 'oo', 'x_1_1': 'bd', 'x_1_2': 'bc'}. Best is trial 384 with value: 0.6222222222222222.
[I 2024-10-13 11:29:28,628] Trial 454 finished with value: 2.0 and parameters: {'x_0_0': 'cd', 'x_0_1': 'ac', 'x_0_2': 'bd', 'x_1_0': 'ad', 'x_1_1': 'ac', 'x_1_2': 'ac'}. Best is trial 384 with value: 0.6222222222222222.
[I 2024-10-13 11:29:28,650] Trial 455 finished with value: 1.6777777777777776 and parameters: {'x_0_0': 'ab', 'x_0_1': 'ad', 'x_0_2': 'oo', 'x_1_0': 'ab', 'x_1_1': 'ab', 'x_1_2': 'ac'}. Best is trial 384 with value: 0.6222222222222222.
[I 2024-10-13 11:29:28,672] Trial 456 finished with value: 1.6666666666666665 and parameters: {'x_0_0': 'ac', 'x_0_1': 'bc', 'x_0_2': 'ac', 'x_1_0': 'ac', 'x_1_1': 'ac', 'x_1_2': 'bc'}. Best is trial 384 with value: 0.6222222222222222.
[I 2024-10-13 11:29:28,691] Trial 457 finished with value: 1.9 and parameters: {'x_0_0': 'oo', 'x_0_1': 'bd', 'x_0_2': 'ac', 'x_1_0': 'cd', 'x_1_1': 'ad', 'x_1_2': 'bd'}. Best is trial 384 with value: 0.6222222222222222.
[I 2024-10-13 11:29:28,712] Trial 458 finished with value: 1.5666666666666664 and parameters: {'x_0_0': 'ad', 'x_0_1': 'cd', 'x_0_2': 'oo', 'x_1_0': 'cd', 'x_1_1': 'bc', 'x_1_2': 'bc'}. Best is trial 384 with value: 0.6222222222222222.
[I 2024-10-13 11:29:28,731] Trial 459 finished with value: 1.6666666666666665 and parameters: {'x_0_0': 'bd', 'x_0_1': 'ad', 'x_0_2': 'cd', 'x_1_0': 'ad', 'x_1_1': 'bc', 'x_1_2': 'ac'}. Best is trial 384 with value: 0.6222222222222222.
[I 2024-10-13 11:29:28,751] Trial 460 finished with value: 1.6666666666666665 and parameters: {'x_0_0': 'ad', 'x_0_1': 'cd', 'x_0_2': 'ab', 'x_1_0': 'ac', 'x_1_1': 'ad', 'x_1_2': 'ad'}. Best is trial 384 with value: 0.6222222222222222.
[I 2024-10-13 11:29:28,771] Trial 461 finished with value: 1.9 and parameters: {'x_0_0': 'oo', 'x_0_1': 'ab', 'x_0_2': 'ad', 'x_1_0': 'bc', 'x_1_1': 'ac', 'x_1_2': 'bd'}. Best is trial 384 with value: 0.6222222222222222.
[I 2024-10-13 11:29:28,793] Trial 462 finished with value: 1.1666666666666665 and parameters: {'x_0_0': 'bc', 'x_0_1': 'oo', 'x_0_2': 'bd', 'x_1_0': 'bc', 'x_1_1': 'oo', 'x_1_2': 'ad'}. Best is trial 384 with value: 0.6222222222222222.
[I 2024-10-13 11:29:28,815] Trial 463 finished with value: 1.6666666666666665 and parameters: {'x_0_0': 'bd', 'x_0_1': 'bd', 'x_0_2': 'ad', 'x_1_0': 'ac', 'x_1_1': 'cd', 'x_1_2': 'bd'}. Best is trial 384 with value: 0.6222222222222222.
[I 2024-10-13 11:29:28,837] Trial 464 finished with value: 1.6666666666666665 and parameters: {'x_0_0': 'bd', 'x_0_1': 'ad', 'x_0_2': 'ab', 'x_1_0': 'cd', 'x_1_1': 'cd', 'x_1_2': 'bd'}. Best is trial 384 with value: 0.6222222222222222.
[I 2024-10-13 11:29:28,858] Trial 465 finished with value: 1.4555555555555555 and parameters: {'x_0_0': 'bd', 'x_0_1': 'ac', 'x_0_2': 'oo', 'x_1_0': 'ab', 'x_1_1': 'bc', 'x_1_2': 'cd'}. Best is trial 384 with value: 0.6222222222222222.
[I 2024-10-13 11:29:28,878] Trial 466 finished with value: 1.3444444444444446 and parameters: {'x_0_0': 'ac', 'x_0_1': 'ad', 'x_0_2': 'ab', 'x_1_0': 'bc', 'x_1_1': 'oo', 'x_1_2': 'ad'}. Best is trial 384 with value: 0.6222222222222222.
[I 2024-10-13 11:29:28,897] Trial 467 finished with value: 1.9 and parameters: {'x_0_0': 'oo', 'x_0_1': 'ad', 'x_0_2': 'ab', 'x_1_0': 'ab', 'x_1_1': 'bd', 'x_1_2': 'ac'}. Best is trial 384 with value: 0.6222222222222222.
[I 2024-10-13 11:29:28,918] Trial 468 finished with value: 1.6666666666666665 and parameters: {'x_0_0': 'ac', 'x_0_1': 'bd', 'x_0_2': 'ad', 'x_1_0': 'ac', 'x_1_1': 'bd', 'x_1_2': 'bc'}. Best is trial 384 with value: 0.6222222222222222.
[I 2024-10-13 11:29:28,941] Trial 469 finished with value: 1.6 and parameters: {'x_0_0': 'oo', 'x_0_1': 'ab', 'x_0_2': 'bc', 'x_1_0': 'oo', 'x_1_1': 'oo', 'x_1_2': 'bc'}. Best is trial 384 with value: 0.6222222222222222.
[I 2024-10-13 11:29:28,961] Trial 470 finished with value: 1.2666666666666666 and parameters: {'x_0_0': 'ac', 'x_0_1': 'cd', 'x_0_2': 'oo', 'x_1_0': 'oo', 'x_1_1': 'ab', 'x_1_2': 'oo'}. Best is trial 384 with value: 0.6222222222222222.
[I 2024-10-13 11:29:28,983] Trial 471 finished with value: 1.5666666666666667 and parameters: {'x_0_0': 'bc', 'x_0_1': 'bc', 'x_0_2': 'cd', 'x_1_0': 'ad', 'x_1_1': 'bc', 'x_1_2': 'oo'}. Best is trial 384 with value: 0.6222222222222222.
