[I 2024-10-13 11:29:37,978] Trial 287 finished with value: 1.4666666666666666 and parameters: {'x_0_0': 'ac', 'x_0_1': 'bd', 'x_0_2': 'ac', 'x_1_0': 'oo', 'x_1_1': 'bc', 'x_1_2': 'ab'}. Best is trial 209 with value: 0.9444444444444444.
[I 2024-10-13 11:29:37,997] Trial 288 finished with value: 1.2222222222222223 and parameters: {'x_0_0': 'ac', 'x_0_1': 'ac', 'x_0_2': 'ac', 'x_1_0': 'bc', 'x_1_1': 'ad', 'x_1_2': 'ab'}. Best is trial 209 with value: 0.9444444444444444.
[I 2024-10-13 11:29:38,016] Trial 289 finished with value: 1.5666666666666664 and parameters: {'x_0_0': 'bd', 'x_0_1': 'ac', 'x_0_2': 'oo', 'x_1_0': 'ac', 'x_1_1': 'ab', 'x_1_2': 'ab'}. Best is trial 209 with value: 0.9444444444444444.
[I 2024-10-13 11:29:38,036] Trial 290 finished with value: 1.5555555555555556 and parameters: {'x_0_0': 'bd', 'x_0_1': 'ad', 'x_0_2': 'bd', 'x_1_0': 'ab', 'x_1_1': 'ac', 'x_1_2': 'bd'}. Best is trial 209 with value: 0.9444444444444444.
[I 2024-10-13 11:29:38,056] Trial 291 finished with value: 1.9 and parameters: {'x_0_0': 'oo', 'x_0_1': 'bc', 'x_0_2': 'ab', 'x_1_0': 'ad', 'x_1_1': 'ad', 'x_1_2': 'bc'}. Best is trial 209 with value: 0.9444444444444444.
[I 2024-10-13 11:29:38,075] Trial 292 finished with value: 1.3333333333333333 and parameters: {'x_0_0': 'ac', 'x_0_1': 'ad', 'x_0_2': 'ad', 'x_1_0': 'ac', 'x_1_1': 'ab', 'x_1_2': 'bc'}. Best is trial 209 with value: 0.9444444444444444.
[I 2024-10-13 11:29:38,094] Trial 293 finished with value: 1.5666666666666667 and parameters: {'x_0_0': 'ac', 'x_0_1': 'bc', 'x_0_2': 'ab', 'x_1_0': 'ab', 'x_1_1': 'oo', 'x_1_2': 'ab'}. Best is trial 209 with value: 0.9444444444444444.
[I 2024-10-13 11:29:38,114] Trial 294 finished with value: 1.6666666666666665 and parameters: {'x_0_0': 'ac', 'x_0_1': 'cd', 'x_0_2': 'cd', 'x_1_0': 'bc', 'x_1_1': 'ac', 'x_1_2': 'ac'}. Best is trial 209 with value: 0.9444444444444444.
[I 2024-10-13 11:29:38,133] Trial 295 finished with value: 1.7777777777777777 and parameters: {'x_0_0': 'ab', 'x_0_1': 'ad', 'x_0_2': 'ab', 'x_1_0': 'cd', 'x_1_1': 'ad', 'x_1_2': 'ad'}. Best is trial 209 with value: 0.9444444444444444.
[I 2024-10-13 11:29:38,152] Trial 296 finished with value: 1.7777777777777777 and parameters: {'x_0_0': 'ab', 'x_0_1': 'ab', 'x_0_2': 'ab', 'x_1_0': 'bd', 'x_1_1': 'bc', 'x_1_2': 'cd'}. Best is trial 209 with value: 0.9444444444444444.
[I 2024-10-13 11:29:38,171] Trial 297 finished with value: 1.6 and parameters: {'x_0_0': 'cd', 'x_0_1': 'oo', 'x_0_2': 'ac', 'x_1_0': 'ab', 'x_1_1': 'bc', 'x_1_2': 'bd'}. Best is trial 209 with value: 0.9444444444444444.
[I 2024-10-13 11:29:38,190] Trial 298 finished with value: 1.6777777777777776 and parameters: {'x_0_0': 'ab', 'x_0_1': 'cd', 'x_0_2': 'oo', 'x_1_0': 'bd', 'x_1_1': 'bd', 'x_1_2': 'bd'}. Best is trial 209 with value: 0.9444444444444444.
[I 2024-10-13 11:29:38,209] Trial 299 finished with value: 1.0666666666666667 and parameters: {'x_0_0': 'bc', 'x_0_1': 'oo', 'x_0_2': 'oo', 'x_1_0': 'ab', 'x_1_1': 'ab', 'x_1_2': 'oo'}. Best is trial 209 with value: 0.9444444444444444.
[I 2024-10-13 11:29:38,227] Trial 300 finished with value: 1.7777777777777777 and parameters: {'x_0_0': 'ab', 'x_0_1': 'ab', 'x_0_2': 'bc', 'x_1_0': 'bd', 'x_1_1': 'bd', 'x_1_2': 'cd'}. Best is trial 209 with value: 0.9444444444444444.
[I 2024-10-13 11:29:38,246] Trial 301 finished with value: 1.6777777777777776 and parameters: {'x_0_0': 'ab', 'x_0_1': 'ad', 'x_0_2': 'oo', 'x_1_0': 'cd', 'x_1_1': 'ab', 'x_1_2': 'ac'}. Best is trial 209 with value: 0.9444444444444444.
[I 2024-10-13 11:29:38,266] Trial 302 finished with value: 1.3555555555555556 and parameters: {'x_0_0': 'ad', 'x_0_1': 'ad', 'x_0_2': 'oo', 'x_1_0': 'ab', 'x_1_1': 'oo', 'x_1_2': 'bc'}. Best is trial 209 with value: 0.9444444444444444.
[I 2024-10-13 11:29:38,285] Trial 303 finished with value: 1.2666666666666666 and parameters: {'x_0_0': 'ad', 'x_0_1': 'oo', 'x_0_2': 'ac', 'x_1_0': 'ad', 'x_1_1': 'bd', 'x_1_2': 'bc'}. Best is trial 209 with value: 0.9444444444444444.
[I 2024-10-13 11:29:38,304] Trial 304 finished with value: 1.7999999999999998 and parameters: {'x_0_0': 'cd', 'x_0_1': 'ab', 'x_0_2': 'ac', 'x_1_0': 'oo', 'x_1_1': 'bd', 'x_1_2': 'bd'}. Best is trial 209 with value: 0.9444444444444444.
[I 2024-10-13 11:29:38,324] Trial 305 finished with value: 1.9 and parameters: {'x_0_0': 'oo', 'x_0_1': 'bc', 'x_0_2': 'ad', 'x_1_0': 'ad', 'x_1_1': 'cd', 'x_1_2': 'ac'}. Best is trial 209 with value: 0.9444444444444444.
[I 2024-10-13 11:29:38,342] Trial 306 finished with value: 1.6666666666666665 and parameters: {'x_0_0': 'ad', 'x_0_1': 'ab', 'x_0_2': 'ad', 'x_1_0': 'ac', 'x_1_1': 'bd', 'x_1_2': 'ab'}. Best is trial 209 with value: 0.9444444444444444.
[I 2024-10-13 11:29:38,361] Trial 307 finished with value: 1.3666666666666667 and parameters: {'x_0_0': 'ad', 'x_0_1': 'ab', 'x_0_2': 'ab', 'x_1_0': 'oo', 'x_1_1': 'oo', 'x_1_2': 'cd'}. Best is trial 209 with value: 0.9444444444444444.
[I 2024-10-13 11:29:38,380] Trial 308 finished with value: 1.6666666666666665 and parameters: {'x_0_0': 'bc', 'x_0_1': 'bc', 'x_0_2': 'bd', 'x_1_0': 'bd', 'x_1_1': 'ad', 'x_1_2': 'ad'}. Best is trial 209 with value: 0.9444444444444444.
[I 2024-10-13 11:29:38,399] Trial 309 finished with value: 1.0333333333333332 and parameters: {'x_0_0': 'ac', 'x_0_1': 'ad', 'x_0_2': 'ab', 'x_1_0': 'oo', 'x_1_1': 'ab', 'x_1_2': 'oo'}. Best is trial 209 with value: 0.9444444444444444.
[I 2024-10-13 11:29:38,417] Trial 310 finished with value: 1.9 and parameters: {'x_0_0': 'oo', 'x_0_1': 'cd', 'x_0_2': 'bd', 'x_1_0': 'ab', 'x_1_1': 'ac', 'x_1_2': 'bd'}. Best is trial 209 with value: 0.9444444444444444.
[I 2024-10-13 11:29:38,436] Trial 311 finished with value: 1.3666666666666667 and parameters: {'x_0_0': 'bd', 'x_0_1': 'cd', 'x_0_2': 'ad', 'x_1_0': 'oo', 'x_1_1': 'bd', 'x_1_2': 'oo'}. Best is trial 209 with value: 0.9444444444444444.
[I 2024-10-13 11:29:38,470] Trial 312 finished with value: 1.1444444444444444 and parameters: {'x_0_0': 'bc', 'x_0_1': 'ac', 'x_0_2': 'oo', 'x_1_0': 'oo', 'x_1_1': 'ac', 'x_1_2': 'ab'}. Best is trial 209 with value: 0.9444444444444444.
[I 2024-10-13 11:29:38,489] Trial 313 finished with value: 1.2444444444444445 and parameters: {'x_0_0': 'ac', 'x_0_1': 'ac', 'x_0_2': 'bc', 'x_1_0': 'oo', 'x_1_1': 'ad', 'x_1_2': 'cd'}. Best is trial 209 with value: 0.9444444444444444.
[I 2024-10-13 11:29:38,508] Trial 314 finished with value: 1.4666666666666666 and parameters: {'x_0_0': 'bc', 'x_0_1': 'cd', 'x_0_2': 'oo', 'x_1_0': 'ab', 'x_1_1': 'oo', 'x_1_2': 'ad'}. Best is trial 209 with value: 0.9444444444444444.
[I 2024-10-13 11:29:38,527] Trial 315 finished with value: 1.5666666666666667 and parameters: {'x_0_0': 'ac', 'x_0_1': 'cd', 'x_0_2': 'ab', 'x_1_0': 'bd', 'x_1_1': 'oo', 'x_1_2': 'ab'}. Best is trial 209 with value: 0.9444444444444444.
[I 2024-10-13 11:29:38,547] Trial 316 finished with value: 1.1111111111111112 and parameters: {'x_0_0': 'ad', 'x_0_1': 'ad', 'x_0_2': 'cd', 'x_1_0': 'bc', 'x_1_1': 'ac', 'x_1_2': 'ab'}. Best is trial 209 with value: 0.9444444444444444.
[I 2024-10-13 11:29:38,567] Trial 317 finished with value: 1.7 and parameters: {'x_0_0': 'cd', 'x_0_1': 'bc', 'x_0_2': 'bd', 'x_1_0': 'oo', 'x_1_1': 'ac', 'x_1_2': 'oo'}. Best is trial 209 with value: 0.9444444444444444.
[I 2024-10-13 11:29:38,587] Trial 318 finished with value: 1.7777777777777777 and parameters: {'x_0_0': 'ab', 'x_0_1': 'bc', 'x_0_2': 'ab', 'x_1_0': 'ac', 'x_1_1': 'bd', 'x_1_2': 'bc'}. Best is trial 209 with value: 0.9444444444444444.
[I 2024-10-13 11:29:38,606] Trial 319 finished with value: 1.7999999999999998 and parameters: {'x_0_0': 'oo', 'x_0_1': 'bd', 'x_0_2': 'ad', 'x_1_0': 'ad', 'x_1_1': 'cd', 'x_1_2': 'oo'}. Best is trial 209 with value: 0.9444444444444444.
[I 2024-10-13 11:29:38,625] Trial 320 finished with value: 1.4444444444444444 and parameters: {'x_0_0': 'ac', 'x_0_1': 'ac', 'x_0_2': 'cd', 'x_1_0': 'ac', 'x_1_1': 'bc', 'x_1_2': 'cd'}. Best is trial 209 with value: 0.9444444444444444.
[I 2024-10-13 11:29:38,644] Trial 321 finished with value: 1.9 and parameters: {'x_0_0': 'oo', 'x_0_1': 'ac', 'x_0_2': 'ad', 'x_1_0': 'cd', 'x_1_1': 'cd', 'x_1_2': 'ab'}. Best is trial 209 with value: 0.9444444444444444.
[I 2024-10-13 11:29:38,664] Trial 322 finished with value: 1.7777777777777777 and parameters: {'x_0_0': 'ab', 'x_0_1': 'bd', 'x_0_2': 'bc', 'x_1_0': 'bd', 'x_1_1': 'bd', 'x_1_2': 'cd'}. Best is trial 209 with value: 0.9444444444444444.
[I 2024-10-13 11:29:38,684] Trial 323 finished with value: 1.6666666666666665 and parameters: {'x_0_0': 'bc', 'x_0_1': 'bc', 'x_0_2': 'cd', 'x_1_0': 'ab', 'x_1_1': 'cd', 'x_1_2': 'bd'}. Best is trial 209 with value: 0.9444444444444444.
[I 2024-10-13 11:29:38,704] Trial 324 finished with value: 1.6777777777777778 and parameters: {'x_0_0': 'ab', 'x_0_1': 'cd', 'x_0_2': 'ab', 'x_1_0': 'ab', 'x_1_1': 'oo', 'x_1_2': 'bc'}. Best is trial 209 with value: 0.9444444444444444.
[I 2024-10-13 11:29:38,724] Trial 325 finished with value: 1.6666666666666665 and parameters: {'x_0_0': 'bd', 'x_0_1': 'cd', 'x_0_2': 'ac', 'x_1_0': 'ac', 'x_1_1': 'bc', 'x_1_2': 'bc'}. Best is trial 209 with value: 0.9444444444444444.
[I 2024-10-13 11:29:38,744] Trial 326 finished with value: 1.2444444444444445 and parameters: {'x_0_0': 'bd', 'x_0_1': 'cd', 'x_0_2': 'oo', 'x_1_0': 'bc', 'x_1_1': 'oo', 'x_1_2': 'bc'}. Best is trial 209 with value: 0.9444444444444444.
[I 2024-10-13 11:29:38,764] Trial 327 finished with value: 2.0 and parameters: {'x_0_0': 'cd', 'x_0_1': 'ab', 'x_0_2': 'cd', 'x_1_0': 'bd', 'x_1_1': 'ab', 'x_1_2': 'ac'}. Best is trial 209 with value: 0.9444444444444444.
[I 2024-10-13 11:29:38,782] Trial 328 finished with value: 1.6666666666666665 and parameters: {'x_0_0': 'ac', 'x_0_1': 'cd', 'x_0_2': 'bc', 'x_1_0': 'cd', 'x_1_1': 'ab', 'x_1_2': 'ad'}. Best is trial 209 with value: 0.9444444444444444.
[I 2024-10-13 11:29:38,803] Trial 329 finished with value: 1.5555555555555556 and parameters: {'x_0_0': 'ac', 'x_0_1': 'ab', 'x_0_2': 'bc', 'x_1_0': 'bd', 'x_1_1': 'bd', 'x_1_2': 'ac'}. Best is trial 209 with value: 0.9444444444444444.
[I 2024-10-13 11:29:38,824] Trial 330 finished with value: 1.6666666666666665 and parameters: {'x_0_0': 'ac', 'x_0_1': 'bc', 'x_0_2': 'cd', 'x_1_0': 'bc', 'x_1_1': 'ab', 'x_1_2': 'ad'}. Best is trial 209 with value: 0.9444444444444444.
[I 2024-10-13 11:29:38,844] Trial 331 finished with value: 1.4666666666666666 and parameters: {'x_0_0': 'bc', 'x_0_1': 'bd', 'x_0_2': 'cd', 'x_1_0': 'oo', 'x_1_1': 'ab', 'x_1_2': 'cd'}. Best is trial 209 with value: 0.9444444444444444.
[I 2024-10-13 11:29:38,863] Trial 332 finished with value: 1.4666666666666666 and parameters: {'x_0_0': 'bc', 'x_0_1': 'bd', 'x_0_2': 'ab', 'x_1_0': 'oo', 'x_1_1': 'bd', 'x_1_2': 'bc'}. Best is trial 209 with value: 0.9444444444444444.
[I 2024-10-13 11:29:38,883] Trial 333 finished with value: 1.6666666666666665 and parameters: {'x_0_0': 'ac', 'x_0_1': 'bd', 'x_0_2': 'ab', 'x_1_0': 'bc', 'x_1_1': 'ab', 'x_1_2': 'bc'}. Best is trial 209 with value: 0.9444444444444444.
[I 2024-10-13 11:29:38,902] Trial 334 finished with value: 1.5666666666666667 and parameters: {'x_0_0': 'bc', 'x_0_1': 'cd', 'x_0_2': 'ac', 'x_1_0': 'ac', 'x_1_1': 'oo', 'x_1_2': 'ab'}. Best is trial 209 with value: 0.9444444444444444.
[I 2024-10-13 11:29:38,922] Trial 335 finished with value: 1.3444444444444446 and parameters: {'x_0_0': 'ac', 'x_0_1': 'ad', 'x_0_2': 'cd', 'x_1_0': 'ac', 'x_1_1': 'oo', 'x_1_2': 'ac'}. Best is trial 209 with value: 0.9444444444444444.
[I 2024-10-13 11:29:38,941] Trial 336 finished with value: 1.3444444444444446 and parameters: {'x_0_0': 'bc', 'x_0_1': 'ad', 'x_0_2': 'bc', 'x_1_0': 'bc', 'x_1_1': 'oo', 'x_1_2': 'ab'}. Best is trial 209 with value: 0.9444444444444444.
[I 2024-10-13 11:29:38,960] Trial 337 finished with value: 1.6666666666666665 and parameters: {'x_0_0': 'ac', 'x_0_1': 'bd', 'x_0_2': 'cd', 'x_1_0': 'ad', 'x_1_1': 'cd', 'x_1_2': 'bd'}. Best is trial 209 with value: 0.9444444444444444.
[I 2024-10-13 11:29:38,980] Trial 338 finished with value: 1.7777777777777777 and parameters: {'x_0_0': 'ab', 'x_0_1': 'cd', 'x_0_2': 'cd', 'x_1_0': 'cd', 'x_1_1': 'cd', 'x_1_2': 'ac'}. Best is trial 209 with value: 0.9444444444444444.
[I 2024-10-13 11:29:39,000] Trial 339 finished with value: 1.2666666666666666 and parameters: {'x_0_0': 'bd', 'x_0_1': 'ac', 'x_0_2': 'oo', 'x_1_0': 'oo', 'x_1_1': 'oo', 'x_1_2': 'cd'}. Best is trial 209 with value: 0.9444444444444444.
[I 2024-10-13 11:29:39,028] Trial 340 finished with value: 1.3444444444444446 and parameters: {'x_0_0': 'ac', 'x_0_1': 'ad', 'x_0_2': 'ac', 'x_1_0': 'ab', 'x_1_1': 'oo', 'x_1_2': 'bc'}. Best is trial 209 with value: 0.9444444444444444.
[I 2024-10-13 11:29:39,049] Trial 341 finished with value: 1.3444444444444446 and parameters: {'x_0_0': 'bd', 'x_0_1': 'ad', 'x_0_2': 'ab', 'x_1_0': 'bc', 'x_1_1': 'oo', 'x_1_2': 'ad'}. Best is trial 209 with value: 0.9444444444444444.
[I 2024-10-13 11:29:39,069] Trial 342 finished with value: 1.9 and parameters: {'x_0_0': 'cd', 'x_0_1': 'bc', 'x_0_2': 'bc', 'x_1_0': 'ad', 'x_1_1': 'oo', 'x_1_2': 'bd'}. Best is trial 209 with value: 0.9444444444444444.
[I 2024-10-13 11:29:39,089] Trial 343 finished with value: 1.7777777777777777 and parameters: {'x_0_0': 'ab', 'x_0_1': 'ad', 'x_0_2': 'ab', 'x_1_0': 'ad', 'x_1_1': 'ab', 'x_1_2': 'bd'}. Best is trial 209 with value: 0.9444444444444444.
[I 2024-10-13 11:29:39,109] Trial 344 finished with value: 1.7777777777777777 and parameters: {'x_0_0': 'ab', 'x_0_1': 'ac', 'x_0_2': 'ab', 'x_1_0': 'ad', 'x_1_1': 'cd', 'x_1_2': 'ac'}. Best is trial 209 with value: 0.9444444444444444.
[I 2024-10-13 11:29:39,128] Trial 345 finished with value: 1.6666666666666665 and parameters: {'x_0_0': 'bc', 'x_0_1': 'bc', 'x_0_2': 'ad', 'x_1_0': 'ac', 'x_1_1': 'ac', 'x_1_2': 'bd'}. Best is trial 209 with value: 0.9444444444444444.
[I 2024-10-13 11:29:39,147] Trial 346 finished with value: 1.5666666666666664 and parameters: {'x_0_0': 'ad', 'x_0_1': 'ad', 'x_0_2': 'oo', 'x_1_0': 'ac', 'x_1_1': 'ac', 'x_1_2': 'ab'}. Best is trial 209 with value: 0.9444444444444444.
[I 2024-10-13 11:29:39,167] Trial 347 finished with value: 1.8 and parameters: {'x_0_0': 'oo', 'x_0_1': 'ad', 'x_0_2': 'oo', 'x_1_0': 'ac', 'x_1_1': 'ab', 'x_1_2': 'cd'}. Best is trial 209 with value: 0.9444444444444444.
[I 2024-10-13 11:29:39,196] Trial 348 finished with value: 2.0 and parameters: {'x_0_0': 'cd', 'x_0_1': 'ad', 'x_0_2': 'ad', 'x_1_0': 'ac', 'x_1_1': 'ab', 'x_1_2': 'bd'}. Best is trial 209 with value: 0.9444444444444444.
[I 2024-10-13 11:29:39,223] Trial 349 finished with value: 1.4444444444444444 and parameters: {'x_0_0': 'ac', 'x_0_1': 'ac', 'x_0_2': 'cd', 'x_1_0': 'ab', 'x_1_1': 'bd', 'x_1_2': 'bc'}. Best is trial 209 with value: 0.9444444444444444.
[I 2024-10-13 11:29:39,243] Trial 350 finished with value: 2.0 and parameters: {'x_0_0': 'cd', 'x_0_1': 'bd', 'x_0_2': 'bd', 'x_1_0': 'cd', 'x_1_1': 'bc', 'x_1_2': 'ac'}. Best is trial 209 with value: 0.9444444444444444.
[I 2024-10-13 11:29:39,263] Trial 351 finished with value: 1.6666666666666665 and parameters: {'x_0_0': 'bc', 'x_0_1': 'bc', 'x_0_2': 'ab', 'x_1_0': 'ad', 'x_1_1': 'ab', 'x_1_2': 'ad'}. Best is trial 209 with value: 0.9444444444444444.
[I 2024-10-13 11:29:39,282] Trial 352 finished with value: 1.7999999999999998 and parameters: {'x_0_0': 'oo', 'x_0_1': 'ac', 'x_0_2': 'bd', 'x_1_0': 'cd', 'x_1_1': 'oo', 'x_1_2': 'ac'}. Best is trial 209 with value: 0.9444444444444444.
[I 2024-10-13 11:29:39,302] Trial 353 finished with value: 1.2666666666666666 and parameters: {'x_0_0': 'ad', 'x_0_1': 'oo', 'x_0_2': 'ab', 'x_1_0': 'ac', 'x_1_1': 'cd', 'x_1_2': 'ab'}. Best is trial 209 with value: 0.9444444444444444.
[I 2024-10-13 11:29:39,324] Trial 354 finished with value: 1.6666666666666665 and parameters: {'x_0_0': 'bd', 'x_0_1': 'ac', 'x_0_2': 'ad', 'x_1_0': 'ad', 'x_1_1': 'bd', 'x_1_2': 'ac'}. Best is trial 209 with value: 0.9444444444444444.
[I 2024-10-13 11:29:39,347] Trial 355 finished with value: 2.0 and parameters: {'x_0_0': 'cd', 'x_0_1': 'cd', 'x_0_2': 'bc', 'x_1_0': 'ab', 'x_1_1': 'cd', 'x_1_2': 'cd'}. Best is trial 209 with value: 0.9444444444444444.
[I 2024-10-13 11:29:39,371] Trial 356 finished with value: 1.3444444444444446 and parameters: {'x_0_0': 'bc', 'x_0_1': 'ad', 'x_0_2': 'bc', 'x_1_0': 'ac', 'x_1_1': 'ac', 'x_1_2': 'oo'}. Best is trial 209 with value: 0.9444444444444444.
[I 2024-10-13 11:29:39,395] Trial 357 finished with value: 1.4444444444444444 and parameters: {'x_0_0': 'ad', 'x_0_1': 'ab', 'x_0_2': 'bc', 'x_1_0': 'bd', 'x_1_1': 'ab', 'x_1_2': 'ab'}. Best is trial 209 with value: 0.9444444444444444.
[I 2024-10-13 11:29:39,415] Trial 358 finished with value: 1.3666666666666667 and parameters: {'x_0_0': 'ad', 'x_0_1': 'ab', 'x_0_2': 'bd', 'x_1_0': 'oo', 'x_1_1': 'ac', 'x_1_2': 'oo'}. Best is trial 209 with value: 0.9444444444444444.
[I 2024-10-13 11:29:39,435] Trial 359 finished with value: 1.6666666666666665 and parameters: {'x_0_0': 'ac', 'x_0_1': 'cd', 'x_0_2': 'ab', 'x_1_0': 'ad', 'x_1_1': 'ab', 'x_1_2': 'ac'}. Best is trial 209 with value: 0.9444444444444444.
[I 2024-10-13 11:29:39,454] Trial 360 finished with value: 1.6666666666666665 and parameters: {'x_0_0': 'bc', 'x_0_1': 'bc', 'x_0_2': 'bd', 'x_1_0': 'bc', 'x_1_1': 'ab', 'x_1_2': 'ac'}. Best is trial 209 with value: 0.9444444444444444.
[I 2024-10-13 11:29:39,474] Trial 361 finished with value: 1.5666666666666667 and parameters: {'x_0_0': 'bd', 'x_0_1': 'ad', 'x_0_2': 'bd', 'x_1_0': 'cd', 'x_1_1': 'oo', 'x_1_2': 'bc'}. Best is trial 209 with value: 0.9444444444444444.
[I 2024-10-13 11:29:39,493] Trial 362 finished with value: 1.5777777777777777 and parameters: {'x_0_0': 'ab', 'x_0_1': 'ad', 'x_0_2': 'oo', 'x_1_0': 'cd', 'x_1_1': 'bd', 'x_1_2': 'oo'}. Best is trial 209 with value: 0.9444444444444444.
[I 2024-10-13 11:29:39,512] Trial 363 finished with value: 1.3444444444444446 and parameters: {'x_0_0': 'bd', 'x_0_1': 'ad', 'x_0_2': 'ad', 'x_1_0': 'bc', 'x_1_1': 'oo', 'x_1_2': 'ad'}. Best is trial 209 with value: 0.9444444444444444.
[I 2024-10-13 11:29:39,531] Trial 364 finished with value: 1.9 and parameters: {'x_0_0': 'oo', 'x_0_1': 'bc', 'x_0_2': 'ab', 'x_1_0': 'cd', 'x_1_1': 'bc', 'x_1_2': 'ad'}. Best is trial 209 with value: 0.9444444444444444.
[I 2024-10-13 11:29:39,551] Trial 365 finished with value: 1.4444444444444444 and parameters: {'x_0_0': 'ac', 'x_0_1': 'ac', 'x_0_2': 'cd', 'x_1_0': 'ad', 'x_1_1': 'ac', 'x_1_2': 'ac'}. Best is trial 209 with value: 0.9444444444444444.
[I 2024-10-13 11:29:39,571] Trial 366 finished with value: 1.6666666666666665 and parameters: {'x_0_0': 'ad', 'x_0_1': 'bc', 'x_0_2': 'cd', 'x_1_0': 'ac', 'x_1_1': 'ad', 'x_1_2': 'ab'}. Best is trial 209 with value: 0.9444444444444444.
[I 2024-10-13 11:29:39,590] Trial 367 finished with value: 1.6666666666666665 and parameters: {'x_0_0': 'bc', 'x_0_1': 'bc', 'x_0_2': 'bc', 'x_1_0': 'ac', 'x_1_1': 'ad', 'x_1_2': 'ac'}. Best is trial 209 with value: 0.9444444444444444.
[I 2024-10-13 11:29:39,610] Trial 368 finished with value: 1.4666666666666666 and parameters: {'x_0_0': 'bc', 'x_0_1': 'bd', 'x_0_2': 'oo', 'x_1_0': 'ab', 'x_1_1': 'oo', 'x_1_2': 'ad'}. Best is trial 209 with value: 0.9444444444444444.
[I 2024-10-13 11:29:39,630] Trial 369 finished with value: 1.3444444444444446 and parameters: {'x_0_0': 'bd', 'x_0_1': 'ac', 'x_0_2': 'cd', 'x_1_0': 'bc', 'x_1_1': 'oo', 'x_1_2': 'ad'}. Best is trial 209 with value: 0.9444444444444444.
[I 2024-10-13 11:29:39,648] Trial 370 finished with value: 0.9444444444444444 and parameters: {'x_0_0': 'bd', 'x_0_1': 'oo', 'x_0_2': 'oo', 'x_1_0': 'bd', 'x_1_1': 'bd', 'x_1_2': 'cd'}. Best is trial 209 with value: 0.9444444444444444.
[I 2024-10-13 11:29:39,667] Trial 371 finished with value: 1.1666666666666665 and parameters: {'x_0_0': 'ac', 'x_0_1': 'oo', 'x_0_2': 'ac', 'x_1_0': 'ad', 'x_1_1': 'bc', 'x_1_2': 'oo'}. Best is trial 209 with value: 0.9444444444444444.
[I 2024-10-13 11:29:39,686] Trial 372 finished with value: 1.6666666666666665 and parameters: {'x_0_0': 'bc', 'x_0_1': 'bd', 'x_0_2': 'ac', 'x_1_0': 'ab', 'x_1_1': 'ad', 'x_1_2': 'bc'}. Best is trial 209 with value: 0.9444444444444444.
[I 2024-10-13 11:29:39,706] Trial 373 finished with value: 1.0222222222222221 and parameters: {'x_0_0': 'ac', 'x_0_1': 'ac', 'x_0_2': 'ac', 'x_1_0': 'bd', 'x_1_1': 'oo', 'x_1_2': 'oo'}. Best is trial 209 with value: 0.9444444444444444.
[I 2024-10-13 11:29:39,725] Trial 374 finished with value: 1.3666666666666667 and parameters: {'x_0_0': 'ad', 'x_0_1': 'cd', 'x_0_2': 'ad', 'x_1_0': 'oo', 'x_1_1': 'ad', 'x_1_2': 'oo'}. Best is trial 209 with value: 0.9444444444444444.
[I 2024-10-13 11:29:39,744] Trial 375 finished with value: 1.7777777777777777 and parameters: {'x_0_0': 'ab', 'x_0_1': 'cd', 'x_0_2': 'bc', 'x_1_0': 'ad', 'x_1_1': 'bd', 'x_1_2': 'ad'}. Best is trial 209 with value: 0.9444444444444444.
[I 2024-10-13 11:29:39,763] Trial 376 finished with value: 1.4555555555555557 and parameters: {'x_0_0': 'bc', 'x_0_1': 'ab', 'x_0_2': 'ac', 'x_1_0': 'bd', 'x_1_1': 'ac', 'x_1_2': 'oo'}. Best is trial 209 with value: 0.9444444444444444.
[I 2024-10-13 11:29:39,782] Trial 377 finished with value: 1.9 and parameters: {'x_0_0': 'cd', 'x_0_1': 'ad', 'x_0_2': 'bd', 'x_1_0': 'bd', 'x_1_1': 'ac', 'x_1_2': 'oo'}. Best is trial 209 with value: 0.9444444444444444.
[I 2024-10-13 11:29:39,817] Trial 378 finished with value: 1.4444444444444444 and parameters: {'x_0_0': 'bd', 'x_0_1': 'ab', 'x_0_2': 'ad', 'x_1_0': 'bd', 'x_1_1': 'ab', 'x_1_2': 'ac'}. Best is trial 209 with value: 0.9444444444444444.
[I 2024-10-13 11:29:39,836] Trial 379 finished with value: 1.5777777777777777 and parameters: {'x_0_0': 'ab', 'x_0_1': 'ab', 'x_0_2': 'oo', 'x_1_0': 'ab', 'x_1_1': 'oo', 'x_1_2': 'bd'}. Best is trial 209 with value: 0.9444444444444444.
[I 2024-10-13 11:29:39,855] Trial 380 finished with value: 1.6666666666666665 and parameters: {'x_0_0': 'ac', 'x_0_1': 'cd', 'x_0_2': 'ad', 'x_1_0': 'ad', 'x_1_1': 'ab', 'x_1_2': 'ac'}. Best is trial 209 with value: 0.9444444444444444.
