[I 2024-10-13 11:29:33,986] Trial 92 finished with value: 1.3444444444444443 and parameters: {'x_0_0': 'bc', 'x_0_1': 'ac', 'x_0_2': 'oo', 'x_1_0': 'cd', 'x_1_1': 'ad', 'x_1_2': 'bd'}. Best is trial 83 with value: 1.0444444444444443.
[I 2024-10-13 11:29:34,005] Trial 93 finished with value: 1.2222222222222223 and parameters: {'x_0_0': 'bc', 'x_0_1': 'ad', 'x_0_2': 'bc', 'x_1_0': 'cd', 'x_1_1': 'bc', 'x_1_2': 'bc'}. Best is trial 83 with value: 1.0444444444444443.
[I 2024-10-13 11:29:34,024] Trial 94 finished with value: 1.6666666666666665 and parameters: {'x_0_0': 'bd', 'x_0_1': 'cd', 'x_0_2': 'ab', 'x_1_0': 'ac', 'x_1_1': 'bc', 'x_1_2': 'bd'}. Best is trial 83 with value: 1.0444444444444443.
[I 2024-10-13 11:29:34,042] Trial 95 finished with value: 1.4 and parameters: {'x_0_0': 'cd', 'x_0_1': 'oo', 'x_0_2': 'bd', 'x_1_0': 'oo', 'x_1_1': 'ac', 'x_1_2': 'ab'}. Best is trial 83 with value: 1.0444444444444443.
[I 2024-10-13 11:29:34,060] Trial 96 finished with value: 1.9 and parameters: {'x_0_0': 'oo', 'x_0_1': 'cd', 'x_0_2': 'ab', 'x_1_0': 'ab', 'x_1_1': 'bd', 'x_1_2': 'ac'}. Best is trial 83 with value: 1.0444444444444443.
[I 2024-10-13 11:29:34,079] Trial 97 finished with value: 1.5666666666666664 and parameters: {'x_0_0': 'ad', 'x_0_1': 'ad', 'x_0_2': 'oo', 'x_1_0': 'ac', 'x_1_1': 'ab', 'x_1_2': 'ad'}. Best is trial 83 with value: 1.0444444444444443.
[I 2024-10-13 11:29:34,098] Trial 98 finished with value: 1.9 and parameters: {'x_0_0': 'oo', 'x_0_1': 'bd', 'x_0_2': 'bd', 'x_1_0': 'ac', 'x_1_1': 'ab', 'x_1_2': 'ab'}. Best is trial 83 with value: 1.0444444444444443.
[I 2024-10-13 11:29:34,117] Trial 99 finished with value: 1.8 and parameters: {'x_0_0': 'oo', 'x_0_1': 'bc', 'x_0_2': 'oo', 'x_1_0': 'cd', 'x_1_1': 'ac', 'x_1_2': 'ab'}. Best is trial 83 with value: 1.0444444444444443.
[I 2024-10-13 11:29:34,135] Trial 100 finished with value: 1.2444444444444445 and parameters: {'x_0_0': 'ad', 'x_0_1': 'bd', 'x_0_2': 'bc', 'x_1_0': 'bc', 'x_1_1': 'oo', 'x_1_2': 'oo'}. Best is trial 83 with value: 1.0444444444444443.
[I 2024-10-13 11:29:34,154] Trial 101 finished with value: 1.5555555555555556 and parameters: {'x_0_0': 'bc', 'x_0_1': 'ab', 'x_0_2': 'cd', 'x_1_0': 'ad', 'x_1_1': 'bd', 'x_1_2': 'bd'}. Best is trial 83 with value: 1.0444444444444443.
[I 2024-10-13 11:29:34,173] Trial 102 finished with value: 1.5555555555555556 and parameters: {'x_0_0': 'ad', 'x_0_1': 'ac', 'x_0_2': 'bd', 'x_1_0': 'ab', 'x_1_1': 'bc', 'x_1_2': 'cd'}. Best is trial 83 with value: 1.0444444444444443.
[I 2024-10-13 11:29:34,192] Trial 103 finished with value: 1.6777777777777778 and parameters: {'x_0_0': 'ab', 'x_0_1': 'cd', 'x_0_2': 'bd', 'x_1_0': 'bd', 'x_1_1': 'oo', 'x_1_2': 'bc'}. Best is trial 83 with value: 1.0444444444444443.
[I 2024-10-13 11:29:34,210] Trial 104 finished with value: 1.6 and parameters: {'x_0_0': 'oo', 'x_0_1': 'ad', 'x_0_2': 'bc', 'x_1_0': 'oo', 'x_1_1': 'oo', 'x_1_2': 'cd'}. Best is trial 83 with value: 1.0444444444444443.
[I 2024-10-13 11:29:34,229] Trial 105 finished with value: 1.9 and parameters: {'x_0_0': 'oo', 'x_0_1': 'ad', 'x_0_2': 'bd', 'x_1_0': 'bc', 'x_1_1': 'ad', 'x_1_2': 'ac'}. Best is trial 83 with value: 1.0444444444444443.
[I 2024-10-13 11:29:34,248] Trial 106 finished with value: 1.1333333333333333 and parameters: {'x_0_0': 'bc', 'x_0_1': 'ad', 'x_0_2': 'bd', 'x_1_0': 'oo', 'x_1_1': 'ab', 'x_1_2': 'cd'}. Best is trial 83 with value: 1.0444444444444443.
[I 2024-10-13 11:29:34,266] Trial 107 finished with value: 1.0 and parameters: {'x_0_0': 'ac', 'x_0_1': 'ac', 'x_0_2': 'ad', 'x_1_0': 'cd', 'x_1_1': 'ad', 'x_1_2': 'bd'}. Best is trial 107 with value: 1.0.
[I 2024-10-13 11:29:34,285] Trial 108 finished with value: 1.9 and parameters: {'x_0_0': 'oo', 'x_0_1': 'cd', 'x_0_2': 'cd', 'x_1_0': 'ab', 'x_1_1': 'ab', 'x_1_2': 'ab'}. Best is trial 107 with value: 1.0.
[I 2024-10-13 11:29:34,303] Trial 109 finished with value: 1.2444444444444445 and parameters: {'x_0_0': 'bc', 'x_0_1': 'ad', 'x_0_2': 'ad', 'x_1_0': 'oo', 'x_1_1': 'ad', 'x_1_2': 'ac'}. Best is trial 107 with value: 1.0.
[I 2024-10-13 11:29:34,321] Trial 110 finished with value: 1.3 and parameters: {'x_0_0': 'oo', 'x_0_1': 'oo', 'x_0_2': 'ac', 'x_1_0': 'ab', 'x_1_1': 'oo', 'x_1_2': 'oo'}. Best is trial 107 with value: 1.0.
[I 2024-10-13 11:29:34,340] Trial 111 finished with value: 1.6666666666666665 and parameters: {'x_0_0': 'bd', 'x_0_1': 'ab', 'x_0_2': 'bc', 'x_1_0': 'ac', 'x_1_1': 'bd', 'x_1_2': 'bd'}. Best is trial 107 with value: 1.0.
[I 2024-10-13 11:29:34,360] Trial 112 finished with value: 1.5666666666666664 and parameters: {'x_0_0': 'ac', 'x_0_1': 'bd', 'x_0_2': 'oo', 'x_1_0': 'bd', 'x_1_1': 'ad', 'x_1_2': 'bd'}. Best is trial 107 with value: 1.0.
[I 2024-10-13 11:29:34,379] Trial 113 finished with value: 1.6666666666666665 and parameters: {'x_0_0': 'bd', 'x_0_1': 'ac', 'x_0_2': 'ad', 'x_1_0': 'cd', 'x_1_1': 'ab', 'x_1_2': 'ad'}. Best is trial 107 with value: 1.0.
[I 2024-10-13 11:29:34,398] Trial 114 finished with value: 1.0666666666666667 and parameters: {'x_0_0': 'ad', 'x_0_1': 'oo', 'x_0_2': 'ad', 'x_1_0': 'oo', 'x_1_1': 'cd', 'x_1_2': 'ad'}. Best is trial 107 with value: 1.0.
[I 2024-10-13 11:29:34,417] Trial 115 finished with value: 1.4444444444444444 and parameters: {'x_0_0': 'ad', 'x_0_1': 'ac', 'x_0_2': 'bc', 'x_1_0': 'bc', 'x_1_1': 'bd', 'x_1_2': 'ad'}. Best is trial 107 with value: 1.0.
[I 2024-10-13 11:29:34,437] Trial 116 finished with value: 2.0 and parameters: {'x_0_0': 'cd', 'x_0_1': 'ac', 'x_0_2': 'cd', 'x_1_0': 'ad', 'x_1_1': 'ab', 'x_1_2': 'ad'}. Best is trial 107 with value: 1.0.
[I 2024-10-13 11:29:34,456] Trial 117 finished with value: 1.3444444444444446 and parameters: {'x_0_0': 'bc', 'x_0_1': 'ad', 'x_0_2': 'ab', 'x_1_0': 'cd', 'x_1_1': 'ad', 'x_1_2': 'oo'}. Best is trial 107 with value: 1.0.
[I 2024-10-13 11:29:34,479] Trial 118 finished with value: 1.5 and parameters: {'x_0_0': 'oo', 'x_0_1': 'oo', 'x_0_2': 'cd', 'x_1_0': 'cd', 'x_1_1': 'ad', 'x_1_2': 'ab'}. Best is trial 107 with value: 1.0.
[I 2024-10-13 11:29:34,500] Trial 119 finished with value: 1.7999999999999998 and parameters: {'x_0_0': 'cd', 'x_0_1': 'ac', 'x_0_2': 'ab', 'x_1_0': 'oo', 'x_1_1': 'ab', 'x_1_2': 'ac'}. Best is trial 107 with value: 1.0.
[I 2024-10-13 11:29:34,520] Trial 120 finished with value: 1.7999999999999998 and parameters: {'x_0_0': 'cd', 'x_0_1': 'ac', 'x_0_2': 'bd', 'x_1_0': 'oo', 'x_1_1': 'cd', 'x_1_2': 'ab'}. Best is trial 107 with value: 1.0.
[I 2024-10-13 11:29:34,542] Trial 121 finished with value: 1.6666666666666665 and parameters: {'x_0_0': 'bc', 'x_0_1': 'bc', 'x_0_2': 'bc', 'x_1_0': 'bc', 'x_1_1': 'ab', 'x_1_2': 'ac'}. Best is trial 107 with value: 1.0.
[I 2024-10-13 11:29:34,564] Trial 122 finished with value: 1.5555555555555556 and parameters: {'x_0_0': 'bd', 'x_0_1': 'ad', 'x_0_2': 'bc', 'x_1_0': 'ab', 'x_1_1': 'ab', 'x_1_2': 'cd'}. Best is trial 107 with value: 1.0.
[I 2024-10-13 11:29:34,586] Trial 123 finished with value: 1.6666666666666665 and parameters: {'x_0_0': 'ad', 'x_0_1': 'cd', 'x_0_2': 'ad', 'x_1_0': 'ac', 'x_1_1': 'bc', 'x_1_2': 'ac'}. Best is trial 107 with value: 1.0.
[I 2024-10-13 11:29:34,607] Trial 124 finished with value: 1.7 and parameters: {'x_0_0': 'cd', 'x_0_1': 'cd', 'x_0_2': 'bd', 'x_1_0': 'oo', 'x_1_1': 'oo', 'x_1_2': 'ac'}. Best is trial 107 with value: 1.0.
[I 2024-10-13 11:29:34,629] Trial 125 finished with value: 1.6666666666666665 and parameters: {'x_0_0': 'ad', 'x_0_1': 'bc', 'x_0_2': 'ab', 'x_1_0': 'cd', 'x_1_1': 'bd', 'x_1_2': 'ad'}. Best is trial 107 with value: 1.0.
[I 2024-10-13 11:29:34,650] Trial 126 finished with value: 1.6666666666666665 and parameters: {'x_0_0': 'bd', 'x_0_1': 'ac', 'x_0_2': 'cd', 'x_1_0': 'ad', 'x_1_1': 'ab', 'x_1_2': 'bc'}. Best is trial 107 with value: 1.0.
[I 2024-10-13 11:29:34,672] Trial 127 finished with value: 1.5666666666666667 and parameters: {'x_0_0': 'ad', 'x_0_1': 'ad', 'x_0_2': 'ad', 'x_1_0': 'cd', 'x_1_1': 'bd', 'x_1_2': 'oo'}. Best is trial 107 with value: 1.0.
[I 2024-10-13 11:29:34,695] Trial 128 finished with value: 1.1555555555555554 and parameters: {'x_0_0': 'bd', 'x_0_1': 'oo', 'x_0_2': 'ac', 'x_1_0': 'ab', 'x_1_1': 'ac', 'x_1_2': 'bc'}. Best is trial 107 with value: 1.0.
[I 2024-10-13 11:29:34,716] Trial 129 finished with value: 2.0 and parameters: {'x_0_0': 'cd', 'x_0_1': 'cd', 'x_0_2': 'ac', 'x_1_0': 'bd', 'x_1_1': 'bc', 'x_1_2': 'ad'}. Best is trial 107 with value: 1.0.
[I 2024-10-13 11:29:34,736] Trial 130 finished with value: 2.0 and parameters: {'x_0_0': 'cd', 'x_0_1': 'bd', 'x_0_2': 'ac', 'x_1_0': 'bd', 'x_1_1': 'bd', 'x_1_2': 'bd'}. Best is trial 107 with value: 1.0.
[I 2024-10-13 11:29:34,755] Trial 131 finished with value: 1.6666666666666665 and parameters: {'x_0_0': 'bc', 'x_0_1': 'bd', 'x_0_2': 'bd', 'x_1_0': 'ad', 'x_1_1': 'bc', 'x_1_2': 'bc'}. Best is trial 107 with value: 1.0.
[I 2024-10-13 11:29:34,775] Trial 132 finished with value: 1.5666666666666667 and parameters: {'x_0_0': 'bd', 'x_0_1': 'bc', 'x_0_2': 'ac', 'x_1_0': 'cd', 'x_1_1': 'bc', 'x_1_2': 'oo'}. Best is trial 107 with value: 1.0.
[I 2024-10-13 11:29:34,795] Trial 133 finished with value: 1.9 and parameters: {'x_0_0': 'oo', 'x_0_1': 'ac', 'x_0_2': 'ad', 'x_1_0': 'bc', 'x_1_1': 'ad', 'x_1_2': 'ab'}. Best is trial 107 with value: 1.0.
[I 2024-10-13 11:29:34,816] Trial 134 finished with value: 1.2666666666666666 and parameters: {'x_0_0': 'ad', 'x_0_1': 'oo', 'x_0_2': 'ab', 'x_1_0': 'ac', 'x_1_1': 'bd', 'x_1_2': 'ab'}. Best is trial 107 with value: 1.0.
[I 2024-10-13 11:29:34,838] Trial 135 finished with value: 1.1666666666666665 and parameters: {'x_0_0': 'bd', 'x_0_1': 'oo', 'x_0_2': 'ad', 'x_1_0': 'ac', 'x_1_1': 'ac', 'x_1_2': 'oo'}. Best is trial 107 with value: 1.0.
[I 2024-10-13 11:29:34,860] Trial 136 finished with value: 1.4 and parameters: {'x_0_0': 'oo', 'x_0_1': 'oo', 'x_0_2': 'oo', 'x_1_0': 'ad', 'x_1_1': 'cd', 'x_1_2': 'bc'}. Best is trial 107 with value: 1.0.
[I 2024-10-13 11:29:34,881] Trial 137 finished with value: 1.2222222222222223 and parameters: {'x_0_0': 'ad', 'x_0_1': 'ac', 'x_0_2': 'ac', 'x_1_0': 'bc', 'x_1_1': 'ac', 'x_1_2': 'cd'}. Best is trial 107 with value: 1.0.
[I 2024-10-13 11:29:34,907] Trial 138 finished with value: 1.4444444444444444 and parameters: {'x_0_0': 'bc', 'x_0_1': 'ad', 'x_0_2': 'ad', 'x_1_0': 'bd', 'x_1_1': 'cd', 'x_1_2': 'bd'}. Best is trial 107 with value: 1.0.
[I 2024-10-13 11:29:34,930] Trial 139 finished with value: 1.7777777777777777 and parameters: {'x_0_0': 'ab', 'x_0_1': 'cd', 'x_0_2': 'ac', 'x_1_0': 'cd', 'x_1_1': 'cd', 'x_1_2': 'ac'}. Best is trial 107 with value: 1.0.
[I 2024-10-13 11:29:34,951] Trial 140 finished with value: 1.1666666666666665 and parameters: {'x_0_0': 'ac', 'x_0_1': 'oo', 'x_0_2': 'ab', 'x_1_0': 'ab', 'x_1_1': 'bc', 'x_1_2': 'oo'}. Best is trial 107 with value: 1.0.
[I 2024-10-13 11:29:34,973] Trial 141 finished with value: 1.5777777777777777 and parameters: {'x_0_0': 'ab', 'x_0_1': 'ad', 'x_0_2': 'cd', 'x_1_0': 'oo', 'x_1_1': 'cd', 'x_1_2': 'bc'}. Best is trial 107 with value: 1.0.
[I 2024-10-13 11:29:34,993] Trial 142 finished with value: 1.6666666666666665 and parameters: {'x_0_0': 'bd', 'x_0_1': 'bc', 'x_0_2': 'ac', 'x_1_0': 'cd', 'x_1_1': 'ab', 'x_1_2': 'ab'}. Best is trial 107 with value: 1.0.
[I 2024-10-13 11:29:35,014] Trial 143 finished with value: 1.9 and parameters: {'x_0_0': 'oo', 'x_0_1': 'ad', 'x_0_2': 'cd', 'x_1_0': 'ab', 'x_1_1': 'ab', 'x_1_2': 'ab'}. Best is trial 107 with value: 1.0.
[I 2024-10-13 11:29:35,034] Trial 144 finished with value: 1.6666666666666665 and parameters: {'x_0_0': 'ac', 'x_0_1': 'cd', 'x_0_2': 'ab', 'x_1_0': 'ab', 'x_1_1': 'ab', 'x_1_2': 'ab'}. Best is trial 107 with value: 1.0.
[I 2024-10-13 11:29:35,054] Trial 145 finished with value: 1.6666666666666665 and parameters: {'x_0_0': 'bd', 'x_0_1': 'ad', 'x_0_2': 'cd', 'x_1_0': 'ad', 'x_1_1': 'ac', 'x_1_2': 'ab'}. Best is trial 107 with value: 1.0.
[I 2024-10-13 11:29:35,074] Trial 146 finished with value: 1.5555555555555556 and parameters: {'x_0_0': 'ac', 'x_0_1': 'ab', 'x_0_2': 'ad', 'x_1_0': 'cd', 'x_1_1': 'bd', 'x_1_2': 'bc'}. Best is trial 107 with value: 1.0.
[I 2024-10-13 11:29:35,093] Trial 147 finished with value: 1.7999999999999998 and parameters: {'x_0_0': 'cd', 'x_0_1': 'ac', 'x_0_2': 'oo', 'x_1_0': 'bc', 'x_1_1': 'ad', 'x_1_2': 'oo'}. Best is trial 107 with value: 1.0.
[I 2024-10-13 11:29:35,113] Trial 148 finished with value: 1.3444444444444446 and parameters: {'x_0_0': 'ac', 'x_0_1': 'ad', 'x_0_2': 'ab', 'x_1_0': 'ac', 'x_1_1': 'oo', 'x_1_2': 'bc'}. Best is trial 107 with value: 1.0.
[I 2024-10-13 11:29:35,132] Trial 149 finished with value: 1.7777777777777777 and parameters: {'x_0_0': 'ab', 'x_0_1': 'bd', 'x_0_2': 'ad', 'x_1_0': 'cd', 'x_1_1': 'bd', 'x_1_2': 'ab'}. Best is trial 107 with value: 1.0.
[I 2024-10-13 11:29:35,150] Trial 150 finished with value: 1.4444444444444444 and parameters: {'x_0_0': 'bd', 'x_0_1': 'ad', 'x_0_2': 'bc', 'x_1_0': 'bd', 'x_1_1': 'ab', 'x_1_2': 'ac'}. Best is trial 107 with value: 1.0.
[I 2024-10-13 11:29:35,170] Trial 151 finished with value: 1.7777777777777777 and parameters: {'x_0_0': 'ab', 'x_0_1': 'ac', 'x_0_2': 'ad', 'x_1_0': 'cd', 'x_1_1': 'ac', 'x_1_2': 'ac'}. Best is trial 107 with value: 1.0.
[I 2024-10-13 11:29:35,189] Trial 152 finished with value: 1.5555555555555556 and parameters: {'x_0_0': 'ac', 'x_0_1': 'ab', 'x_0_2': 'cd', 'x_1_0': 'cd', 'x_1_1': 'cd', 'x_1_2': 'ab'}. Best is trial 107 with value: 1.0.
[I 2024-10-13 11:29:35,208] Trial 153 finished with value: 1.9 and parameters: {'x_0_0': 'oo', 'x_0_1': 'ab', 'x_0_2': 'ac', 'x_1_0': 'ab', 'x_1_1': 'bc', 'x_1_2': 'bc'}. Best is trial 107 with value: 1.0.
[I 2024-10-13 11:29:35,227] Trial 154 finished with value: 1.4444444444444444 and parameters: {'x_0_0': 'bc', 'x_0_1': 'ad', 'x_0_2': 'ab', 'x_1_0': 'ab', 'x_1_1': 'cd', 'x_1_2': 'ad'}. Best is trial 107 with value: 1.0.
[I 2024-10-13 11:29:35,246] Trial 155 finished with value: 1.4666666666666666 and parameters: {'x_0_0': 'bd', 'x_0_1': 'bd', 'x_0_2': 'cd', 'x_1_0': 'oo', 'x_1_1': 'cd', 'x_1_2': 'bd'}. Best is trial 107 with value: 1.0.
[I 2024-10-13 11:29:35,265] Trial 156 finished with value: 1.5 and parameters: {'x_0_0': 'oo', 'x_0_1': 'oo', 'x_0_2': 'ad', 'x_1_0': 'ac', 'x_1_1': 'ab', 'x_1_2': 'ab'}. Best is trial 107 with value: 1.0.
[I 2024-10-13 11:29:35,283] Trial 157 finished with value: 1.4555555555555557 and parameters: {'x_0_0': 'bc', 'x_0_1': 'ab', 'x_0_2': 'ac', 'x_1_0': 'bd', 'x_1_1': 'oo', 'x_1_2': 'bc'}. Best is trial 107 with value: 1.0.
[I 2024-10-13 11:29:35,303] Trial 158 finished with value: 1.7777777777777777 and parameters: {'x_0_0': 'ab', 'x_0_1': 'ac', 'x_0_2': 'cd', 'x_1_0': 'bd', 'x_1_1': 'ac', 'x_1_2': 'cd'}. Best is trial 107 with value: 1.0.
[I 2024-10-13 11:29:35,322] Trial 159 finished with value: 1.5555555555555556 and parameters: {'x_0_0': 'ad', 'x_0_1': 'cd', 'x_0_2': 'ad', 'x_1_0': 'ab', 'x_1_1': 'bd', 'x_1_2': 'ab'}. Best is trial 107 with value: 1.0.
[I 2024-10-13 11:29:35,340] Trial 160 finished with value: 1.9 and parameters: {'x_0_0': 'oo', 'x_0_1': 'ac', 'x_0_2': 'ad', 'x_1_0': 'bc', 'x_1_1': 'ad', 'x_1_2': 'bc'}. Best is trial 107 with value: 1.0.
[I 2024-10-13 11:29:35,359] Trial 161 finished with value: 1.7999999999999998 and parameters: {'x_0_0': 'cd', 'x_0_1': 'ad', 'x_0_2': 'cd', 'x_1_0': 'oo', 'x_1_1': 'ab', 'x_1_2': 'ad'}. Best is trial 107 with value: 1.0.
[I 2024-10-13 11:29:35,378] Trial 162 finished with value: 1.3666666666666667 and parameters: {'x_0_0': 'bd', 'x_0_1': 'cd', 'x_0_2': 'bc', 'x_1_0': 'oo', 'x_1_1': 'bd', 'x_1_2': 'oo'}. Best is trial 107 with value: 1.0.
[I 2024-10-13 11:29:35,397] Trial 163 finished with value: 1.7777777777777777 and parameters: {'x_0_0': 'ab', 'x_0_1': 'bd', 'x_0_2': 'ad', 'x_1_0': 'ac', 'x_1_1': 'ac', 'x_1_2': 'bc'}. Best is trial 107 with value: 1.0.
[I 2024-10-13 11:29:35,416] Trial 164 finished with value: 1.5666666666666667 and parameters: {'x_0_0': 'bd', 'x_0_1': 'ad', 'x_0_2': 'ac', 'x_1_0': 'ad', 'x_1_1': 'oo', 'x_1_2': 'ad'}. Best is trial 107 with value: 1.0.
[I 2024-10-13 11:29:35,435] Trial 165 finished with value: 1.3555555555555556 and parameters: {'x_0_0': 'ac', 'x_0_1': 'ab', 'x_0_2': 'oo', 'x_1_0': 'cd', 'x_1_1': 'oo', 'x_1_2': 'ac'}. Best is trial 107 with value: 1.0.
[I 2024-10-13 11:29:35,453] Trial 166 finished with value: 1.5555555555555556 and parameters: {'x_0_0': 'bc', 'x_0_1': 'ab', 'x_0_2': 'cd', 'x_1_0': 'ac', 'x_1_1': 'ad', 'x_1_2': 'ad'}. Best is trial 107 with value: 1.0.
[I 2024-10-13 11:29:35,473] Trial 167 finished with value: 1.7777777777777777 and parameters: {'x_0_0': 'ab', 'x_0_1': 'ab', 'x_0_2': 'ad', 'x_1_0': 'cd', 'x_1_1': 'bd', 'x_1_2': 'bc'}. Best is trial 107 with value: 1.0.
[I 2024-10-13 11:29:35,492] Trial 168 finished with value: 1.4 and parameters: {'x_0_0': 'oo', 'x_0_1': 'oo', 'x_0_2': 'oo', 'x_1_0': 'cd', 'x_1_1': 'bd', 'x_1_2': 'cd'}. Best is trial 107 with value: 1.0.
[I 2024-10-13 11:29:35,513] Trial 169 finished with value: 1.9 and parameters: {'x_0_0': 'oo', 'x_0_1': 'ab', 'x_0_2': 'bd', 'x_1_0': 'ab', 'x_1_1': 'bc', 'x_1_2': 'ac'}. Best is trial 107 with value: 1.0.
[I 2024-10-13 11:29:35,534] Trial 170 finished with value: 1.9 and parameters: {'x_0_0': 'oo', 'x_0_1': 'ad', 'x_0_2': 'ac', 'x_1_0': 'ac', 'x_1_1': 'bc', 'x_1_2': 'bd'}. Best is trial 107 with value: 1.0.
[I 2024-10-13 11:29:35,555] Trial 171 finished with value: 1.3444444444444446 and parameters: {'x_0_0': 'ad', 'x_0_1': 'bd', 'x_0_2': 'ab', 'x_1_0': 'bd', 'x_1_1': 'oo', 'x_1_2': 'ac'}. Best is trial 107 with value: 1.0.
[I 2024-10-13 11:29:35,574] Trial 172 finished with value: 1.4444444444444444 and parameters: {'x_0_0': 'bc', 'x_0_1': 'ac', 'x_0_2': 'cd', 'x_1_0': 'bc', 'x_1_1': 'bd', 'x_1_2': 'ac'}. Best is trial 107 with value: 1.0.
[I 2024-10-13 11:29:35,594] Trial 173 finished with value: 1.4444444444444444 and parameters: {'x_0_0': 'ad', 'x_0_1': 'cd', 'x_0_2': 'cd', 'x_1_0': 'bc', 'x_1_1': 'bc', 'x_1_2': 'bd'}. Best is trial 107 with value: 1.0.
[I 2024-10-13 11:29:35,613] Trial 174 finished with value: 1.5666666666666667 and parameters: {'x_0_0': 'bd', 'x_0_1': 'cd', 'x_0_2': 'ad', 'x_1_0': 'ac', 'x_1_1': 'oo', 'x_1_2': 'cd'}. Best is trial 107 with value: 1.0.
[I 2024-10-13 11:29:35,632] Trial 175 finished with value: 1.6777777777777778 and parameters: {'x_0_0': 'ab', 'x_0_1': 'bd', 'x_0_2': 'ad', 'x_1_0': 'bc', 'x_1_1': 'oo', 'x_1_2': 'ac'}. Best is trial 107 with value: 1.0.
[I 2024-10-13 11:29:35,651] Trial 176 finished with value: 1.6777777777777776 and parameters: {'x_0_0': 'ab', 'x_0_1': 'bd', 'x_0_2': 'oo', 'x_1_0': 'cd', 'x_1_1': 'ab', 'x_1_2': 'ad'}. Best is trial 107 with value: 1.0.
[I 2024-10-13 11:29:35,671] Trial 177 finished with value: 1.0666666666666667 and parameters: {'x_0_0': 'ad', 'x_0_1': 'oo', 'x_0_2': 'ad', 'x_1_0': 'oo', 'x_1_1': 'bc', 'x_1_2': 'ab'}. Best is trial 107 with value: 1.0.
[I 2024-10-13 11:29:35,692] Trial 178 finished with value: 2.0 and parameters: {'x_0_0': 'cd', 'x_0_1': 'ad', 'x_0_2': 'ad', 'x_1_0': 'ac', 'x_1_1': 'bc', 'x_1_2': 'bc'}. Best is trial 107 with value: 1.0.
[I 2024-10-13 11:29:35,711] Trial 179 finished with value: 1.6 and parameters: {'x_0_0': 'oo', 'x_0_1': 'ad', 'x_0_2': 'oo', 'x_1_0': 'oo', 'x_1_1': 'bc', 'x_1_2': 'cd'}. Best is trial 107 with value: 1.0.
[I 2024-10-13 11:29:35,730] Trial 180 finished with value: 1.9 and parameters: {'x_0_0': 'oo', 'x_0_1': 'ad', 'x_0_2': 'bd', 'x_1_0': 'cd', 'x_1_1': 'cd', 'x_1_2': 'ad'}. Best is trial 107 with value: 1.0.
[I 2024-10-13 11:29:35,749] Trial 181 finished with value: 1.4444444444444444 and parameters: {'x_0_0': 'ad', 'x_0_1': 'ad', 'x_0_2': 'ab', 'x_1_0': 'bd', 'x_1_1': 'ac', 'x_1_2': 'bd'}. Best is trial 107 with value: 1.0.
[I 2024-10-13 11:29:35,768] Trial 182 finished with value: 1.9 and parameters: {'x_0_0': 'oo', 'x_0_1': 'cd', 'x_0_2': 'bc', 'x_1_0': 'cd', 'x_1_1': 'cd', 'x_1_2': 'ac'}. Best is trial 107 with value: 1.0.
[I 2024-10-13 11:29:35,786] Trial 183 finished with value: 1.2777777777777777 and parameters: {'x_0_0': 'ab', 'x_0_1': 'oo', 'x_0_2': 'bc', 'x_1_0': 'cd', 'x_1_1': 'bd', 'x_1_2': 'oo'}. Best is trial 107 with value: 1.0.
[I 2024-10-13 11:29:35,805] Trial 184 finished with value: 1.4 and parameters: {'x_0_0': 'oo', 'x_0_1': 'oo', 'x_0_2': 'oo', 'x_1_0': 'bd', 'x_1_1': 'ac', 'x_1_2': 'cd'}. Best is trial 107 with value: 1.0.
[I 2024-10-13 11:29:35,824] Trial 185 finished with value: 1.6666666666666665 and parameters: {'x_0_0': 'ac', 'x_0_1': 'cd', 'x_0_2': 'ac', 'x_1_0': 'ab', 'x_1_1': 'ac', 'x_1_2': 'ad'}. Best is trial 107 with value: 1.0.
[I 2024-10-13 11:29:35,842] Trial 186 finished with value: 1.0444444444444443 and parameters: {'x_0_0': 'ad', 'x_0_1': 'oo', 'x_0_2': 'ac', 'x_1_0': 'bc', 'x_1_1': 'cd', 'x_1_2': 'cd'}. Best is trial 107 with value: 1.0.
[I 2024-10-13 11:29:35,861] Trial 187 finished with value: 1.7999999999999998 and parameters: {'x_0_0': 'cd', 'x_0_1': 'cd', 'x_0_2': 'oo', 'x_1_0': 'ab', 'x_1_1': 'ac', 'x_1_2': 'oo'}. Best is trial 107 with value: 1.0.
[I 2024-10-13 11:29:35,880] Trial 188 finished with value: 1.6666666666666665 and parameters: {'x_0_0': 'ac', 'x_0_1': 'cd', 'x_0_2': 'ac', 'x_1_0': 'bd', 'x_1_1': 'bc', 'x_1_2': 'bc'}. Best is trial 107 with value: 1.0.
[I 2024-10-13 11:29:35,899] Trial 189 finished with value: 1.4666666666666666 and parameters: {'x_0_0': 'bd', 'x_0_1': 'bd', 'x_0_2': 'bd', 'x_1_0': 'oo', 'x_1_1': 'bd', 'x_1_2': 'bd'}. Best is trial 107 with value: 1.0.
[I 2024-10-13 11:29:35,918] Trial 190 finished with value: 1.4444444444444444 and parameters: {'x_0_0': 'bc', 'x_0_1': 'ad', 'x_0_2': 'cd', 'x_1_0': 'ad', 'x_1_1': 'ac', 'x_1_2': 'bc'}. Best is trial 107 with value: 1.0.
[I 2024-10-13 11:29:35,937] Trial 191 finished with value: 1.3666666666666667 and parameters: {'x_0_0': 'ad', 'x_0_1': 'ac', 'x_0_2': 'bc', 'x_1_0': 'oo', 'x_1_1': 'oo', 'x_1_2': 'ad'}. Best is trial 107 with value: 1.0.
