[I 2024-10-13 11:30:26,329] Trial 463 finished with value: 0.8222222222222222 and parameters: {'x_0_0': 'bc', 'x_0_1': 'ad', 'x_0_2': 'oo', 'x_1_0': 'oo', 'x_1_1': 'bc', 'x_1_2': 'oo'}. Best is trial 443 with value: 0.8222222222222222.
[I 2024-10-13 11:30:26,359] Trial 464 finished with value: 1.3777777777777778 and parameters: {'x_0_0': 'ab', 'x_0_1': 'ad', 'x_0_2': 'oo', 'x_1_0': 'oo', 'x_1_1': 'bc', 'x_1_2': 'oo'}. Best is trial 443 with value: 0.8222222222222222.
[I 2024-10-13 11:30:26,389] Trial 465 finished with value: 0.8222222222222222 and parameters: {'x_0_0': 'bc', 'x_0_1': 'ad', 'x_0_2': 'oo', 'x_1_0': 'oo', 'x_1_1': 'bc', 'x_1_2': 'oo'}. Best is trial 443 with value: 0.8222222222222222.
[I 2024-10-13 11:30:26,418] Trial 466 finished with value: 0.8222222222222222 and parameters: {'x_0_0': 'ac', 'x_0_1': 'ad', 'x_0_2': 'oo', 'x_1_0': 'oo', 'x_1_1': 'bc', 'x_1_2': 'oo'}. Best is trial 443 with value: 0.8222222222222222.
[I 2024-10-13 11:30:26,449] Trial 467 finished with value: 1.0222222222222221 and parameters: {'x_0_0': 'ac', 'x_0_1': 'ad', 'x_0_2': 'oo', 'x_1_0': 'ad', 'x_1_1': 'bc', 'x_1_2': 'oo'}. Best is trial 443 with value: 0.8222222222222222.
[I 2024-10-13 11:30:26,479] Trial 468 finished with value: 0.9222222222222222 and parameters: {'x_0_0': 'ac', 'x_0_1': 'ad', 'x_0_2': 'oo', 'x_1_0': 'oo', 'x_1_1': 'bc', 'x_1_2': 'bc'}. Best is trial 443 with value: 0.8222222222222222.
[I 2024-10-13 11:30:26,509] Trial 469 finished with value: 0.8222222222222222 and parameters: {'x_0_0': 'ac', 'x_0_1': 'ad', 'x_0_2': 'oo', 'x_1_0': 'oo', 'x_1_1': 'bc', 'x_1_2': 'oo'}. Best is trial 443 with value: 0.8222222222222222.
[I 2024-10-13 11:30:26,539] Trial 470 finished with value: 0.8222222222222222 and parameters: {'x_0_0': 'ac', 'x_0_1': 'ad', 'x_0_2': 'oo', 'x_1_0': 'oo', 'x_1_1': 'bc', 'x_1_2': 'oo'}. Best is trial 443 with value: 0.8222222222222222.
[I 2024-10-13 11:30:26,569] Trial 471 finished with value: 0.8222222222222222 and parameters: {'x_0_0': 'ac', 'x_0_1': 'ad', 'x_0_2': 'oo', 'x_1_0': 'oo', 'x_1_1': 'bc', 'x_1_2': 'oo'}. Best is trial 443 with value: 0.8222222222222222.
[I 2024-10-13 11:30:26,599] Trial 472 finished with value: 0.8222222222222222 and parameters: {'x_0_0': 'ac', 'x_0_1': 'ad', 'x_0_2': 'oo', 'x_1_0': 'oo', 'x_1_1': 'bc', 'x_1_2': 'oo'}. Best is trial 443 with value: 0.8222222222222222.
[I 2024-10-13 11:30:26,630] Trial 473 finished with value: 0.8222222222222222 and parameters: {'x_0_0': 'ac', 'x_0_1': 'ad', 'x_0_2': 'oo', 'x_1_0': 'oo', 'x_1_1': 'bc', 'x_1_2': 'oo'}. Best is trial 443 with value: 0.8222222222222222.
[I 2024-10-13 11:30:26,661] Trial 474 finished with value: 0.8222222222222222 and parameters: {'x_0_0': 'ac', 'x_0_1': 'ad', 'x_0_2': 'oo', 'x_1_0': 'oo', 'x_1_1': 'bc', 'x_1_2': 'oo'}. Best is trial 443 with value: 0.8222222222222222.
[I 2024-10-13 11:30:26,691] Trial 475 finished with value: 1.2666666666666666 and parameters: {'x_0_0': 'ac', 'x_0_1': 'bc', 'x_0_2': 'oo', 'x_1_0': 'oo', 'x_1_1': 'bc', 'x_1_2': 'oo'}. Best is trial 443 with value: 0.8222222222222222.
[I 2024-10-13 11:30:26,721] Trial 476 finished with value: 0.8222222222222222 and parameters: {'x_0_0': 'ac', 'x_0_1': 'ad', 'x_0_2': 'oo', 'x_1_0': 'oo', 'x_1_1': 'bc', 'x_1_2': 'oo'}. Best is trial 443 with value: 0.8222222222222222.
[I 2024-10-13 11:30:26,751] Trial 477 finished with value: 0.8222222222222222 and parameters: {'x_0_0': 'ac', 'x_0_1': 'ad', 'x_0_2': 'oo', 'x_1_0': 'oo', 'x_1_1': 'bc', 'x_1_2': 'oo'}. Best is trial 443 with value: 0.8222222222222222.
[I 2024-10-13 11:30:26,781] Trial 478 finished with value: 0.8222222222222222 and parameters: {'x_0_0': 'ac', 'x_0_1': 'ad', 'x_0_2': 'oo', 'x_1_0': 'oo', 'x_1_1': 'bc', 'x_1_2': 'oo'}. Best is trial 443 with value: 0.8222222222222222.
[I 2024-10-13 11:30:26,811] Trial 479 finished with value: 0.8222222222222222 and parameters: {'x_0_0': 'ac', 'x_0_1': 'ad', 'x_0_2': 'oo', 'x_1_0': 'oo', 'x_1_1': 'bc', 'x_1_2': 'oo'}. Best is trial 443 with value: 0.8222222222222222.
[I 2024-10-13 11:30:26,841] Trial 480 finished with value: 0.8222222222222222 and parameters: {'x_0_0': 'ac', 'x_0_1': 'ad', 'x_0_2': 'oo', 'x_1_0': 'oo', 'x_1_1': 'bc', 'x_1_2': 'oo'}. Best is trial 443 with value: 0.8222222222222222.
[I 2024-10-13 11:30:26,872] Trial 481 finished with value: 0.8222222222222222 and parameters: {'x_0_0': 'ac', 'x_0_1': 'ad', 'x_0_2': 'oo', 'x_1_0': 'oo', 'x_1_1': 'bc', 'x_1_2': 'oo'}. Best is trial 443 with value: 0.8222222222222222.
[I 2024-10-13 11:30:26,902] Trial 482 finished with value: 0.8222222222222222 and parameters: {'x_0_0': 'ac', 'x_0_1': 'ad', 'x_0_2': 'oo', 'x_1_0': 'oo', 'x_1_1': 'bc', 'x_1_2': 'oo'}. Best is trial 443 with value: 0.8222222222222222.
[I 2024-10-13 11:30:26,933] Trial 483 finished with value: 1.0222222222222221 and parameters: {'x_0_0': 'ac', 'x_0_1': 'ad', 'x_0_2': 'oo', 'x_1_0': 'cd', 'x_1_1': 'bc', 'x_1_2': 'oo'}. Best is trial 443 with value: 0.8222222222222222.
[I 2024-10-13 11:30:26,963] Trial 484 finished with value: 0.8222222222222222 and parameters: {'x_0_0': 'ac', 'x_0_1': 'ad', 'x_0_2': 'oo', 'x_1_0': 'oo', 'x_1_1': 'bc', 'x_1_2': 'oo'}. Best is trial 443 with value: 0.8222222222222222.
[I 2024-10-13 11:30:26,994] Trial 485 finished with value: 0.8222222222222222 and parameters: {'x_0_0': 'ac', 'x_0_1': 'ad', 'x_0_2': 'oo', 'x_1_0': 'oo', 'x_1_1': 'bc', 'x_1_2': 'oo'}. Best is trial 443 with value: 0.8222222222222222.
[I 2024-10-13 11:30:27,025] Trial 486 finished with value: 1.3666666666666667 and parameters: {'x_0_0': 'ac', 'x_0_1': 'cd', 'x_0_2': 'oo', 'x_1_0': 'oo', 'x_1_1': 'bc', 'x_1_2': 'ac'}. Best is trial 443 with value: 0.8222222222222222.
[I 2024-10-13 11:30:27,056] Trial 487 finished with value: 0.8222222222222222 and parameters: {'x_0_0': 'ac', 'x_0_1': 'ad', 'x_0_2': 'oo', 'x_1_0': 'oo', 'x_1_1': 'bc', 'x_1_2': 'oo'}. Best is trial 443 with value: 0.8222222222222222.
[I 2024-10-13 11:30:27,086] Trial 488 finished with value: 0.8222222222222222 and parameters: {'x_0_0': 'ac', 'x_0_1': 'ad', 'x_0_2': 'oo', 'x_1_0': 'oo', 'x_1_1': 'bc', 'x_1_2': 'oo'}. Best is trial 443 with value: 0.8222222222222222.
[I 2024-10-13 11:30:27,116] Trial 489 finished with value: 0.8222222222222222 and parameters: {'x_0_0': 'ac', 'x_0_1': 'ad', 'x_0_2': 'oo', 'x_1_0': 'oo', 'x_1_1': 'bc', 'x_1_2': 'oo'}. Best is trial 443 with value: 0.8222222222222222.
[I 2024-10-13 11:30:27,146] Trial 490 finished with value: 1.0222222222222221 and parameters: {'x_0_0': 'ac', 'x_0_1': 'ad', 'x_0_2': 'oo', 'x_1_0': 'ac', 'x_1_1': 'bc', 'x_1_2': 'oo'}. Best is trial 443 with value: 0.8222222222222222.
[I 2024-10-13 11:30:27,176] Trial 491 finished with value: 0.8222222222222222 and parameters: {'x_0_0': 'ac', 'x_0_1': 'ad', 'x_0_2': 'oo', 'x_1_0': 'oo', 'x_1_1': 'bc', 'x_1_2': 'oo'}. Best is trial 443 with value: 0.8222222222222222.
[I 2024-10-13 11:30:27,206] Trial 492 finished with value: 1.1222222222222222 and parameters: {'x_0_0': 'ac', 'x_0_1': 'ad', 'x_0_2': 'oo', 'x_1_0': 'bd', 'x_1_1': 'bc', 'x_1_2': 'bd'}. Best is trial 443 with value: 0.8222222222222222.
[I 2024-10-13 11:30:27,236] Trial 493 finished with value: 1.2666666666666666 and parameters: {'x_0_0': 'ac', 'x_0_1': 'bd', 'x_0_2': 'oo', 'x_1_0': 'oo', 'x_1_1': 'bc', 'x_1_2': 'oo'}. Best is trial 443 with value: 0.8222222222222222.
[I 2024-10-13 11:30:27,266] Trial 494 finished with value: 1.0444444444444443 and parameters: {'x_0_0': 'ac', 'x_0_1': 'ac', 'x_0_2': 'oo', 'x_1_0': 'oo', 'x_1_1': 'bc', 'x_1_2': 'oo'}. Best is trial 443 with value: 0.8222222222222222.
[I 2024-10-13 11:30:27,296] Trial 495 finished with value: 0.8222222222222222 and parameters: {'x_0_0': 'ac', 'x_0_1': 'ad', 'x_0_2': 'oo', 'x_1_0': 'oo', 'x_1_1': 'bc', 'x_1_2': 'oo'}. Best is trial 443 with value: 0.8222222222222222.
[I 2024-10-13 11:30:27,326] Trial 496 finished with value: 0.8222222222222222 and parameters: {'x_0_0': 'ac', 'x_0_1': 'ad', 'x_0_2': 'oo', 'x_1_0': 'oo', 'x_1_1': 'bc', 'x_1_2': 'oo'}. Best is trial 443 with value: 0.8222222222222222.
[I 2024-10-13 11:30:27,357] Trial 497 finished with value: 0.9222222222222222 and parameters: {'x_0_0': 'ac', 'x_0_1': 'ad', 'x_0_2': 'oo', 'x_1_0': 'oo', 'x_1_1': 'bc', 'x_1_2': 'cd'}. Best is trial 443 with value: 0.8222222222222222.
[I 2024-10-13 11:30:27,388] Trial 498 finished with value: 0.8222222222222222 and parameters: {'x_0_0': 'ac', 'x_0_1': 'ad', 'x_0_2': 'oo', 'x_1_0': 'oo', 'x_1_1': 'bc', 'x_1_2': 'oo'}. Best is trial 443 with value: 0.8222222222222222.
[I 2024-10-13 11:30:27,418] Trial 499 finished with value: 0.8222222222222222 and parameters: {'x_0_0': 'ac', 'x_0_1': 'ad', 'x_0_2': 'oo', 'x_1_0': 'oo', 'x_1_1': 'bc', 'x_1_2': 'oo'}. Best is trial 443 with value: 0.8222222222222222.
2024-10-13 11:30:27,432 - INFO - Best value: 0.8222222222222222
2024-10-13 11:30:27,434 - INFO - Best params: {'x_0_0': 'bc', 'x_0_1': 'ad', 'x_0_2': 'oo', 'x_1_0': 'oo', 'x_1_1': 'bd', 'x_1_2': 'oo'}
2024-10-13 11:30:27,434 - INFO - Best Direction Matrix:
[['bc' 'ad' 'oo']
 ['oo' 'bd' 'oo']]
