[I 2024-10-13 11:31:02,522] Trial 499 finished with value: 1.6 and parameters: {'x_0_0': 'oo', 'x_0_1': 'ab', 'x_0_2': 'ab', 'x_1_0': 'oo', 'x_1_1': 'oo', 'x_1_2': 'cd'}. Best is trial 119 with value: 0.7.
2024-10-13 11:31:02,536 - INFO - Best value: 0.7
2024-10-13 11:31:02,539 - INFO - Best params: {'x_0_0': 'bc', 'x_0_1': 'ac', 'x_0_2': 'ad', 'x_1_0': 'oo', 'x_1_1': 'oo', 'x_1_2': 'bc'}
2024-10-13 11:31:02,539 - INFO - Best Direction Matrix:
[['bc' 'ac' 'ad']
 ['oo' 'oo' 'bc']]
