[I 2024-10-13 11:30:04,620] Trial 281 finished with value: 2.0 and parameters: {'x_0_0': 'cd', 'x_0_1': 'ab', 'x_0_2': 'cd', 'x_1_0': 'ab', 'x_1_1': 'bd', 'x_1_2': 'bd'}. Best is trial 269 with value: 0.7222222222222222.
[I 2024-10-13 11:30:04,662] Trial 282 finished with value: 1.9 and parameters: {'x_0_0': 'cd', 'x_0_1': 'bd', 'x_0_2': 'bd', 'x_1_0': 'bd', 'x_1_1': 'cd', 'x_1_2': 'oo'}. Best is trial 269 with value: 0.7222222222222222.
[I 2024-10-13 11:30:04,696] Trial 283 finished with value: 1.6666666666666665 and parameters: {'x_0_0': 'bd', 'x_0_1': 'bd', 'x_0_2': 'cd', 'x_1_0': 'ad', 'x_1_1': 'ab', 'x_1_2': 'cd'}. Best is trial 269 with value: 0.7222222222222222.
[I 2024-10-13 11:30:04,738] Trial 284 finished with value: 1.6666666666666665 and parameters: {'x_0_0': 'ad', 'x_0_1': 'ac', 'x_0_2': 'ad', 'x_1_0': 'ac', 'x_1_1': 'ab', 'x_1_2': 'ab'}. Best is trial 269 with value: 0.7222222222222222.
[I 2024-10-13 11:30:04,774] Trial 285 finished with value: 1.6666666666666665 and parameters: {'x_0_0': 'ad', 'x_0_1': 'bc', 'x_0_2': 'bc', 'x_1_0': 'ad', 'x_1_1': 'bc', 'x_1_2': 'ad'}. Best is trial 269 with value: 0.7222222222222222.
[I 2024-10-13 11:30:04,817] Trial 286 finished with value: 1.7 and parameters: {'x_0_0': 'oo', 'x_0_1': 'bd', 'x_0_2': 'bd', 'x_1_0': 'oo', 'x_1_1': 'ac', 'x_1_2': 'cd'}. Best is trial 269 with value: 0.7222222222222222.
[I 2024-10-13 11:30:04,885] Trial 287 finished with value: 0.9666666666666667 and parameters: {'x_0_0': 'bc', 'x_0_1': 'oo', 'x_0_2': 'oo', 'x_1_0': 'oo', 'x_1_1': 'ac', 'x_1_2': 'ab'}. Best is trial 269 with value: 0.7222222222222222.
[I 2024-10-13 11:30:04,947] Trial 288 finished with value: 1.4444444444444444 and parameters: {'x_0_0': 'bd', 'x_0_1': 'ad', 'x_0_2': 'ad', 'x_1_0': 'bc', 'x_1_1': 'cd', 'x_1_2': 'ab'}. Best is trial 269 with value: 0.7222222222222222.
[I 2024-10-13 11:30:05,000] Trial 289 finished with value: 1.2222222222222223 and parameters: {'x_0_0': 'bc', 'x_0_1': 'ac', 'x_0_2': 'ad', 'x_1_0': 'ac', 'x_1_1': 'bd', 'x_1_2': 'cd'}. Best is trial 269 with value: 0.7222222222222222.
[I 2024-10-13 11:30:05,063] Trial 290 finished with value: 1.6666666666666665 and parameters: {'x_0_0': 'ac', 'x_0_1': 'bc', 'x_0_2': 'ac', 'x_1_0': 'bd', 'x_1_1': 'bd', 'x_1_2': 'ad'}. Best is trial 269 with value: 0.7222222222222222.
[I 2024-10-13 11:30:05,117] Trial 291 finished with value: 1.6666666666666665 and parameters: {'x_0_0': 'bd', 'x_0_1': 'ad', 'x_0_2': 'cd', 'x_1_0': 'ad', 'x_1_1': 'cd', 'x_1_2': 'cd'}. Best is trial 269 with value: 0.7222222222222222.
[I 2024-10-13 11:30:05,159] Trial 292 finished with value: 1.7777777777777777 and parameters: {'x_0_0': 'ab', 'x_0_1': 'ab', 'x_0_2': 'ac', 'x_1_0': 'ab', 'x_1_1': 'bd', 'x_1_2': 'cd'}. Best is trial 269 with value: 0.7222222222222222.
[I 2024-10-13 11:30:05,187] Trial 293 finished with value: 1.2222222222222223 and parameters: {'x_0_0': 'ac', 'x_0_1': 'ad', 'x_0_2': 'ab', 'x_1_0': 'bd', 'x_1_1': 'bc', 'x_1_2': 'bc'}. Best is trial 269 with value: 0.7222222222222222.
[I 2024-10-13 11:30:05,217] Trial 294 finished with value: 1.7999999999999998 and parameters: {'x_0_0': 'oo', 'x_0_1': 'bc', 'x_0_2': 'ab', 'x_1_0': 'cd', 'x_1_1': 'oo', 'x_1_2': 'cd'}. Best is trial 269 with value: 0.7222222222222222.
[I 2024-10-13 11:30:05,251] Trial 295 finished with value: 1.4666666666666666 and parameters: {'x_0_0': 'bc', 'x_0_1': 'cd', 'x_0_2': 'oo', 'x_1_0': 'bd', 'x_1_1': 'ad', 'x_1_2': 'oo'}. Best is trial 269 with value: 0.7222222222222222.
[I 2024-10-13 11:30:05,284] Trial 296 finished with value: 0.9666666666666667 and parameters: {'x_0_0': 'bd', 'x_0_1': 'oo', 'x_0_2': 'cd', 'x_1_0': 'oo', 'x_1_1': 'cd', 'x_1_2': 'oo'}. Best is trial 269 with value: 0.7222222222222222.
[I 2024-10-13 11:30:05,324] Trial 297 finished with value: 1.7999999999999998 and parameters: {'x_0_0': 'oo', 'x_0_1': 'bd', 'x_0_2': 'bc', 'x_1_0': 'cd', 'x_1_1': 'oo', 'x_1_2': 'ac'}. Best is trial 269 with value: 0.7222222222222222.
[I 2024-10-13 11:30:05,392] Trial 298 finished with value: 2.0 and parameters: {'x_0_0': 'cd', 'x_0_1': 'cd', 'x_0_2': 'ab', 'x_1_0': 'cd', 'x_1_1': 'bc', 'x_1_2': 'bd'}. Best is trial 269 with value: 0.7222222222222222.
[I 2024-10-13 11:30:05,453] Trial 299 finished with value: 1.4555555555555557 and parameters: {'x_0_0': 'ad', 'x_0_1': 'bc', 'x_0_2': 'ac', 'x_1_0': 'ab', 'x_1_1': 'ad', 'x_1_2': 'oo'}. Best is trial 269 with value: 0.7222222222222222.
[I 2024-10-13 11:30:05,503] Trial 300 finished with value: 1.4666666666666666 and parameters: {'x_0_0': 'bd', 'x_0_1': 'ad', 'x_0_2': 'bc', 'x_1_0': 'oo', 'x_1_1': 'ac', 'x_1_2': 'ab'}. Best is trial 269 with value: 0.7222222222222222.
[I 2024-10-13 11:30:05,534] Trial 301 finished with value: 1.6666666666666665 and parameters: {'x_0_0': 'bc', 'x_0_1': 'bc', 'x_0_2': 'cd', 'x_1_0': 'ab', 'x_1_1': 'bd', 'x_1_2': 'bd'}. Best is trial 269 with value: 0.7222222222222222.
[I 2024-10-13 11:30:05,567] Trial 302 finished with value: 1.6666666666666665 and parameters: {'x_0_0': 'ad', 'x_0_1': 'ad', 'x_0_2': 'bd', 'x_1_0': 'ac', 'x_1_1': 'ab', 'x_1_2': 'bd'}. Best is trial 269 with value: 0.7222222222222222.
[I 2024-10-13 11:30:05,596] Trial 303 finished with value: 1.6666666666666665 and parameters: {'x_0_0': 'ad', 'x_0_1': 'bc', 'x_0_2': 'cd', 'x_1_0': 'ac', 'x_1_1': 'cd', 'x_1_2': 'ab'}. Best is trial 269 with value: 0.7222222222222222.
[I 2024-10-13 11:30:05,620] Trial 304 finished with value: 1.7999999999999998 and parameters: {'x_0_0': 'cd', 'x_0_1': 'bc', 'x_0_2': 'ac', 'x_1_0': 'oo', 'x_1_1': 'bd', 'x_1_2': 'ac'}. Best is trial 269 with value: 0.7222222222222222.
[I 2024-10-13 11:30:05,647] Trial 305 finished with value: 1.1666666666666665 and parameters: {'x_0_0': 'ac', 'x_0_1': 'oo', 'x_0_2': 'ab', 'x_1_0': 'ab', 'x_1_1': 'oo', 'x_1_2': 'ad'}. Best is trial 269 with value: 0.7222222222222222.
[I 2024-10-13 11:30:05,672] Trial 306 finished with value: 1.5555555555555556 and parameters: {'x_0_0': 'bd', 'x_0_1': 'cd', 'x_0_2': 'ac', 'x_1_0': 'ab', 'x_1_1': 'ad', 'x_1_2': 'ad'}. Best is trial 269 with value: 0.7222222222222222.
[I 2024-10-13 11:30:05,696] Trial 307 finished with value: 1.4666666666666666 and parameters: {'x_0_0': 'ac', 'x_0_1': 'bd', 'x_0_2': 'bc', 'x_1_0': 'oo', 'x_1_1': 'ad', 'x_1_2': 'bc'}. Best is trial 269 with value: 0.7222222222222222.
[I 2024-10-13 11:30:05,719] Trial 308 finished with value: 1.4666666666666666 and parameters: {'x_0_0': 'bd', 'x_0_1': 'ac', 'x_0_2': 'ab', 'x_1_0': 'oo', 'x_1_1': 'bc', 'x_1_2': 'ac'}. Best is trial 269 with value: 0.7222222222222222.
[I 2024-10-13 11:30:05,741] Trial 309 finished with value: 1.5666666666666667 and parameters: {'x_0_0': 'bd', 'x_0_1': 'ad', 'x_0_2': 'bc', 'x_1_0': 'ad', 'x_1_1': 'oo', 'x_1_2': 'ab'}. Best is trial 269 with value: 0.7222222222222222.
[I 2024-10-13 11:30:05,765] Trial 310 finished with value: 1.3444444444444446 and parameters: {'x_0_0': 'bc', 'x_0_1': 'ac', 'x_0_2': 'cd', 'x_1_0': 'cd', 'x_1_1': 'bc', 'x_1_2': 'oo'}. Best is trial 269 with value: 0.7222222222222222.
[I 2024-10-13 11:30:05,786] Trial 311 finished with value: 1.5555555555555556 and parameters: {'x_0_0': 'bc', 'x_0_1': 'ab', 'x_0_2': 'bd', 'x_1_0': 'cd', 'x_1_1': 'bc', 'x_1_2': 'bd'}. Best is trial 269 with value: 0.7222222222222222.
[I 2024-10-13 11:30:05,807] Trial 312 finished with value: 1.3666666666666667 and parameters: {'x_0_0': 'bc', 'x_0_1': 'bc', 'x_0_2': 'bc', 'x_1_0': 'oo', 'x_1_1': 'cd', 'x_1_2': 'oo'}. Best is trial 269 with value: 0.7222222222222222.
[I 2024-10-13 11:30:05,828] Trial 313 finished with value: 1.6777777777777778 and parameters: {'x_0_0': 'ab', 'x_0_1': 'ac', 'x_0_2': 'bc', 'x_1_0': 'bc', 'x_1_1': 'oo', 'x_1_2': 'bc'}. Best is trial 269 with value: 0.7222222222222222.
[I 2024-10-13 11:30:05,848] Trial 314 finished with value: 2.0 and parameters: {'x_0_0': 'cd', 'x_0_1': 'ab', 'x_0_2': 'ac', 'x_1_0': 'bd', 'x_1_1': 'bd', 'x_1_2': 'ad'}. Best is trial 269 with value: 0.7222222222222222.
[I 2024-10-13 11:30:05,869] Trial 315 finished with value: 1.9 and parameters: {'x_0_0': 'oo', 'x_0_1': 'cd', 'x_0_2': 'bc', 'x_1_0': 'bd', 'x_1_1': 'ac', 'x_1_2': 'ab'}. Best is trial 269 with value: 0.7222222222222222.
[I 2024-10-13 11:30:05,891] Trial 316 finished with value: 1.0666666666666667 and parameters: {'x_0_0': 'ad', 'x_0_1': 'oo', 'x_0_2': 'ac', 'x_1_0': 'oo', 'x_1_1': 'bd', 'x_1_2': 'ab'}. Best is trial 269 with value: 0.7222222222222222.
[I 2024-10-13 11:30:05,952] Trial 317 finished with value: 1.1333333333333333 and parameters: {'x_0_0': 'ac', 'x_0_1': 'ac', 'x_0_2': 'ab', 'x_1_0': 'oo', 'x_1_1': 'ac', 'x_1_2': 'bd'}. Best is trial 269 with value: 0.7222222222222222.
[I 2024-10-13 11:30:05,984] Trial 318 finished with value: 1.5666666666666664 and parameters: {'x_0_0': 'ad', 'x_0_1': 'ac', 'x_0_2': 'oo', 'x_1_0': 'ac', 'x_1_1': 'ad', 'x_1_2': 'bc'}. Best is trial 269 with value: 0.7222222222222222.
[I 2024-10-13 11:30:06,010] Trial 319 finished with value: 1.4666666666666666 and parameters: {'x_0_0': 'bd', 'x_0_1': 'cd', 'x_0_2': 'ab', 'x_1_0': 'oo', 'x_1_1': 'ac', 'x_1_2': 'bc'}. Best is trial 269 with value: 0.7222222222222222.
[I 2024-10-13 11:30:06,039] Trial 320 finished with value: 1.3555555555555556 and parameters: {'x_0_0': 'ac', 'x_0_1': 'ab', 'x_0_2': 'bd', 'x_1_0': 'oo', 'x_1_1': 'ab', 'x_1_2': 'ac'}. Best is trial 269 with value: 0.7222222222222222.
[I 2024-10-13 11:30:06,069] Trial 321 finished with value: 2.0 and parameters: {'x_0_0': 'cd', 'x_0_1': 'ac', 'x_0_2': 'bc', 'x_1_0': 'cd', 'x_1_1': 'ac', 'x_1_2': 'cd'}. Best is trial 269 with value: 0.7222222222222222.
[I 2024-10-13 11:30:06,093] Trial 322 finished with value: 1.3444444444444446 and parameters: {'x_0_0': 'bc', 'x_0_1': 'ad', 'x_0_2': 'ac', 'x_1_0': 'ac', 'x_1_1': 'ad', 'x_1_2': 'oo'}. Best is trial 269 with value: 0.7222222222222222.
[I 2024-10-13 11:30:06,116] Trial 323 finished with value: 1.5555555555555556 and parameters: {'x_0_0': 'bc', 'x_0_1': 'ab', 'x_0_2': 'cd', 'x_1_0': 'ad', 'x_1_1': 'ac', 'x_1_2': 'bc'}. Best is trial 269 with value: 0.7222222222222222.
[I 2024-10-13 11:30:06,142] Trial 324 finished with value: 1.9 and parameters: {'x_0_0': 'cd', 'x_0_1': 'ad', 'x_0_2': 'ab', 'x_1_0': 'ac', 'x_1_1': 'ad', 'x_1_2': 'oo'}. Best is trial 269 with value: 0.7222222222222222.
[I 2024-10-13 11:30:06,165] Trial 325 finished with value: 1.7999999999999998 and parameters: {'x_0_0': 'oo', 'x_0_1': 'bc', 'x_0_2': 'bc', 'x_1_0': 'cd', 'x_1_1': 'bc', 'x_1_2': 'oo'}. Best is trial 269 with value: 0.7222222222222222.
[I 2024-10-13 11:30:06,187] Trial 326 finished with value: 1.6666666666666665 and parameters: {'x_0_0': 'bc', 'x_0_1': 'cd', 'x_0_2': 'ab', 'x_1_0': 'ab', 'x_1_1': 'bc', 'x_1_2': 'ac'}. Best is trial 269 with value: 0.7222222222222222.
[I 2024-10-13 11:30:06,228] Trial 327 finished with value: 1.5555555555555556 and parameters: {'x_0_0': 'ac', 'x_0_1': 'ab', 'x_0_2': 'ac', 'x_1_0': 'ad', 'x_1_1': 'bd', 'x_1_2': 'ab'}. Best is trial 269 with value: 0.7222222222222222.
[I 2024-10-13 11:30:06,249] Trial 328 finished with value: 1.3777777777777778 and parameters: {'x_0_0': 'ab', 'x_0_1': 'oo', 'x_0_2': 'ac', 'x_1_0': 'bc', 'x_1_1': 'bd', 'x_1_2': 'cd'}. Best is trial 269 with value: 0.7222222222222222.
[I 2024-10-13 11:30:06,273] Trial 329 finished with value: 1.5555555555555556 and parameters: {'x_0_0': 'bd', 'x_0_1': 'bd', 'x_0_2': 'bc', 'x_1_0': 'ab', 'x_1_1': 'ab', 'x_1_2': 'ab'}. Best is trial 269 with value: 0.7222222222222222.
[I 2024-10-13 11:30:06,296] Trial 330 finished with value: 2.0 and parameters: {'x_0_0': 'cd', 'x_0_1': 'ad', 'x_0_2': 'ac', 'x_1_0': 'bc', 'x_1_1': 'cd', 'x_1_2': 'bd'}. Best is trial 269 with value: 0.7222222222222222.
[I 2024-10-13 11:30:06,321] Trial 331 finished with value: 1.5666666666666667 and parameters: {'x_0_0': 'bc', 'x_0_1': 'cd', 'x_0_2': 'ab', 'x_1_0': 'bc', 'x_1_1': 'oo', 'x_1_2': 'bc'}. Best is trial 269 with value: 0.7222222222222222.
[I 2024-10-13 11:30:06,345] Trial 332 finished with value: 1.5 and parameters: {'x_0_0': 'oo', 'x_0_1': 'oo', 'x_0_2': 'ad', 'x_1_0': 'ab', 'x_1_1': 'bc', 'x_1_2': 'ab'}. Best is trial 269 with value: 0.7222222222222222.
[I 2024-10-13 11:30:06,371] Trial 333 finished with value: 1.8 and parameters: {'x_0_0': 'oo', 'x_0_1': 'cd', 'x_0_2': 'oo', 'x_1_0': 'cd', 'x_1_1': 'ac', 'x_1_2': 'cd'}. Best is trial 269 with value: 0.7222222222222222.
[I 2024-10-13 11:30:06,393] Trial 334 finished with value: 1.6777777777777778 and parameters: {'x_0_0': 'ab', 'x_0_1': 'ab', 'x_0_2': 'bd', 'x_1_0': 'ad', 'x_1_1': 'oo', 'x_1_2': 'ab'}. Best is trial 269 with value: 0.7222222222222222.
[I 2024-10-13 11:30:06,417] Trial 335 finished with value: 1.6666666666666665 and parameters: {'x_0_0': 'bd', 'x_0_1': 'ac', 'x_0_2': 'ab', 'x_1_0': 'cd', 'x_1_1': 'bc', 'x_1_2': 'bc'}. Best is trial 269 with value: 0.7222222222222222.
[I 2024-10-13 11:30:06,440] Trial 336 finished with value: 1.6666666666666665 and parameters: {'x_0_0': 'ac', 'x_0_1': 'bc', 'x_0_2': 'ad', 'x_1_0': 'bd', 'x_1_1': 'ab', 'x_1_2': 'cd'}. Best is trial 269 with value: 0.7222222222222222.
[I 2024-10-13 11:30:06,464] Trial 337 finished with value: 1.7777777777777777 and parameters: {'x_0_0': 'ab', 'x_0_1': 'ab', 'x_0_2': 'cd', 'x_1_0': 'ac', 'x_1_1': 'bc', 'x_1_2': 'bc'}. Best is trial 269 with value: 0.7222222222222222.
[I 2024-10-13 11:30:06,489] Trial 338 finished with value: 2.0 and parameters: {'x_0_0': 'cd', 'x_0_1': 'ad', 'x_0_2': 'bd', 'x_1_0': 'cd', 'x_1_1': 'ac', 'x_1_2': 'bc'}. Best is trial 269 with value: 0.7222222222222222.
[I 2024-10-13 11:30:06,514] Trial 339 finished with value: 2.0 and parameters: {'x_0_0': 'cd', 'x_0_1': 'ac', 'x_0_2': 'ac', 'x_1_0': 'bc', 'x_1_1': 'ad', 'x_1_2': 'ac'}. Best is trial 269 with value: 0.7222222222222222.
[I 2024-10-13 11:30:06,540] Trial 340 finished with value: 1.5666666666666667 and parameters: {'x_0_0': 'ac', 'x_0_1': 'cd', 'x_0_2': 'bd', 'x_1_0': 'ab', 'x_1_1': 'oo', 'x_1_2': 'ad'}. Best is trial 269 with value: 0.7222222222222222.
[I 2024-10-13 11:30:06,563] Trial 341 finished with value: 2.0 and parameters: {'x_0_0': 'cd', 'x_0_1': 'ab', 'x_0_2': 'ad', 'x_1_0': 'ab', 'x_1_1': 'ad', 'x_1_2': 'ab'}. Best is trial 269 with value: 0.7222222222222222.
[I 2024-10-13 11:30:06,594] Trial 342 finished with value: 1.5666666666666664 and parameters: {'x_0_0': 'bd', 'x_0_1': 'cd', 'x_0_2': 'oo', 'x_1_0': 'cd', 'x_1_1': 'bc', 'x_1_2': 'ad'}. Best is trial 269 with value: 0.7222222222222222.
[I 2024-10-13 11:30:06,616] Trial 343 finished with value: 1.9 and parameters: {'x_0_0': 'cd', 'x_0_1': 'bd', 'x_0_2': 'ad', 'x_1_0': 'ad', 'x_1_1': 'oo', 'x_1_2': 'bd'}. Best is trial 269 with value: 0.7222222222222222.
[I 2024-10-13 11:30:06,639] Trial 344 finished with value: 2.0 and parameters: {'x_0_0': 'cd', 'x_0_1': 'ad', 'x_0_2': 'bc', 'x_1_0': 'bd', 'x_1_1': 'ab', 'x_1_2': 'ab'}. Best is trial 269 with value: 0.7222222222222222.
[I 2024-10-13 11:30:06,660] Trial 345 finished with value: 1.6666666666666665 and parameters: {'x_0_0': 'ad', 'x_0_1': 'ac', 'x_0_2': 'ab', 'x_1_0': 'cd', 'x_1_1': 'cd', 'x_1_2': 'cd'}. Best is trial 269 with value: 0.7222222222222222.
[I 2024-10-13 11:30:06,680] Trial 346 finished with value: 1.4666666666666666 and parameters: {'x_0_0': 'bc', 'x_0_1': 'bc', 'x_0_2': 'bc', 'x_1_0': 'oo', 'x_1_1': 'bd', 'x_1_2': 'ab'}. Best is trial 269 with value: 0.7222222222222222.
[I 2024-10-13 11:30:06,701] Trial 347 finished with value: 1.9 and parameters: {'x_0_0': 'oo', 'x_0_1': 'ad', 'x_0_2': 'bd', 'x_1_0': 'bc', 'x_1_1': 'ac', 'x_1_2': 'bd'}. Best is trial 269 with value: 0.7222222222222222.
[I 2024-10-13 11:30:06,721] Trial 348 finished with value: 1.8 and parameters: {'x_0_0': 'oo', 'x_0_1': 'ad', 'x_0_2': 'oo', 'x_1_0': 'ab', 'x_1_1': 'bc', 'x_1_2': 'ac'}. Best is trial 269 with value: 0.7222222222222222.
[I 2024-10-13 11:30:06,741] Trial 349 finished with value: 1.6666666666666665 and parameters: {'x_0_0': 'ad', 'x_0_1': 'ab', 'x_0_2': 'ad', 'x_1_0': 'cd', 'x_1_1': 'cd', 'x_1_2': 'bc'}. Best is trial 269 with value: 0.7222222222222222.
[I 2024-10-13 11:30:06,763] Trial 350 finished with value: 1.9 and parameters: {'x_0_0': 'cd', 'x_0_1': 'ad', 'x_0_2': 'oo', 'x_1_0': 'ac', 'x_1_1': 'ab', 'x_1_2': 'ab'}. Best is trial 269 with value: 0.7222222222222222.
[I 2024-10-13 11:30:06,784] Trial 351 finished with value: 1.3444444444444443 and parameters: {'x_0_0': 'ad', 'x_0_1': 'ac', 'x_0_2': 'oo', 'x_1_0': 'bd', 'x_1_1': 'bc', 'x_1_2': 'ad'}. Best is trial 269 with value: 0.7222222222222222.
[I 2024-10-13 11:30:06,805] Trial 352 finished with value: 1.3777777777777778 and parameters: {'x_0_0': 'ab', 'x_0_1': 'oo', 'x_0_2': 'ac', 'x_1_0': 'bd', 'x_1_1': 'cd', 'x_1_2': 'ac'}. Best is trial 269 with value: 0.7222222222222222.
[I 2024-10-13 11:30:06,824] Trial 353 finished with value: 1.6777777777777778 and parameters: {'x_0_0': 'ab', 'x_0_1': 'bd', 'x_0_2': 'ab', 'x_1_0': 'bc', 'x_1_1': 'oo', 'x_1_2': 'bd'}. Best is trial 269 with value: 0.7222222222222222.
[I 2024-10-13 11:30:06,844] Trial 354 finished with value: 1.5555555555555556 and parameters: {'x_0_0': 'bc', 'x_0_1': 'ab', 'x_0_2': 'cd', 'x_1_0': 'ad', 'x_1_1': 'ad', 'x_1_2': 'ac'}. Best is trial 269 with value: 0.7222222222222222.
[I 2024-10-13 11:30:06,867] Trial 355 finished with value: 1.7 and parameters: {'x_0_0': 'oo', 'x_0_1': 'ac', 'x_0_2': 'ab', 'x_1_0': 'oo', 'x_1_1': 'bd', 'x_1_2': 'bc'}. Best is trial 269 with value: 0.7222222222222222.
[I 2024-10-13 11:30:06,887] Trial 356 finished with value: 1.7999999999999998 and parameters: {'x_0_0': 'oo', 'x_0_1': 'ad', 'x_0_2': 'bd', 'x_1_0': 'ad', 'x_1_1': 'oo', 'x_1_2': 'ac'}. Best is trial 269 with value: 0.7222222222222222.
[I 2024-10-13 11:30:06,908] Trial 357 finished with value: 1.9 and parameters: {'x_0_0': 'cd', 'x_0_1': 'ad', 'x_0_2': 'oo', 'x_1_0': 'bd', 'x_1_1': 'cd', 'x_1_2': 'bc'}. Best is trial 269 with value: 0.7222222222222222.
[I 2024-10-13 11:30:06,929] Trial 358 finished with value: 1.3 and parameters: {'x_0_0': 'oo', 'x_0_1': 'oo', 'x_0_2': 'ad', 'x_1_0': 'oo', 'x_1_1': 'bd', 'x_1_2': 'bd'}. Best is trial 269 with value: 0.7222222222222222.
[I 2024-10-13 11:30:06,951] Trial 359 finished with value: 1.0 and parameters: {'x_0_0': 'ad', 'x_0_1': 'cd', 'x_0_2': 'bc', 'x_1_0': 'bc', 'x_1_1': 'ac', 'x_1_2': 'ad'}. Best is trial 269 with value: 0.7222222222222222.
[I 2024-10-13 11:30:06,973] Trial 360 finished with value: 1.4 and parameters: {'x_0_0': 'oo', 'x_0_1': 'oo', 'x_0_2': 'oo', 'x_1_0': 'ab', 'x_1_1': 'bd', 'x_1_2': 'cd'}. Best is trial 269 with value: 0.7222222222222222.
[I 2024-10-13 11:30:06,994] Trial 361 finished with value: 1.5 and parameters: {'x_0_0': 'oo', 'x_0_1': 'oo', 'x_0_2': 'bc', 'x_1_0': 'bd', 'x_1_1': 'ab', 'x_1_2': 'ad'}. Best is trial 269 with value: 0.7222222222222222.
[I 2024-10-13 11:30:07,015] Trial 362 finished with value: 1.4555555555555557 and parameters: {'x_0_0': 'bc', 'x_0_1': 'ab', 'x_0_2': 'cd', 'x_1_0': 'bd', 'x_1_1': 'ad', 'x_1_2': 'oo'}. Best is trial 269 with value: 0.7222222222222222.
[I 2024-10-13 11:30:07,036] Trial 363 finished with value: 2.0 and parameters: {'x_0_0': 'cd', 'x_0_1': 'ac', 'x_0_2': 'cd', 'x_1_0': 'ab', 'x_1_1': 'cd', 'x_1_2': 'bc'}. Best is trial 269 with value: 0.7222222222222222.
[I 2024-10-13 11:30:07,072] Trial 364 finished with value: 1.2222222222222223 and parameters: {'x_0_0': 'bc', 'x_0_1': 'ad', 'x_0_2': 'ac', 'x_1_0': 'ac', 'x_1_1': 'bd', 'x_1_2': 'bc'}. Best is trial 269 with value: 0.7222222222222222.
[I 2024-10-13 11:30:07,093] Trial 365 finished with value: 1.4777777777777779 and parameters: {'x_0_0': 'ab', 'x_0_1': 'bd', 'x_0_2': 'ad', 'x_1_0': 'oo', 'x_1_1': 'oo', 'x_1_2': 'cd'}. Best is trial 269 with value: 0.7222222222222222.
[I 2024-10-13 11:30:07,113] Trial 366 finished with value: 1.3444444444444446 and parameters: {'x_0_0': 'ad', 'x_0_1': 'bc', 'x_0_2': 'bd', 'x_1_0': 'bc', 'x_1_1': 'oo', 'x_1_2': 'bd'}. Best is trial 269 with value: 0.7222222222222222.
[I 2024-10-13 11:30:07,133] Trial 367 finished with value: 1.9 and parameters: {'x_0_0': 'oo', 'x_0_1': 'ad', 'x_0_2': 'bc', 'x_1_0': 'cd', 'x_1_1': 'cd', 'x_1_2': 'ad'}. Best is trial 269 with value: 0.7222222222222222.
[I 2024-10-13 11:30:07,153] Trial 368 finished with value: 1.6666666666666665 and parameters: {'x_0_0': 'ad', 'x_0_1': 'cd', 'x_0_2': 'ab', 'x_1_0': 'ac', 'x_1_1': 'cd', 'x_1_2': 'ab'}. Best is trial 269 with value: 0.7222222222222222.
[I 2024-10-13 11:30:07,173] Trial 369 finished with value: 1.5555555555555556 and parameters: {'x_0_0': 'bd', 'x_0_1': 'bc', 'x_0_2': 'ac', 'x_1_0': 'ab', 'x_1_1': 'cd', 'x_1_2': 'ac'}. Best is trial 269 with value: 0.7222222222222222.
[I 2024-10-13 11:30:07,192] Trial 370 finished with value: 1.3444444444444446 and parameters: {'x_0_0': 'ad', 'x_0_1': 'bd', 'x_0_2': 'cd', 'x_1_0': 'bc', 'x_1_1': 'oo', 'x_1_2': 'cd'}. Best is trial 269 with value: 0.7222222222222222.
[I 2024-10-13 11:30:07,211] Trial 371 finished with value: 1.9 and parameters: {'x_0_0': 'oo', 'x_0_1': 'cd', 'x_0_2': 'ad', 'x_1_0': 'ad', 'x_1_1': 'ad', 'x_1_2': 'cd'}. Best is trial 269 with value: 0.7222222222222222.
[I 2024-10-13 11:30:07,234] Trial 372 finished with value: 1.2666666666666666 and parameters: {'x_0_0': 'bc', 'x_0_1': 'oo', 'x_0_2': 'ab', 'x_1_0': 'bc', 'x_1_1': 'ab', 'x_1_2': 'bc'}. Best is trial 269 with value: 0.7222222222222222.
[I 2024-10-13 11:30:07,261] Trial 373 finished with value: 1.5666666666666664 and parameters: {'x_0_0': 'bc', 'x_0_1': 'cd', 'x_0_2': 'oo', 'x_1_0': 'ad', 'x_1_1': 'ad', 'x_1_2': 'ab'}. Best is trial 269 with value: 0.7222222222222222.
[I 2024-10-13 11:30:07,282] Trial 374 finished with value: 1.6777777777777778 and parameters: {'x_0_0': 'ab', 'x_0_1': 'ab', 'x_0_2': 'bc', 'x_1_0': 'ab', 'x_1_1': 'cd', 'x_1_2': 'oo'}. Best is trial 269 with value: 0.7222222222222222.
[I 2024-10-13 11:30:07,308] Trial 375 finished with value: 1.9 and parameters: {'x_0_0': 'cd', 'x_0_1': 'cd', 'x_0_2': 'ad', 'x_1_0': 'cd', 'x_1_1': 'oo', 'x_1_2': 'ad'}. Best is trial 269 with value: 0.7222222222222222.
