[I 2024-10-13 11:31:10,538] Trial 202 finished with value: 0.7 and parameters: {'x_0_0': 'ac', 'x_0_1': 'ad', 'x_0_2': 'oo', 'x_1_0': 'oo', 'x_1_1': 'bc', 'x_1_2': 'ad'}. Best is trial 98 with value: 0.7.
[I 2024-10-13 11:31:10,579] Trial 203 finished with value: 0.7 and parameters: {'x_0_0': 'ac', 'x_0_1': 'ad', 'x_0_2': 'oo', 'x_1_0': 'oo', 'x_1_1': 'bc', 'x_1_2': 'ad'}. Best is trial 98 with value: 0.7.
[I 2024-10-13 11:31:10,613] Trial 204 finished with value: 1.3666666666666667 and parameters: {'x_0_0': 'bd', 'x_0_1': 'ad', 'x_0_2': 'oo', 'x_1_0': 'oo', 'x_1_1': 'bc', 'x_1_2': 'ad'}. Best is trial 98 with value: 0.7.
[I 2024-10-13 11:31:10,646] Trial 205 finished with value: 0.8999999999999999 and parameters: {'x_0_0': 'ac', 'x_0_1': 'ad', 'x_0_2': 'oo', 'x_1_0': 'cd', 'x_1_1': 'bc', 'x_1_2': 'ad'}. Best is trial 98 with value: 0.7.
[I 2024-10-13 11:31:10,715] Trial 206 finished with value: 0.7 and parameters: {'x_0_0': 'ac', 'x_0_1': 'ad', 'x_0_2': 'oo', 'x_1_0': 'oo', 'x_1_1': 'bc', 'x_1_2': 'ad'}. Best is trial 98 with value: 0.7.
[I 2024-10-13 11:31:10,754] Trial 207 finished with value: 1.2666666666666666 and parameters: {'x_0_0': 'ac', 'x_0_1': 'bd', 'x_0_2': 'oo', 'x_1_0': 'oo', 'x_1_1': 'bc', 'x_1_2': 'oo'}. Best is trial 98 with value: 0.7.
[I 2024-10-13 11:31:10,798] Trial 208 finished with value: 0.8111111111111111 and parameters: {'x_0_0': 'ac', 'x_0_1': 'ad', 'x_0_2': 'oo', 'x_1_0': 'oo', 'x_1_1': 'bc', 'x_1_2': 'ab'}. Best is trial 98 with value: 0.7.
[I 2024-10-13 11:31:10,828] Trial 209 finished with value: 1.3444444444444443 and parameters: {'x_0_0': 'ac', 'x_0_1': 'ad', 'x_0_2': 'oo', 'x_1_0': 'bc', 'x_1_1': 'ac', 'x_1_2': 'ad'}. Best is trial 98 with value: 0.7.
[I 2024-10-13 11:31:10,857] Trial 210 finished with value: 1.1444444444444444 and parameters: {'x_0_0': 'ac', 'x_0_1': 'ad', 'x_0_2': 'oo', 'x_1_0': 'oo', 'x_1_1': 'ad', 'x_1_2': 'ad'}. Best is trial 98 with value: 0.7.
[I 2024-10-13 11:31:10,884] Trial 211 finished with value: 0.7 and parameters: {'x_0_0': 'ac', 'x_0_1': 'ad', 'x_0_2': 'oo', 'x_1_0': 'oo', 'x_1_1': 'bc', 'x_1_2': 'ad'}. Best is trial 98 with value: 0.7.
[I 2024-10-13 11:31:10,914] Trial 212 finished with value: 0.7 and parameters: {'x_0_0': 'ac', 'x_0_1': 'ad', 'x_0_2': 'oo', 'x_1_0': 'oo', 'x_1_1': 'bc', 'x_1_2': 'ad'}. Best is trial 98 with value: 0.7.
[I 2024-10-13 11:31:10,943] Trial 213 finished with value: 0.7 and parameters: {'x_0_0': 'ac', 'x_0_1': 'ad', 'x_0_2': 'oo', 'x_1_0': 'oo', 'x_1_1': 'bc', 'x_1_2': 'ad'}. Best is trial 98 with value: 0.7.
[I 2024-10-13 11:31:10,971] Trial 214 finished with value: 0.7 and parameters: {'x_0_0': 'ac', 'x_0_1': 'ad', 'x_0_2': 'oo', 'x_1_0': 'oo', 'x_1_1': 'bc', 'x_1_2': 'ad'}. Best is trial 98 with value: 0.7.
[I 2024-10-13 11:31:10,999] Trial 215 finished with value: 0.7 and parameters: {'x_0_0': 'ac', 'x_0_1': 'ad', 'x_0_2': 'oo', 'x_1_0': 'oo', 'x_1_1': 'bc', 'x_1_2': 'ad'}. Best is trial 98 with value: 0.7.
[I 2024-10-13 11:31:11,026] Trial 216 finished with value: 0.9222222222222222 and parameters: {'x_0_0': 'ac', 'x_0_1': 'ad', 'x_0_2': 'oo', 'x_1_0': 'oo', 'x_1_1': 'bc', 'x_1_2': 'bc'}. Best is trial 98 with value: 0.7.
[I 2024-10-13 11:31:11,053] Trial 217 finished with value: 1.3444444444444443 and parameters: {'x_0_0': 'bc', 'x_0_1': 'ad', 'x_0_2': 'oo', 'x_1_0': 'bd', 'x_1_1': 'cd', 'x_1_2': 'ad'}. Best is trial 98 with value: 0.7.
[I 2024-10-13 11:31:11,080] Trial 218 finished with value: 1.3666666666666667 and parameters: {'x_0_0': 'ac', 'x_0_1': 'cd', 'x_0_2': 'oo', 'x_1_0': 'oo', 'x_1_1': 'bc', 'x_1_2': 'cd'}. Best is trial 98 with value: 0.7.
[I 2024-10-13 11:31:11,107] Trial 219 finished with value: 0.7999999999999999 and parameters: {'x_0_0': 'ac', 'x_0_1': 'ad', 'x_0_2': 'bd', 'x_1_0': 'oo', 'x_1_1': 'bc', 'x_1_2': 'ad'}. Best is trial 98 with value: 0.7.
[I 2024-10-13 11:31:11,133] Trial 220 finished with value: 1.0333333333333332 and parameters: {'x_0_0': 'ac', 'x_0_1': 'ad', 'x_0_2': 'oo', 'x_1_0': 'oo', 'x_1_1': 'ab', 'x_1_2': 'ac'}. Best is trial 98 with value: 0.7.
[I 2024-10-13 11:31:11,160] Trial 221 finished with value: 0.7 and parameters: {'x_0_0': 'ac', 'x_0_1': 'ad', 'x_0_2': 'oo', 'x_1_0': 'oo', 'x_1_1': 'bc', 'x_1_2': 'ad'}. Best is trial 98 with value: 0.7.
[I 2024-10-13 11:31:11,187] Trial 222 finished with value: 0.7 and parameters: {'x_0_0': 'ac', 'x_0_1': 'ad', 'x_0_2': 'oo', 'x_1_0': 'oo', 'x_1_1': 'bc', 'x_1_2': 'ad'}. Best is trial 98 with value: 0.7.
[I 2024-10-13 11:31:11,213] Trial 223 finished with value: 0.7 and parameters: {'x_0_0': 'ac', 'x_0_1': 'ad', 'x_0_2': 'oo', 'x_1_0': 'oo', 'x_1_1': 'bc', 'x_1_2': 'ad'}. Best is trial 98 with value: 0.7.
[I 2024-10-13 11:31:11,240] Trial 224 finished with value: 1.4666666666666666 and parameters: {'x_0_0': 'ac', 'x_0_1': 'bc', 'x_0_2': 'ab', 'x_1_0': 'oo', 'x_1_1': 'bc', 'x_1_2': 'ad'}. Best is trial 98 with value: 0.7.
[I 2024-10-13 11:31:11,267] Trial 225 finished with value: 1.4777777777777779 and parameters: {'x_0_0': 'ab', 'x_0_1': 'ad', 'x_0_2': 'oo', 'x_1_0': 'oo', 'x_1_1': 'bc', 'x_1_2': 'ad'}. Best is trial 98 with value: 0.7.
[I 2024-10-13 11:31:11,294] Trial 226 finished with value: 0.8999999999999999 and parameters: {'x_0_0': 'ac', 'x_0_1': 'ad', 'x_0_2': 'oo', 'x_1_0': 'ac', 'x_1_1': 'bc', 'x_1_2': 'ad'}. Best is trial 98 with value: 0.7.
[I 2024-10-13 11:31:11,320] Trial 227 finished with value: 1.1666666666666665 and parameters: {'x_0_0': 'ac', 'x_0_1': 'oo', 'x_0_2': 'oo', 'x_1_0': 'ad', 'x_1_1': 'bc', 'x_1_2': 'ad'}. Best is trial 98 with value: 0.7.
[I 2024-10-13 11:31:11,347] Trial 228 finished with value: 0.7 and parameters: {'x_0_0': 'ac', 'x_0_1': 'ad', 'x_0_2': 'oo', 'x_1_0': 'oo', 'x_1_1': 'bc', 'x_1_2': 'ad'}. Best is trial 98 with value: 0.7.
[I 2024-10-13 11:31:11,373] Trial 229 finished with value: 0.7999999999999999 and parameters: {'x_0_0': 'ac', 'x_0_1': 'ad', 'x_0_2': 'ac', 'x_1_0': 'oo', 'x_1_1': 'bc', 'x_1_2': 'ad'}. Best is trial 98 with value: 0.7.
[I 2024-10-13 11:31:11,400] Trial 230 finished with value: 1.7 and parameters: {'x_0_0': 'cd', 'x_0_1': 'ad', 'x_0_2': 'oo', 'x_1_0': 'oo', 'x_1_1': 'bc', 'x_1_2': 'ad'}. Best is trial 98 with value: 0.7.
[I 2024-10-13 11:31:11,427] Trial 231 finished with value: 0.7 and parameters: {'x_0_0': 'ac', 'x_0_1': 'ad', 'x_0_2': 'oo', 'x_1_0': 'oo', 'x_1_1': 'bc', 'x_1_2': 'ad'}. Best is trial 98 with value: 0.7.
[I 2024-10-13 11:31:11,454] Trial 232 finished with value: 0.7 and parameters: {'x_0_0': 'ac', 'x_0_1': 'ad', 'x_0_2': 'oo', 'x_1_0': 'oo', 'x_1_1': 'bc', 'x_1_2': 'ad'}. Best is trial 98 with value: 0.7.
[I 2024-10-13 11:31:11,481] Trial 233 finished with value: 0.7 and parameters: {'x_0_0': 'ac', 'x_0_1': 'ad', 'x_0_2': 'oo', 'x_1_0': 'oo', 'x_1_1': 'bc', 'x_1_2': 'ad'}. Best is trial 98 with value: 0.7.
[I 2024-10-13 11:31:11,508] Trial 234 finished with value: 0.7 and parameters: {'x_0_0': 'ac', 'x_0_1': 'ad', 'x_0_2': 'oo', 'x_1_0': 'oo', 'x_1_1': 'bc', 'x_1_2': 'ad'}. Best is trial 98 with value: 0.7.
[I 2024-10-13 11:31:11,535] Trial 235 finished with value: 0.7 and parameters: {'x_0_0': 'ac', 'x_0_1': 'ad', 'x_0_2': 'oo', 'x_1_0': 'oo', 'x_1_1': 'bc', 'x_1_2': 'ad'}. Best is trial 98 with value: 0.7.
[I 2024-10-13 11:31:11,562] Trial 236 finished with value: 1.0444444444444443 and parameters: {'x_0_0': 'ac', 'x_0_1': 'ad', 'x_0_2': 'oo', 'x_1_0': 'oo', 'x_1_1': 'oo', 'x_1_2': 'bd'}. Best is trial 98 with value: 0.7.
[I 2024-10-13 11:31:11,589] Trial 237 finished with value: 1.3666666666666667 and parameters: {'x_0_0': 'ad', 'x_0_1': 'ad', 'x_0_2': 'oo', 'x_1_0': 'oo', 'x_1_1': 'bc', 'x_1_2': 'ad'}. Best is trial 98 with value: 0.7.
[I 2024-10-13 11:31:11,616] Trial 238 finished with value: 0.7 and parameters: {'x_0_0': 'ac', 'x_0_1': 'ad', 'x_0_2': 'oo', 'x_1_0': 'oo', 'x_1_1': 'bc', 'x_1_2': 'ad'}. Best is trial 98 with value: 0.7.
[I 2024-10-13 11:31:11,644] Trial 239 finished with value: 1.6 and parameters: {'x_0_0': 'oo', 'x_0_1': 'ac', 'x_0_2': 'oo', 'x_1_0': 'oo', 'x_1_1': 'bc', 'x_1_2': 'ad'}. Best is trial 98 with value: 0.7.
[I 2024-10-13 11:31:11,673] Trial 240 finished with value: 0.7 and parameters: {'x_0_0': 'ac', 'x_0_1': 'ad', 'x_0_2': 'oo', 'x_1_0': 'oo', 'x_1_1': 'bc', 'x_1_2': 'ad'}. Best is trial 98 with value: 0.7.
[I 2024-10-13 11:31:11,701] Trial 241 finished with value: 0.7 and parameters: {'x_0_0': 'ac', 'x_0_1': 'ad', 'x_0_2': 'oo', 'x_1_0': 'oo', 'x_1_1': 'bc', 'x_1_2': 'ad'}. Best is trial 98 with value: 0.7.
[I 2024-10-13 11:31:11,728] Trial 242 finished with value: 0.7 and parameters: {'x_0_0': 'ac', 'x_0_1': 'ad', 'x_0_2': 'oo', 'x_1_0': 'oo', 'x_1_1': 'bc', 'x_1_2': 'ad'}. Best is trial 98 with value: 0.7.
[I 2024-10-13 11:31:11,755] Trial 243 finished with value: 0.7999999999999999 and parameters: {'x_0_0': 'ac', 'x_0_1': 'ad', 'x_0_2': 'cd', 'x_1_0': 'oo', 'x_1_1': 'bc', 'x_1_2': 'ad'}. Best is trial 98 with value: 0.7.
[I 2024-10-13 11:31:11,782] Trial 244 finished with value: 0.9222222222222222 and parameters: {'x_0_0': 'ac', 'x_0_1': 'ad', 'x_0_2': 'oo', 'x_1_0': 'oo', 'x_1_1': 'bd', 'x_1_2': 'ad'}. Best is trial 98 with value: 0.7.
[I 2024-10-13 11:31:11,810] Trial 245 finished with value: 0.7 and parameters: {'x_0_0': 'ac', 'x_0_1': 'ad', 'x_0_2': 'oo', 'x_1_0': 'oo', 'x_1_1': 'bc', 'x_1_2': 'ad'}. Best is trial 98 with value: 0.7.
[I 2024-10-13 11:31:11,838] Trial 246 finished with value: 1.3555555555555556 and parameters: {'x_0_0': 'ac', 'x_0_1': 'ab', 'x_0_2': 'ad', 'x_1_0': 'oo', 'x_1_1': 'bc', 'x_1_2': 'ad'}. Best is trial 98 with value: 0.7.
[I 2024-10-13 11:31:11,865] Trial 247 finished with value: 0.7 and parameters: {'x_0_0': 'ac', 'x_0_1': 'ad', 'x_0_2': 'oo', 'x_1_0': 'oo', 'x_1_1': 'bc', 'x_1_2': 'ad'}. Best is trial 98 with value: 0.7.
[I 2024-10-13 11:31:11,893] Trial 248 finished with value: 0.8999999999999999 and parameters: {'x_0_0': 'ac', 'x_0_1': 'ad', 'x_0_2': 'oo', 'x_1_0': 'cd', 'x_1_1': 'bc', 'x_1_2': 'ad'}. Best is trial 98 with value: 0.7.
[I 2024-10-13 11:31:11,920] Trial 249 finished with value: 0.7 and parameters: {'x_0_0': 'ac', 'x_0_1': 'ad', 'x_0_2': 'oo', 'x_1_0': 'oo', 'x_1_1': 'bc', 'x_1_2': 'ad'}. Best is trial 98 with value: 0.7.
[I 2024-10-13 11:31:11,948] Trial 250 finished with value: 0.7 and parameters: {'x_0_0': 'ac', 'x_0_1': 'ad', 'x_0_2': 'oo', 'x_1_0': 'oo', 'x_1_1': 'bc', 'x_1_2': 'ad'}. Best is trial 98 with value: 0.7.
[I 2024-10-13 11:31:11,975] Trial 251 finished with value: 1.3444444444444443 and parameters: {'x_0_0': 'bd', 'x_0_1': 'bd', 'x_0_2': 'oo', 'x_1_0': 'bc', 'x_1_1': 'bc', 'x_1_2': 'ab'}. Best is trial 98 with value: 0.7.
[I 2024-10-13 11:31:12,003] Trial 252 finished with value: 1.0444444444444443 and parameters: {'x_0_0': 'ac', 'x_0_1': 'ad', 'x_0_2': 'oo', 'x_1_0': 'oo', 'x_1_1': 'ac', 'x_1_2': 'oo'}. Best is trial 98 with value: 0.7.
[I 2024-10-13 11:31:12,032] Trial 253 finished with value: 0.7 and parameters: {'x_0_0': 'ac', 'x_0_1': 'ad', 'x_0_2': 'oo', 'x_1_0': 'oo', 'x_1_1': 'bc', 'x_1_2': 'ad'}. Best is trial 98 with value: 0.7.
[I 2024-10-13 11:31:12,058] Trial 254 finished with value: 0.7 and parameters: {'x_0_0': 'ac', 'x_0_1': 'ad', 'x_0_2': 'oo', 'x_1_0': 'oo', 'x_1_1': 'bc', 'x_1_2': 'ad'}. Best is trial 98 with value: 0.7.
[I 2024-10-13 11:31:12,087] Trial 255 finished with value: 1.3444444444444443 and parameters: {'x_0_0': 'ac', 'x_0_1': 'ad', 'x_0_2': 'oo', 'x_1_0': 'bd', 'x_1_1': 'ad', 'x_1_2': 'ad'}. Best is trial 98 with value: 0.7.
[I 2024-10-13 11:31:12,113] Trial 256 finished with value: 0.7 and parameters: {'x_0_0': 'ac', 'x_0_1': 'ad', 'x_0_2': 'oo', 'x_1_0': 'oo', 'x_1_1': 'bc', 'x_1_2': 'ad'}. Best is trial 98 with value: 0.7.
[I 2024-10-13 11:31:12,140] Trial 257 finished with value: 1.4666666666666666 and parameters: {'x_0_0': 'bc', 'x_0_1': 'cd', 'x_0_2': 'bd', 'x_1_0': 'oo', 'x_1_1': 'bc', 'x_1_2': 'ad'}. Best is trial 98 with value: 0.7.
[I 2024-10-13 11:31:12,167] Trial 258 finished with value: 1.1444444444444444 and parameters: {'x_0_0': 'ac', 'x_0_1': 'ad', 'x_0_2': 'oo', 'x_1_0': 'oo', 'x_1_1': 'cd', 'x_1_2': 'cd'}. Best is trial 98 with value: 0.7.
[I 2024-10-13 11:31:12,194] Trial 259 finished with value: 0.7 and parameters: {'x_0_0': 'ac', 'x_0_1': 'ad', 'x_0_2': 'oo', 'x_1_0': 'oo', 'x_1_1': 'bc', 'x_1_2': 'ad'}. Best is trial 98 with value: 0.7.
[I 2024-10-13 11:31:12,221] Trial 260 finished with value: 1.3333333333333333 and parameters: {'x_0_0': 'ac', 'x_0_1': 'ad', 'x_0_2': 'ab', 'x_1_0': 'ac', 'x_1_1': 'ab', 'x_1_2': 'ac'}. Best is trial 98 with value: 0.7.
[I 2024-10-13 11:31:12,248] Trial 261 finished with value: 0.9222222222222222 and parameters: {'x_0_0': 'ac', 'x_0_1': 'ad', 'x_0_2': 'oo', 'x_1_0': 'oo', 'x_1_1': 'bc', 'x_1_2': 'bc'}. Best is trial 98 with value: 0.7.
[I 2024-10-13 11:31:12,275] Trial 262 finished with value: 1.0 and parameters: {'x_0_0': 'ac', 'x_0_1': 'ad', 'x_0_2': 'ac', 'x_1_0': 'ad', 'x_1_1': 'bc', 'x_1_2': 'ad'}. Best is trial 98 with value: 0.7.
[I 2024-10-13 11:31:12,302] Trial 263 finished with value: 0.9666666666666667 and parameters: {'x_0_0': 'ac', 'x_0_1': 'oo', 'x_0_2': 'oo', 'x_1_0': 'oo', 'x_1_1': 'bc', 'x_1_2': 'ad'}. Best is trial 98 with value: 0.7.
[I 2024-10-13 11:31:12,329] Trial 264 finished with value: 0.7 and parameters: {'x_0_0': 'ac', 'x_0_1': 'ad', 'x_0_2': 'oo', 'x_1_0': 'oo', 'x_1_1': 'bc', 'x_1_2': 'ad'}. Best is trial 98 with value: 0.7.
[I 2024-10-13 11:31:12,358] Trial 265 finished with value: 1.4777777777777779 and parameters: {'x_0_0': 'ab', 'x_0_1': 'ad', 'x_0_2': 'oo', 'x_1_0': 'oo', 'x_1_1': 'bc', 'x_1_2': 'ad'}. Best is trial 98 with value: 0.7.
[I 2024-10-13 11:31:12,385] Trial 266 finished with value: 0.7 and parameters: {'x_0_0': 'ac', 'x_0_1': 'ad', 'x_0_2': 'oo', 'x_1_0': 'oo', 'x_1_1': 'bc', 'x_1_2': 'ad'}. Best is trial 98 with value: 0.7.
[I 2024-10-13 11:31:12,412] Trial 267 finished with value: 1.7 and parameters: {'x_0_0': 'cd', 'x_0_1': 'bc', 'x_0_2': 'oo', 'x_1_0': 'oo', 'x_1_1': 'bc', 'x_1_2': 'ad'}. Best is trial 98 with value: 0.7.
[I 2024-10-13 11:31:12,439] Trial 268 finished with value: 0.7 and parameters: {'x_0_0': 'ac', 'x_0_1': 'ad', 'x_0_2': 'oo', 'x_1_0': 'oo', 'x_1_1': 'bc', 'x_1_2': 'ad'}. Best is trial 98 with value: 0.7.
[I 2024-10-13 11:31:12,466] Trial 269 finished with value: 1.3666666666666667 and parameters: {'x_0_0': 'ad', 'x_0_1': 'ad', 'x_0_2': 'oo', 'x_1_0': 'oo', 'x_1_1': 'bc', 'x_1_2': 'bd'}. Best is trial 98 with value: 0.7.
[I 2024-10-13 11:31:12,493] Trial 270 finished with value: 0.7 and parameters: {'x_0_0': 'ac', 'x_0_1': 'ad', 'x_0_2': 'oo', 'x_1_0': 'oo', 'x_1_1': 'bc', 'x_1_2': 'ad'}. Best is trial 98 with value: 0.7.
[I 2024-10-13 11:31:12,520] Trial 271 finished with value: 1.0222222222222221 and parameters: {'x_0_0': 'ac', 'x_0_1': 'ac', 'x_0_2': 'ad', 'x_1_0': 'oo', 'x_1_1': 'bc', 'x_1_2': 'ad'}. Best is trial 98 with value: 0.7.
[I 2024-10-13 11:31:12,548] Trial 272 finished with value: 0.7999999999999999 and parameters: {'x_0_0': 'ac', 'x_0_1': 'ad', 'x_0_2': 'cd', 'x_1_0': 'oo', 'x_1_1': 'bc', 'x_1_2': 'ad'}. Best is trial 98 with value: 0.7.
[I 2024-10-13 11:31:12,575] Trial 273 finished with value: 1.0444444444444443 and parameters: {'x_0_0': 'ac', 'x_0_1': 'ad', 'x_0_2': 'oo', 'x_1_0': 'oo', 'x_1_1': 'oo', 'x_1_2': 'ad'}. Best is trial 98 with value: 0.7.
[I 2024-10-13 11:31:12,603] Trial 274 finished with value: 1.4555555555555555 and parameters: {'x_0_0': 'ac', 'x_0_1': 'ab', 'x_0_2': 'oo', 'x_1_0': 'cd', 'x_1_1': 'bd', 'x_1_2': 'ad'}. Best is trial 98 with value: 0.7.
[I 2024-10-13 11:31:12,629] Trial 275 finished with value: 0.7 and parameters: {'x_0_0': 'ac', 'x_0_1': 'ad', 'x_0_2': 'oo', 'x_1_0': 'oo', 'x_1_1': 'bc', 'x_1_2': 'ad'}. Best is trial 98 with value: 0.7.
[I 2024-10-13 11:31:12,660] Trial 276 finished with value: 1.6 and parameters: {'x_0_0': 'oo', 'x_0_1': 'ad', 'x_0_2': 'oo', 'x_1_0': 'oo', 'x_1_1': 'bc', 'x_1_2': 'ad'}. Best is trial 98 with value: 0.7.
[I 2024-10-13 11:31:12,691] Trial 277 finished with value: 1.3666666666666667 and parameters: {'x_0_0': 'bd', 'x_0_1': 'ad', 'x_0_2': 'oo', 'x_1_0': 'oo', 'x_1_1': 'bc', 'x_1_2': 'ad'}. Best is trial 98 with value: 0.7.
[I 2024-10-13 11:31:12,718] Trial 278 finished with value: 0.7 and parameters: {'x_0_0': 'ac', 'x_0_1': 'ad', 'x_0_2': 'oo', 'x_1_0': 'oo', 'x_1_1': 'bc', 'x_1_2': 'ad'}. Best is trial 98 with value: 0.7.
[I 2024-10-13 11:31:12,746] Trial 279 finished with value: 0.7 and parameters: {'x_0_0': 'ac', 'x_0_1': 'ad', 'x_0_2': 'oo', 'x_1_0': 'oo', 'x_1_1': 'bc', 'x_1_2': 'ad'}. Best is trial 98 with value: 0.7.
[I 2024-10-13 11:31:12,774] Trial 280 finished with value: 1.2666666666666666 and parameters: {'x_0_0': 'ac', 'x_0_1': 'bd', 'x_0_2': 'oo', 'x_1_0': 'oo', 'x_1_1': 'ac', 'x_1_2': 'oo'}. Best is trial 98 with value: 0.7.
[I 2024-10-13 11:31:12,802] Trial 281 finished with value: 0.8111111111111111 and parameters: {'x_0_0': 'ac', 'x_0_1': 'ad', 'x_0_2': 'oo', 'x_1_0': 'oo', 'x_1_1': 'bc', 'x_1_2': 'ab'}. Best is trial 98 with value: 0.7.
[I 2024-10-13 11:31:12,829] Trial 282 finished with value: 0.8999999999999999 and parameters: {'x_0_0': 'ac', 'x_0_1': 'ad', 'x_0_2': 'oo', 'x_1_0': 'bc', 'x_1_1': 'bc', 'x_1_2': 'ad'}. Best is trial 98 with value: 0.7.
[I 2024-10-13 11:31:12,871] Trial 283 finished with value: 1.1444444444444444 and parameters: {'x_0_0': 'ac', 'x_0_1': 'ad', 'x_0_2': 'oo', 'x_1_0': 'oo', 'x_1_1': 'ad', 'x_1_2': 'ad'}. Best is trial 98 with value: 0.7.
[I 2024-10-13 11:31:12,907] Trial 284 finished with value: 0.7 and parameters: {'x_0_0': 'ac', 'x_0_1': 'ad', 'x_0_2': 'oo', 'x_1_0': 'oo', 'x_1_1': 'bc', 'x_1_2': 'ad'}. Best is trial 98 with value: 0.7.
[I 2024-10-13 11:31:12,935] Trial 285 finished with value: 1.0 and parameters: {'x_0_0': 'ac', 'x_0_1': 'ad', 'x_0_2': 'bd', 'x_1_0': 'bd', 'x_1_1': 'bc', 'x_1_2': 'ad'}. Best is trial 98 with value: 0.7.
[I 2024-10-13 11:31:12,962] Trial 286 finished with value: 1.3666666666666667 and parameters: {'x_0_0': 'bc', 'x_0_1': 'cd', 'x_0_2': 'oo', 'x_1_0': 'oo', 'x_1_1': 'bc', 'x_1_2': 'ad'}. Best is trial 98 with value: 0.7.
[I 2024-10-13 11:31:12,990] Trial 287 finished with value: 1.2444444444444445 and parameters: {'x_0_0': 'ac', 'x_0_1': 'ad', 'x_0_2': 'ab', 'x_1_0': 'oo', 'x_1_1': 'cd', 'x_1_2': 'bc'}. Best is trial 98 with value: 0.7.
[I 2024-10-13 11:31:13,017] Trial 288 finished with value: 0.9222222222222222 and parameters: {'x_0_0': 'ac', 'x_0_1': 'ad', 'x_0_2': 'oo', 'x_1_0': 'oo', 'x_1_1': 'bc', 'x_1_2': 'cd'}. Best is trial 98 with value: 0.7.
[I 2024-10-13 11:31:13,045] Trial 289 finished with value: 1.2333333333333332 and parameters: {'x_0_0': 'ac', 'x_0_1': 'ad', 'x_0_2': 'oo', 'x_1_0': 'ac', 'x_1_1': 'ab', 'x_1_2': 'ad'}. Best is trial 98 with value: 0.7.
[I 2024-10-13 11:31:13,073] Trial 290 finished with value: 1.3666666666666667 and parameters: {'x_0_0': 'ac', 'x_0_1': 'bc', 'x_0_2': 'oo', 'x_1_0': 'oo', 'x_1_1': 'bc', 'x_1_2': 'ad'}. Best is trial 98 with value: 0.7.
[I 2024-10-13 11:31:13,101] Trial 291 finished with value: 0.7 and parameters: {'x_0_0': 'ac', 'x_0_1': 'ad', 'x_0_2': 'oo', 'x_1_0': 'oo', 'x_1_1': 'bc', 'x_1_2': 'ad'}. Best is trial 98 with value: 0.7.
[I 2024-10-13 11:31:13,129] Trial 292 finished with value: 0.7 and parameters: {'x_0_0': 'ac', 'x_0_1': 'ad', 'x_0_2': 'oo', 'x_1_0': 'oo', 'x_1_1': 'bc', 'x_1_2': 'ad'}. Best is trial 98 with value: 0.7.
[I 2024-10-13 11:31:13,156] Trial 293 finished with value: 1.5777777777777777 and parameters: {'x_0_0': 'ab', 'x_0_1': 'ad', 'x_0_2': 'ac', 'x_1_0': 'oo', 'x_1_1': 'bc', 'x_1_2': 'ad'}. Best is trial 98 with value: 0.7.
[I 2024-10-13 11:31:13,184] Trial 294 finished with value: 0.9666666666666667 and parameters: {'x_0_0': 'ac', 'x_0_1': 'oo', 'x_0_2': 'oo', 'x_1_0': 'oo', 'x_1_1': 'bc', 'x_1_2': 'ad'}. Best is trial 98 with value: 0.7.
[I 2024-10-13 11:31:13,211] Trial 295 finished with value: 0.7 and parameters: {'x_0_0': 'ac', 'x_0_1': 'ad', 'x_0_2': 'oo', 'x_1_0': 'oo', 'x_1_1': 'bc', 'x_1_2': 'ac'}. Best is trial 98 with value: 0.7.
[I 2024-10-13 11:31:13,239] Trial 296 finished with value: 1.9 and parameters: {'x_0_0': 'cd', 'x_0_1': 'ad', 'x_0_2': 'oo', 'x_1_0': 'ad', 'x_1_1': 'bc', 'x_1_2': 'ad'}. Best is trial 98 with value: 0.7.
[I 2024-10-13 11:31:13,267] Trial 297 finished with value: 0.7 and parameters: {'x_0_0': 'ac', 'x_0_1': 'ad', 'x_0_2': 'oo', 'x_1_0': 'oo', 'x_1_1': 'bc', 'x_1_2': 'ad'}. Best is trial 98 with value: 0.7.
[I 2024-10-13 11:31:13,294] Trial 298 finished with value: 1.3666666666666667 and parameters: {'x_0_0': 'ad', 'x_0_1': 'ad', 'x_0_2': 'oo', 'x_1_0': 'oo', 'x_1_1': 'bc', 'x_1_2': 'bd'}. Best is trial 98 with value: 0.7.
[I 2024-10-13 11:31:13,321] Trial 299 finished with value: 0.7999999999999999 and parameters: {'x_0_0': 'ac', 'x_0_1': 'ad', 'x_0_2': 'ad', 'x_1_0': 'oo', 'x_1_1': 'bc', 'x_1_2': 'ad'}. Best is trial 98 with value: 0.7.
[I 2024-10-13 11:31:13,349] Trial 300 finished with value: 0.7999999999999999 and parameters: {'x_0_0': 'ac', 'x_0_1': 'ad', 'x_0_2': 'cd', 'x_1_0': 'oo', 'x_1_1': 'bc', 'x_1_2': 'ad'}. Best is trial 98 with value: 0.7.
[I 2024-10-13 11:31:13,378] Trial 301 finished with value: 1.5 and parameters: {'x_0_0': 'oo', 'x_0_1': 'ad', 'x_0_2': 'oo', 'x_1_0': 'oo', 'x_1_1': 'oo', 'x_1_2': 'ad'}. Best is trial 98 with value: 0.7.
[I 2024-10-13 11:31:13,408] Trial 302 finished with value: 1.1444444444444444 and parameters: {'x_0_0': 'ac', 'x_0_1': 'ac', 'x_0_2': 'oo', 'x_1_0': 'oo', 'x_1_1': 'bc', 'x_1_2': 'ad'}. Best is trial 98 with value: 0.7.
[I 2024-10-13 11:31:13,436] Trial 303 finished with value: 0.7 and parameters: {'x_0_0': 'ac', 'x_0_1': 'ad', 'x_0_2': 'oo', 'x_1_0': 'oo', 'x_1_1': 'bc', 'x_1_2': 'ad'}. Best is trial 98 with value: 0.7.
[I 2024-10-13 11:31:13,467] Trial 304 finished with value: 0.7 and parameters: {'x_0_0': 'ac', 'x_0_1': 'ad', 'x_0_2': 'oo', 'x_1_0': 'oo', 'x_1_1': 'bc', 'x_1_2': 'ad'}. Best is trial 98 with value: 0.7.
