/Users/keisukeonoue/ws/constrained_BO_v2/experiments/2024-10-13/bo_benchmark.py:141: ExperimentalWarning: GPSampler is experimental (supported from v3.6.0). The interface can change in the future.
  return GPSampler(seed=seed)  # Use GPSampler for GP-based Bayesian Optimization
2024-10-13 11:38:51,545 - INFO - Experiment settings: {'name': 'bo_benchmark_gp_map2_seed2', 'seed': 2, 'map': array([[0.1, 0.4, 0.1],
       [0.2, 0.1, 0.1]]), 'iter_bo': 500, 'storage': 'sqlite:////Users/keisukeonoue/ws/constrained_BO_v2/results/dbs/2024-10-13_11-38-50_bo_benchmark_gp_map2_seed2.db', 'sampler': <optuna.samplers._gp.sampler.GPSampler object at 0x102e3c1a0>, 'acqf_settings': {'trade_off_param': 3.0, 'batch_size': 10, 'maximize': False}}
[I 2024-10-13 11:38:52,060] A new study created in RDB with name: bo_benchmark_gp_map2_seed2
2024-10-13 11:38:52,062 - INFO - Created new study 'bo_benchmark_gp_map2_seed2' in sqlite:////Users/keisukeonoue/ws/constrained_BO_v2/results/dbs/2024-10-13_11-38-50_bo_benchmark_gp_map2_seed2.db
[I 2024-10-13 11:38:52,126] Trial 0 finished with value: 1.2222222222222223 and parameters: {'x_0_0': 'ac', 'x_0_1': 'ad', 'x_0_2': 'ac', 'x_1_0': 'bc', 'x_1_1': 'bc', 'x_1_2': 'bd'}. Best is trial 0 with value: 1.2222222222222223.
[I 2024-10-13 11:38:52,169] Trial 1 finished with value: 1.5 and parameters: {'x_0_0': 'oo', 'x_0_1': 'oo', 'x_0_2': 'ac', 'x_1_0': 'bd', 'x_1_1': 'bc', 'x_1_2': 'ab'}. Best is trial 0 with value: 1.2222222222222223.
[I 2024-10-13 11:38:52,228] Trial 2 finished with value: 1.5555555555555556 and parameters: {'x_0_0': 'bc', 'x_0_1': 'ab', 'x_0_2': 'ab', 'x_1_0': 'ac', 'x_1_1': 'ad', 'x_1_2': 'ac'}. Best is trial 0 with value: 1.2222222222222223.
[I 2024-10-13 11:38:52,279] Trial 3 finished with value: 1.7777777777777777 and parameters: {'x_0_0': 'ab', 'x_0_1': 'bc', 'x_0_2': 'ac', 'x_1_0': 'ac', 'x_1_1': 'cd', 'x_1_2': 'bc'}. Best is trial 0 with value: 1.2222222222222223.
[I 2024-10-13 11:38:52,319] Trial 4 finished with value: 1.4555555555555557 and parameters: {'x_0_0': 'ad', 'x_0_1': 'bc', 'x_0_2': 'ab', 'x_1_0': 'ab', 'x_1_1': 'oo', 'x_1_2': 'cd'}. Best is trial 0 with value: 1.2222222222222223.
[I 2024-10-13 11:38:52,360] Trial 5 finished with value: 1.9 and parameters: {'x_0_0': 'oo', 'x_0_1': 'ad', 'x_0_2': 'bc', 'x_1_0': 'bd', 'x_1_1': 'ab', 'x_1_2': 'ab'}. Best is trial 0 with value: 1.2222222222222223.
[I 2024-10-13 11:38:52,406] Trial 6 finished with value: 1.4444444444444444 and parameters: {'x_0_0': 'ac', 'x_0_1': 'ad', 'x_0_2': 'ab', 'x_1_0': 'bd', 'x_1_1': 'ad', 'x_1_2': 'ad'}. Best is trial 0 with value: 1.2222222222222223.
[I 2024-10-13 11:38:52,443] Trial 7 finished with value: 1.5666666666666667 and parameters: {'x_0_0': 'bd', 'x_0_1': 'ad', 'x_0_2': 'bc', 'x_1_0': 'ac', 'x_1_1': 'oo', 'x_1_2': 'cd'}. Best is trial 0 with value: 1.2222222222222223.
[I 2024-10-13 11:38:52,480] Trial 8 finished with value: 1.7777777777777777 and parameters: {'x_0_0': 'ab', 'x_0_1': 'bc', 'x_0_2': 'bd', 'x_1_0': 'ab', 'x_1_1': 'ad', 'x_1_2': 'ab'}. Best is trial 0 with value: 1.2222222222222223.
[I 2024-10-13 11:38:52,519] Trial 9 finished with value: 1.6666666666666665 and parameters: {'x_0_0': 'bd', 'x_0_1': 'bc', 'x_0_2': 'bc', 'x_1_0': 'ac', 'x_1_1': 'ab', 'x_1_2': 'bc'}. Best is trial 0 with value: 1.2222222222222223.
[I 2024-10-13 11:38:52,992] Trial 10 finished with value: 1.2222222222222223 and parameters: {'x_0_0': 'ac', 'x_0_1': 'ad', 'x_0_2': 'ac', 'x_1_0': 'bd', 'x_1_1': 'bc', 'x_1_2': 'bd'}. Best is trial 0 with value: 1.2222222222222223.
[I 2024-10-13 11:38:53,123] Trial 11 finished with value: 1.0222222222222221 and parameters: {'x_0_0': 'ac', 'x_0_1': 'ad', 'x_0_2': 'ac', 'x_1_0': 'oo', 'x_1_1': 'bc', 'x_1_2': 'bd'}. Best is trial 11 with value: 1.0222222222222221.
[I 2024-10-13 11:38:53,257] Trial 12 finished with value: 1.0666666666666667 and parameters: {'x_0_0': 'ac', 'x_0_1': 'oo', 'x_0_2': 'ac', 'x_1_0': 'oo', 'x_1_1': 'bc', 'x_1_2': 'bd'}. Best is trial 11 with value: 1.0222222222222221.
[I 2024-10-13 11:38:53,407] Trial 13 finished with value: 1.4666666666666666 and parameters: {'x_0_0': 'ac', 'x_0_1': 'bd', 'x_0_2': 'ac', 'x_1_0': 'oo', 'x_1_1': 'bc', 'x_1_2': 'bd'}. Best is trial 11 with value: 1.0222222222222221.
[I 2024-10-13 11:38:53,559] Trial 14 finished with value: 0.9222222222222222 and parameters: {'x_0_0': 'ac', 'x_0_1': 'ad', 'x_0_2': 'oo', 'x_1_0': 'oo', 'x_1_1': 'bc', 'x_1_2': 'bd'}. Best is trial 14 with value: 0.9222222222222222.
[I 2024-10-13 11:38:53,678] Trial 15 finished with value: 1.1444444444444444 and parameters: {'x_0_0': 'ac', 'x_0_1': 'ad', 'x_0_2': 'oo', 'x_1_0': 'oo', 'x_1_1': 'ac', 'x_1_2': 'bd'}. Best is trial 14 with value: 0.9222222222222222.
[I 2024-10-13 11:38:53,794] Trial 16 finished with value: 0.9666666666666667 and parameters: {'x_0_0': 'ac', 'x_0_1': 'oo', 'x_0_2': 'oo', 'x_1_0': 'oo', 'x_1_1': 'bc', 'x_1_2': 'bd'}. Best is trial 14 with value: 0.9222222222222222.
[I 2024-10-13 11:38:53,902] Trial 17 finished with value: 1.0222222222222221 and parameters: {'x_0_0': 'ac', 'x_0_1': 'ad', 'x_0_2': 'ad', 'x_1_0': 'oo', 'x_1_1': 'bc', 'x_1_2': 'bd'}. Best is trial 14 with value: 0.9222222222222222.
[I 2024-10-13 11:38:54,082] Trial 18 finished with value: 1.1666666666666665 and parameters: {'x_0_0': 'ac', 'x_0_1': 'oo', 'x_0_2': 'oo', 'x_1_0': 'ad', 'x_1_1': 'bc', 'x_1_2': 'bd'}. Best is trial 14 with value: 0.9222222222222222.
[I 2024-10-13 11:38:54,194] Trial 19 finished with value: 0.9666666666666667 and parameters: {'x_0_0': 'ac', 'x_0_1': 'oo', 'x_0_2': 'oo', 'x_1_0': 'oo', 'x_1_1': 'bd', 'x_1_2': 'bd'}. Best is trial 14 with value: 0.9222222222222222.
[I 2024-10-13 11:38:54,303] Trial 20 finished with value: 0.9666666666666667 and parameters: {'x_0_0': 'ad', 'x_0_1': 'oo', 'x_0_2': 'oo', 'x_1_0': 'oo', 'x_1_1': 'bc', 'x_1_2': 'bd'}. Best is trial 14 with value: 0.9222222222222222.
[I 2024-10-13 11:38:54,420] Trial 21 finished with value: 1.3666666666666667 and parameters: {'x_0_0': 'ad', 'x_0_1': 'ad', 'x_0_2': 'oo', 'x_1_0': 'oo', 'x_1_1': 'bc', 'x_1_2': 'bd'}. Best is trial 14 with value: 0.9222222222222222.
[I 2024-10-13 11:38:54,545] Trial 22 finished with value: 0.9666666666666667 and parameters: {'x_0_0': 'ad', 'x_0_1': 'oo', 'x_0_2': 'oo', 'x_1_0': 'oo', 'x_1_1': 'bd', 'x_1_2': 'bd'}. Best is trial 14 with value: 0.9222222222222222.
[I 2024-10-13 11:38:54,707] Trial 23 finished with value: 1.3 and parameters: {'x_0_0': 'cd', 'x_0_1': 'oo', 'x_0_2': 'oo', 'x_1_0': 'oo', 'x_1_1': 'bd', 'x_1_2': 'bd'}. Best is trial 14 with value: 0.9222222222222222.
[I 2024-10-13 11:38:54,852] Trial 24 finished with value: 0.8666666666666667 and parameters: {'x_0_0': 'ad', 'x_0_1': 'oo', 'x_0_2': 'oo', 'x_1_0': 'oo', 'x_1_1': 'oo', 'x_1_2': 'bd'}. Best is trial 24 with value: 0.8666666666666667.
[I 2024-10-13 11:38:54,972] Trial 25 finished with value: 0.7666666666666666 and parameters: {'x_0_0': 'ad', 'x_0_1': 'oo', 'x_0_2': 'oo', 'x_1_0': 'oo', 'x_1_1': 'oo', 'x_1_2': 'oo'}. Best is trial 25 with value: 0.7666666666666666.
[I 2024-10-13 11:38:55,099] Trial 26 finished with value: 0.8666666666666667 and parameters: {'x_0_0': 'ad', 'x_0_1': 'oo', 'x_0_2': 'cd', 'x_1_0': 'oo', 'x_1_1': 'oo', 'x_1_2': 'oo'}. Best is trial 25 with value: 0.7666666666666666.
[I 2024-10-13 11:38:55,220] Trial 27 finished with value: 0.8666666666666667 and parameters: {'x_0_0': 'ad', 'x_0_1': 'oo', 'x_0_2': 'oo', 'x_1_0': 'oo', 'x_1_1': 'oo', 'x_1_2': 'ac'}. Best is trial 25 with value: 0.7666666666666666.
[I 2024-10-13 11:38:55,337] Trial 28 finished with value: 0.9666666666666667 and parameters: {'x_0_0': 'ad', 'x_0_1': 'oo', 'x_0_2': 'oo', 'x_1_0': 'cd', 'x_1_1': 'oo', 'x_1_2': 'oo'}. Best is trial 25 with value: 0.7666666666666666.
[I 2024-10-13 11:38:55,446] Trial 29 finished with value: 0.8666666666666667 and parameters: {'x_0_0': 'ad', 'x_0_1': 'oo', 'x_0_2': 'oo', 'x_1_0': 'oo', 'x_1_1': 'oo', 'x_1_2': 'cd'}. Best is trial 25 with value: 0.7666666666666666.
[I 2024-10-13 11:38:55,565] Trial 30 finished with value: 0.8666666666666667 and parameters: {'x_0_0': 'ad', 'x_0_1': 'oo', 'x_0_2': 'oo', 'x_1_0': 'oo', 'x_1_1': 'cd', 'x_1_2': 'oo'}. Best is trial 25 with value: 0.7666666666666666.
[I 2024-10-13 11:38:55,675] Trial 31 finished with value: 0.8666666666666667 and parameters: {'x_0_0': 'ad', 'x_0_1': 'oo', 'x_0_2': 'oo', 'x_1_0': 'oo', 'x_1_1': 'oo', 'x_1_2': 'bc'}. Best is trial 25 with value: 0.7666666666666666.
[I 2024-10-13 11:38:55,788] Trial 32 finished with value: 0.8666666666666667 and parameters: {'x_0_0': 'ad', 'x_0_1': 'oo', 'x_0_2': 'oo', 'x_1_0': 'oo', 'x_1_1': 'ab', 'x_1_2': 'oo'}. Best is trial 25 with value: 0.7666666666666666.
[I 2024-10-13 11:38:55,906] Trial 33 finished with value: 0.7666666666666666 and parameters: {'x_0_0': 'ac', 'x_0_1': 'oo', 'x_0_2': 'oo', 'x_1_0': 'oo', 'x_1_1': 'oo', 'x_1_2': 'oo'}. Best is trial 25 with value: 0.7666666666666666.
[I 2024-10-13 11:38:56,018] Trial 34 finished with value: 0.8666666666666667 and parameters: {'x_0_0': 'ac', 'x_0_1': 'oo', 'x_0_2': 'oo', 'x_1_0': 'oo', 'x_1_1': 'oo', 'x_1_2': 'ad'}. Best is trial 25 with value: 0.7666666666666666.
[I 2024-10-13 11:38:56,139] Trial 35 finished with value: 0.8666666666666667 and parameters: {'x_0_0': 'ac', 'x_0_1': 'oo', 'x_0_2': 'bd', 'x_1_0': 'oo', 'x_1_1': 'oo', 'x_1_2': 'oo'}. Best is trial 25 with value: 0.7666666666666666.
[I 2024-10-13 11:38:56,253] Trial 36 finished with value: 0.7666666666666666 and parameters: {'x_0_0': 'bc', 'x_0_1': 'oo', 'x_0_2': 'oo', 'x_1_0': 'oo', 'x_1_1': 'oo', 'x_1_2': 'oo'}. Best is trial 25 with value: 0.7666666666666666.
[I 2024-10-13 11:38:56,367] Trial 37 finished with value: 0.7666666666666666 and parameters: {'x_0_0': 'bd', 'x_0_1': 'oo', 'x_0_2': 'oo', 'x_1_0': 'oo', 'x_1_1': 'oo', 'x_1_2': 'oo'}. Best is trial 25 with value: 0.7666666666666666.
[I 2024-10-13 11:38:56,480] Trial 38 finished with value: 0.8777777777777778 and parameters: {'x_0_0': 'ab', 'x_0_1': 'oo', 'x_0_2': 'oo', 'x_1_0': 'oo', 'x_1_1': 'oo', 'x_1_2': 'oo'}. Best is trial 25 with value: 0.7666666666666666.
[I 2024-10-13 11:38:56,597] Trial 39 finished with value: 0.8666666666666667 and parameters: {'x_0_0': 'bc', 'x_0_1': 'oo', 'x_0_2': 'ad', 'x_1_0': 'oo', 'x_1_1': 'oo', 'x_1_2': 'oo'}. Best is trial 25 with value: 0.7666666666666666.
[I 2024-10-13 11:38:56,715] Trial 40 finished with value: 0.8666666666666667 and parameters: {'x_0_0': 'bd', 'x_0_1': 'oo', 'x_0_2': 'oo', 'x_1_0': 'oo', 'x_1_1': 'ad', 'x_1_2': 'oo'}. Best is trial 25 with value: 0.7666666666666666.
[I 2024-10-13 11:38:56,831] Trial 41 finished with value: 0.8666666666666667 and parameters: {'x_0_0': 'bd', 'x_0_1': 'oo', 'x_0_2': 'ab', 'x_1_0': 'oo', 'x_1_1': 'oo', 'x_1_2': 'oo'}. Best is trial 25 with value: 0.7666666666666666.
[I 2024-10-13 11:38:56,951] Trial 42 finished with value: 0.8666666666666667 and parameters: {'x_0_0': 'bc', 'x_0_1': 'oo', 'x_0_2': 'oo', 'x_1_0': 'oo', 'x_1_1': 'ac', 'x_1_2': 'oo'}. Best is trial 25 with value: 0.7666666666666666.
[I 2024-10-13 11:38:57,065] Trial 43 finished with value: 0.9444444444444444 and parameters: {'x_0_0': 'ac', 'x_0_1': 'ac', 'x_0_2': 'oo', 'x_1_0': 'oo', 'x_1_1': 'oo', 'x_1_2': 'oo'}. Best is trial 25 with value: 0.7666666666666666.
[I 2024-10-13 11:38:57,183] Trial 44 finished with value: 1.1666666666666665 and parameters: {'x_0_0': 'ac', 'x_0_1': 'cd', 'x_0_2': 'oo', 'x_1_0': 'oo', 'x_1_1': 'oo', 'x_1_2': 'oo'}. Best is trial 25 with value: 0.7666666666666666.
[I 2024-10-13 11:38:57,317] Trial 45 finished with value: 0.9666666666666667 and parameters: {'x_0_0': 'bc', 'x_0_1': 'oo', 'x_0_2': 'oo', 'x_1_0': 'ab', 'x_1_1': 'oo', 'x_1_2': 'oo'}. Best is trial 25 with value: 0.7666666666666666.
[I 2024-10-13 11:38:57,465] Trial 46 finished with value: 0.8666666666666667 and parameters: {'x_0_0': 'bc', 'x_0_1': 'oo', 'x_0_2': 'oo', 'x_1_0': 'oo', 'x_1_1': 'bc', 'x_1_2': 'oo'}. Best is trial 25 with value: 0.7666666666666666.
[I 2024-10-13 11:38:57,634] Trial 47 finished with value: 0.7666666666666666 and parameters: {'x_0_0': 'ac', 'x_0_1': 'oo', 'x_0_2': 'oo', 'x_1_0': 'oo', 'x_1_1': 'oo', 'x_1_2': 'oo'}. Best is trial 25 with value: 0.7666666666666666.
[I 2024-10-13 11:38:57,771] Trial 48 finished with value: 0.9444444444444444 and parameters: {'x_0_0': 'bc', 'x_0_1': 'ac', 'x_0_2': 'oo', 'x_1_0': 'oo', 'x_1_1': 'oo', 'x_1_2': 'oo'}. Best is trial 25 with value: 0.7666666666666666.
[I 2024-10-13 11:38:57,893] Trial 49 finished with value: 0.7444444444444445 and parameters: {'x_0_0': 'bd', 'x_0_1': 'oo', 'x_0_2': 'oo', 'x_1_0': 'bc', 'x_1_1': 'oo', 'x_1_2': 'oo'}. Best is trial 49 with value: 0.7444444444444445.
[I 2024-10-13 11:38:58,096] Trial 50 finished with value: 0.7444444444444445 and parameters: {'x_0_0': 'ad', 'x_0_1': 'oo', 'x_0_2': 'oo', 'x_1_0': 'bc', 'x_1_1': 'oo', 'x_1_2': 'oo'}. Best is trial 49 with value: 0.7444444444444445.
[I 2024-10-13 11:38:58,267] Trial 51 finished with value: 0.9666666666666667 and parameters: {'x_0_0': 'bc', 'x_0_1': 'oo', 'x_0_2': 'oo', 'x_1_0': 'bc', 'x_1_1': 'oo', 'x_1_2': 'oo'}. Best is trial 49 with value: 0.7444444444444445.
[I 2024-10-13 11:38:58,407] Trial 52 finished with value: 0.9666666666666667 and parameters: {'x_0_0': 'ac', 'x_0_1': 'oo', 'x_0_2': 'oo', 'x_1_0': 'bc', 'x_1_1': 'oo', 'x_1_2': 'oo'}. Best is trial 49 with value: 0.7444444444444445.
[I 2024-10-13 11:38:58,594] Trial 53 finished with value: 0.8444444444444444 and parameters: {'x_0_0': 'bd', 'x_0_1': 'oo', 'x_0_2': 'oo', 'x_1_0': 'bc', 'x_1_1': 'cd', 'x_1_2': 'oo'}. Best is trial 49 with value: 0.7444444444444445.
[I 2024-10-13 11:38:58,744] Trial 54 finished with value: 0.8444444444444444 and parameters: {'x_0_0': 'bd', 'x_0_1': 'oo', 'x_0_2': 'oo', 'x_1_0': 'bc', 'x_1_1': 'oo', 'x_1_2': 'ad'}. Best is trial 49 with value: 0.7444444444444445.
[I 2024-10-13 11:38:58,895] Trial 55 finished with value: 1.1444444444444444 and parameters: {'x_0_0': 'bd', 'x_0_1': 'ac', 'x_0_2': 'oo', 'x_1_0': 'bc', 'x_1_1': 'oo', 'x_1_2': 'oo'}. Best is trial 49 with value: 0.7444444444444445.
[I 2024-10-13 11:38:59,009] Trial 56 finished with value: 0.6222222222222222 and parameters: {'x_0_0': 'ad', 'x_0_1': 'oo', 'x_0_2': 'oo', 'x_1_0': 'bc', 'x_1_1': 'ad', 'x_1_2': 'oo'}. Best is trial 56 with value: 0.6222222222222222.
[I 2024-10-13 11:38:59,171] Trial 57 finished with value: 0.7222222222222222 and parameters: {'x_0_0': 'ad', 'x_0_1': 'oo', 'x_0_2': 'bc', 'x_1_0': 'bc', 'x_1_1': 'ad', 'x_1_2': 'oo'}. Best is trial 56 with value: 0.6222222222222222.
[I 2024-10-13 11:38:59,316] Trial 58 finished with value: 0.7222222222222222 and parameters: {'x_0_0': 'ad', 'x_0_1': 'oo', 'x_0_2': 'oo', 'x_1_0': 'bc', 'x_1_1': 'ad', 'x_1_2': 'ab'}. Best is trial 56 with value: 0.6222222222222222.
[I 2024-10-13 11:38:59,442] Trial 59 finished with value: 0.9555555555555556 and parameters: {'x_0_0': 'ad', 'x_0_1': 'oo', 'x_0_2': 'oo', 'x_1_0': 'ab', 'x_1_1': 'ad', 'x_1_2': 'oo'}. Best is trial 56 with value: 0.6222222222222222.
[I 2024-10-13 11:38:59,611] Trial 60 finished with value: 0.6222222222222222 and parameters: {'x_0_0': 'ad', 'x_0_1': 'oo', 'x_0_2': 'oo', 'x_1_0': 'bc', 'x_1_1': 'ac', 'x_1_2': 'oo'}. Best is trial 56 with value: 0.6222222222222222.
[I 2024-10-13 11:38:59,740] Trial 61 finished with value: 0.7222222222222222 and parameters: {'x_0_0': 'ad', 'x_0_1': 'oo', 'x_0_2': 'ad', 'x_1_0': 'bc', 'x_1_1': 'ac', 'x_1_2': 'oo'}. Best is trial 56 with value: 0.6222222222222222.
[I 2024-10-13 11:38:59,871] Trial 62 finished with value: 0.8444444444444444 and parameters: {'x_0_0': 'ad', 'x_0_1': 'oo', 'x_0_2': 'oo', 'x_1_0': 'bc', 'x_1_1': 'bd', 'x_1_2': 'oo'}. Best is trial 56 with value: 0.6222222222222222.
[I 2024-10-13 11:39:00,038] Trial 63 finished with value: 0.7222222222222222 and parameters: {'x_0_0': 'ad', 'x_0_1': 'oo', 'x_0_2': 'bd', 'x_1_0': 'bc', 'x_1_1': 'ac', 'x_1_2': 'oo'}. Best is trial 56 with value: 0.6222222222222222.
[I 2024-10-13 11:39:00,168] Trial 64 finished with value: 0.6222222222222222 and parameters: {'x_0_0': 'bd', 'x_0_1': 'oo', 'x_0_2': 'oo', 'x_1_0': 'bc', 'x_1_1': 'ac', 'x_1_2': 'oo'}. Best is trial 56 with value: 0.6222222222222222.
[I 2024-10-13 11:39:00,297] Trial 65 finished with value: 0.7222222222222222 and parameters: {'x_0_0': 'bd', 'x_0_1': 'oo', 'x_0_2': 'oo', 'x_1_0': 'bc', 'x_1_1': 'ac', 'x_1_2': 'cd'}. Best is trial 56 with value: 0.6222222222222222.
[I 2024-10-13 11:39:00,459] Trial 66 finished with value: 0.6222222222222222 and parameters: {'x_0_0': 'bd', 'x_0_1': 'oo', 'x_0_2': 'oo', 'x_1_0': 'bc', 'x_1_1': 'ad', 'x_1_2': 'oo'}. Best is trial 56 with value: 0.6222222222222222.
[I 2024-10-13 11:39:00,600] Trial 67 finished with value: 0.7222222222222222 and parameters: {'x_0_0': 'bd', 'x_0_1': 'oo', 'x_0_2': 'cd', 'x_1_0': 'bc', 'x_1_1': 'ac', 'x_1_2': 'oo'}. Best is trial 56 with value: 0.6222222222222222.
[I 2024-10-13 11:39:00,735] Trial 68 finished with value: 1.1777777777777778 and parameters: {'x_0_0': 'ab', 'x_0_1': 'oo', 'x_0_2': 'oo', 'x_1_0': 'bc', 'x_1_1': 'ac', 'x_1_2': 'oo'}. Best is trial 56 with value: 0.6222222222222222.
[I 2024-10-13 11:39:00,919] Trial 69 finished with value: 0.7222222222222222 and parameters: {'x_0_0': 'bd', 'x_0_1': 'oo', 'x_0_2': 'oo', 'x_1_0': 'bc', 'x_1_1': 'ad', 'x_1_2': 'ac'}. Best is trial 56 with value: 0.6222222222222222.
[I 2024-10-13 11:39:01,065] Trial 70 finished with value: 0.7222222222222222 and parameters: {'x_0_0': 'ad', 'x_0_1': 'oo', 'x_0_2': 'oo', 'x_1_0': 'bc', 'x_1_1': 'ac', 'x_1_2': 'bc'}. Best is trial 56 with value: 0.6222222222222222.
[I 2024-10-13 11:39:01,201] Trial 71 finished with value: 1.0666666666666667 and parameters: {'x_0_0': 'bd', 'x_0_1': 'oo', 'x_0_2': 'oo', 'x_1_0': 'ad', 'x_1_1': 'ac', 'x_1_2': 'oo'}. Best is trial 56 with value: 0.6222222222222222.
[I 2024-10-13 11:39:01,351] Trial 72 finished with value: 1.0666666666666667 and parameters: {'x_0_0': 'ad', 'x_0_1': 'oo', 'x_0_2': 'oo', 'x_1_0': 'ac', 'x_1_1': 'ac', 'x_1_2': 'oo'}. Best is trial 56 with value: 0.6222222222222222.
[I 2024-10-13 11:39:01,476] Trial 73 finished with value: 0.7222222222222222 and parameters: {'x_0_0': 'bd', 'x_0_1': 'oo', 'x_0_2': 'oo', 'x_1_0': 'bc', 'x_1_1': 'ad', 'x_1_2': 'bd'}. Best is trial 56 with value: 0.6222222222222222.
[I 2024-10-13 11:39:01,606] Trial 74 finished with value: 0.7222222222222222 and parameters: {'x_0_0': 'ad', 'x_0_1': 'oo', 'x_0_2': 'ab', 'x_1_0': 'bc', 'x_1_1': 'ad', 'x_1_2': 'oo'}. Best is trial 56 with value: 0.6222222222222222.
[I 2024-10-13 11:39:01,755] Trial 75 finished with value: 0.7222222222222222 and parameters: {'x_0_0': 'ad', 'x_0_1': 'oo', 'x_0_2': 'oo', 'x_1_0': 'bc', 'x_1_1': 'ad', 'x_1_2': 'ad'}. Best is trial 56 with value: 0.6222222222222222.
[I 2024-10-13 11:39:01,887] Trial 76 finished with value: 0.7222222222222222 and parameters: {'x_0_0': 'bd', 'x_0_1': 'oo', 'x_0_2': 'ac', 'x_1_0': 'bc', 'x_1_1': 'ad', 'x_1_2': 'oo'}. Best is trial 56 with value: 0.6222222222222222.
[I 2024-10-13 11:39:02,014] Trial 77 finished with value: 0.8444444444444444 and parameters: {'x_0_0': 'bd', 'x_0_1': 'oo', 'x_0_2': 'oo', 'x_1_0': 'bc', 'x_1_1': 'bc', 'x_1_2': 'oo'}. Best is trial 56 with value: 0.6222222222222222.
[I 2024-10-13 11:39:02,167] Trial 78 finished with value: 0.7222222222222222 and parameters: {'x_0_0': 'bd', 'x_0_1': 'oo', 'x_0_2': 'oo', 'x_1_0': 'bc', 'x_1_1': 'ad', 'x_1_2': 'bc'}. Best is trial 56 with value: 0.6222222222222222.
[I 2024-10-13 11:39:02,294] Trial 79 finished with value: 1.0666666666666667 and parameters: {'x_0_0': 'bd', 'x_0_1': 'oo', 'x_0_2': 'oo', 'x_1_0': 'cd', 'x_1_1': 'ac', 'x_1_2': 'oo'}. Best is trial 56 with value: 0.6222222222222222.
[I 2024-10-13 11:39:02,422] Trial 80 finished with value: 1.0555555555555556 and parameters: {'x_0_0': 'ac', 'x_0_1': 'ab', 'x_0_2': 'oo', 'x_1_0': 'oo', 'x_1_1': 'oo', 'x_1_2': 'oo'}. Best is trial 56 with value: 0.6222222222222222.
[I 2024-10-13 11:39:02,598] Trial 81 finished with value: 0.7333333333333334 and parameters: {'x_0_0': 'bd', 'x_0_1': 'oo', 'x_0_2': 'oo', 'x_1_0': 'bc', 'x_1_1': 'ab', 'x_1_2': 'oo'}. Best is trial 56 with value: 0.6222222222222222.
[I 2024-10-13 11:39:02,745] Trial 82 finished with value: 0.7222222222222222 and parameters: {'x_0_0': 'ad', 'x_0_1': 'oo', 'x_0_2': 'cd', 'x_1_0': 'bc', 'x_1_1': 'ad', 'x_1_2': 'oo'}. Best is trial 56 with value: 0.6222222222222222.
[I 2024-10-13 11:39:02,902] Trial 83 finished with value: 1.0222222222222221 and parameters: {'x_0_0': 'ad', 'x_0_1': 'ac', 'x_0_2': 'oo', 'x_1_0': 'bc', 'x_1_1': 'ac', 'x_1_2': 'oo'}. Best is trial 56 with value: 0.6222222222222222.
[I 2024-10-13 11:39:03,122] Trial 84 finished with value: 0.7333333333333334 and parameters: {'x_0_0': 'ad', 'x_0_1': 'oo', 'x_0_2': 'oo', 'x_1_0': 'bc', 'x_1_1': 'ab', 'x_1_2': 'oo'}. Best is trial 56 with value: 0.6222222222222222.
[I 2024-10-13 11:39:03,300] Trial 85 finished with value: 0.7222222222222222 and parameters: {'x_0_0': 'ad', 'x_0_1': 'oo', 'x_0_2': 'ac', 'x_1_0': 'bc', 'x_1_1': 'ac', 'x_1_2': 'oo'}. Best is trial 56 with value: 0.6222222222222222.
[I 2024-10-13 11:39:03,562] Trial 86 finished with value: 0.7222222222222222 and parameters: {'x_0_0': 'ad', 'x_0_1': 'oo', 'x_0_2': 'oo', 'x_1_0': 'bc', 'x_1_1': 'ad', 'x_1_2': 'cd'}. Best is trial 56 with value: 0.6222222222222222.
[I 2024-10-13 11:39:03,743] Trial 87 finished with value: 1.0 and parameters: {'x_0_0': 'oo', 'x_0_1': 'oo', 'x_0_2': 'oo', 'x_1_0': 'oo', 'x_1_1': 'oo', 'x_1_2': 'oo'}. Best is trial 56 with value: 0.6222222222222222.
[I 2024-10-13 11:39:03,954] Trial 88 finished with value: 0.6222222222222222 and parameters: {'x_0_0': 'ad', 'x_0_1': 'oo', 'x_0_2': 'oo', 'x_1_0': 'bc', 'x_1_1': 'ad', 'x_1_2': 'oo'}. Best is trial 56 with value: 0.6222222222222222.
