2024-10-13 11:31:04,305 - INFO - Experiment settings: {'name': 'bo_benchmark_tpe_map2_seed3', 'seed': 3, 'map': array([[0.1, 0.4, 0.1],
       [0.2, 0.1, 0.1]]), 'iter_bo': 500, 'storage': 'sqlite:////Users/keisukeonoue/ws/constrained_BO_v2/results/dbs/2024-10-13_11-31-04_bo_benchmark_tpe_map2_seed3.db', 'sampler': <optuna.samplers._tpe.sampler.TPESampler object at 0x1078a9e50>, 'acqf_settings': {'trade_off_param': 3.0, 'batch_size': 10, 'maximize': False}}
[I 2024-10-13 11:31:04,644] A new study created in RDB with name: bo_benchmark_tpe_map2_seed3
2024-10-13 11:31:04,645 - INFO - Created new study 'bo_benchmark_tpe_map2_seed3' in sqlite:////Users/keisukeonoue/ws/constrained_BO_v2/results/dbs/2024-10-13_11-31-04_bo_benchmark_tpe_map2_seed3.db
[I 2024-10-13 11:31:04,680] Trial 0 finished with value: 1.011111111111111 and parameters: {'x_0_0': 'bd', 'x_0_1': 'bd', 'x_0_2': 'oo', 'x_1_0': 'bc', 'x_1_1': 'ac', 'x_1_2': 'ab'}. Best is trial 0 with value: 1.011111111111111.
[I 2024-10-13 11:31:04,719] Trial 1 finished with value: 1.4444444444444444 and parameters: {'x_0_0': 'ad', 'x_0_1': 'ad', 'x_0_2': 'ab', 'x_1_0': 'bd', 'x_1_1': 'ac', 'x_1_2': 'cd'}. Best is trial 0 with value: 1.011111111111111.
[I 2024-10-13 11:31:04,742] Trial 2 finished with value: 1.6666666666666665 and parameters: {'x_0_0': 'bc', 'x_0_1': 'bc', 'x_0_2': 'bd', 'x_1_0': 'ad', 'x_1_1': 'ad', 'x_1_2': 'ac'}. Best is trial 0 with value: 1.011111111111111.
[I 2024-10-13 11:31:04,764] Trial 3 finished with value: 1.2444444444444445 and parameters: {'x_0_0': 'bd', 'x_0_1': 'bc', 'x_0_2': 'oo', 'x_1_0': 'bd', 'x_1_1': 'ac', 'x_1_2': 'oo'}. Best is trial 0 with value: 1.011111111111111.
[I 2024-10-13 11:31:04,785] Trial 4 finished with value: 1.6666666666666665 and parameters: {'x_0_0': 'ac', 'x_0_1': 'bd', 'x_0_2': 'ab', 'x_1_0': 'ad', 'x_1_1': 'ac', 'x_1_2': 'bd'}. Best is trial 0 with value: 1.011111111111111.
[I 2024-10-13 11:31:04,806] Trial 5 finished with value: 1.4444444444444444 and parameters: {'x_0_0': 'ad', 'x_0_1': 'cd', 'x_0_2': 'ab', 'x_1_0': 'bd', 'x_1_1': 'ab', 'x_1_2': 'bc'}. Best is trial 0 with value: 1.011111111111111.
[I 2024-10-13 11:31:04,829] Trial 6 finished with value: 1.1666666666666665 and parameters: {'x_0_0': 'ad', 'x_0_1': 'oo', 'x_0_2': 'ac', 'x_1_0': 'ad', 'x_1_1': 'cd', 'x_1_2': 'oo'}. Best is trial 0 with value: 1.011111111111111.
[I 2024-10-13 11:31:04,850] Trial 7 finished with value: 2.0 and parameters: {'x_0_0': 'cd', 'x_0_1': 'cd', 'x_0_2': 'ac', 'x_1_0': 'bd', 'x_1_1': 'cd', 'x_1_2': 'ad'}. Best is trial 0 with value: 1.011111111111111.
[I 2024-10-13 11:31:04,873] Trial 8 finished with value: 1.6666666666666665 and parameters: {'x_0_0': 'bd', 'x_0_1': 'bc', 'x_0_2': 'ad', 'x_1_0': 'ac', 'x_1_1': 'ab', 'x_1_2': 'bc'}. Best is trial 0 with value: 1.011111111111111.
[I 2024-10-13 11:31:04,894] Trial 9 finished with value: 1.6666666666666665 and parameters: {'x_0_0': 'ad', 'x_0_1': 'ab', 'x_0_2': 'bd', 'x_1_0': 'ad', 'x_1_1': 'ad', 'x_1_2': 'ab'}. Best is trial 0 with value: 1.011111111111111.
[I 2024-10-13 11:31:04,918] Trial 10 finished with value: 1.5777777777777777 and parameters: {'x_0_0': 'ab', 'x_0_1': 'bd', 'x_0_2': 'oo', 'x_1_0': 'bc', 'x_1_1': 'oo', 'x_1_2': 'ab'}. Best is trial 0 with value: 1.011111111111111.
[I 2024-10-13 11:31:04,941] Trial 11 finished with value: 1.2 and parameters: {'x_0_0': 'oo', 'x_0_1': 'oo', 'x_0_2': 'bc', 'x_1_0': 'oo', 'x_1_1': 'cd', 'x_1_2': 'oo'}. Best is trial 0 with value: 1.011111111111111.
[I 2024-10-13 11:31:04,970] Trial 12 finished with value: 1.5666666666666667 and parameters: {'x_0_0': 'bd', 'x_0_1': 'ac', 'x_0_2': 'cd', 'x_1_0': 'cd', 'x_1_1': 'bc', 'x_1_2': 'oo'}. Best is trial 0 with value: 1.011111111111111.
[I 2024-10-13 11:31:04,999] Trial 13 finished with value: 1.3777777777777778 and parameters: {'x_0_0': 'ab', 'x_0_1': 'oo', 'x_0_2': 'ac', 'x_1_0': 'bc', 'x_1_1': 'bd', 'x_1_2': 'ab'}. Best is trial 0 with value: 1.011111111111111.
[I 2024-10-13 11:31:05,032] Trial 14 finished with value: 2.0 and parameters: {'x_0_0': 'cd', 'x_0_1': 'bd', 'x_0_2': 'ac', 'x_1_0': 'ab', 'x_1_1': 'cd', 'x_1_2': 'ac'}. Best is trial 0 with value: 1.011111111111111.
[I 2024-10-13 11:31:05,057] Trial 15 finished with value: 1.3 and parameters: {'x_0_0': 'oo', 'x_0_1': 'oo', 'x_0_2': 'oo', 'x_1_0': 'bc', 'x_1_1': 'oo', 'x_1_2': 'cd'}. Best is trial 0 with value: 1.011111111111111.
[I 2024-10-13 11:31:05,081] Trial 16 finished with value: 1.4444444444444444 and parameters: {'x_0_0': 'bc', 'x_0_1': 'ac', 'x_0_2': 'cd', 'x_1_0': 'ac', 'x_1_1': 'bd', 'x_1_2': 'bd'}. Best is trial 0 with value: 1.011111111111111.
[I 2024-10-13 11:31:05,106] Trial 17 finished with value: 1.0 and parameters: {'x_0_0': 'ac', 'x_0_1': 'ad', 'x_0_2': 'bc', 'x_1_0': 'ab', 'x_1_1': 'bc', 'x_1_2': 'ad'}. Best is trial 17 with value: 1.0.
[I 2024-10-13 11:31:05,130] Trial 18 finished with value: 1.0 and parameters: {'x_0_0': 'ac', 'x_0_1': 'ad', 'x_0_2': 'bc', 'x_1_0': 'ab', 'x_1_1': 'bc', 'x_1_2': 'ad'}. Best is trial 17 with value: 1.0.
[I 2024-10-13 11:31:05,153] Trial 19 finished with value: 1.0 and parameters: {'x_0_0': 'ac', 'x_0_1': 'ad', 'x_0_2': 'bc', 'x_1_0': 'ab', 'x_1_1': 'bc', 'x_1_2': 'ad'}. Best is trial 17 with value: 1.0.
[I 2024-10-13 11:31:05,178] Trial 20 finished with value: 1.0 and parameters: {'x_0_0': 'ac', 'x_0_1': 'ad', 'x_0_2': 'bc', 'x_1_0': 'ab', 'x_1_1': 'bc', 'x_1_2': 'ad'}. Best is trial 17 with value: 1.0.
[I 2024-10-13 11:31:05,205] Trial 21 finished with value: 1.0 and parameters: {'x_0_0': 'ac', 'x_0_1': 'ad', 'x_0_2': 'bc', 'x_1_0': 'ab', 'x_1_1': 'bc', 'x_1_2': 'ad'}. Best is trial 17 with value: 1.0.
[I 2024-10-13 11:31:05,230] Trial 22 finished with value: 1.0 and parameters: {'x_0_0': 'ac', 'x_0_1': 'ad', 'x_0_2': 'bc', 'x_1_0': 'ab', 'x_1_1': 'bc', 'x_1_2': 'ad'}. Best is trial 17 with value: 1.0.
[I 2024-10-13 11:31:05,255] Trial 23 finished with value: 1.0 and parameters: {'x_0_0': 'ac', 'x_0_1': 'ad', 'x_0_2': 'bc', 'x_1_0': 'ab', 'x_1_1': 'bc', 'x_1_2': 'ad'}. Best is trial 17 with value: 1.0.
[I 2024-10-13 11:31:05,281] Trial 24 finished with value: 1.0 and parameters: {'x_0_0': 'ac', 'x_0_1': 'ad', 'x_0_2': 'bc', 'x_1_0': 'ab', 'x_1_1': 'bc', 'x_1_2': 'ad'}. Best is trial 17 with value: 1.0.
[I 2024-10-13 11:31:05,306] Trial 25 finished with value: 1.0 and parameters: {'x_0_0': 'ac', 'x_0_1': 'ad', 'x_0_2': 'bc', 'x_1_0': 'ab', 'x_1_1': 'bc', 'x_1_2': 'ad'}. Best is trial 17 with value: 1.0.
[I 2024-10-13 11:31:05,349] Trial 26 finished with value: 1.3555555555555556 and parameters: {'x_0_0': 'ac', 'x_0_1': 'ab', 'x_0_2': 'ad', 'x_1_0': 'oo', 'x_1_1': 'bc', 'x_1_2': 'ad'}. Best is trial 17 with value: 1.0.
[I 2024-10-13 11:31:05,375] Trial 27 finished with value: 1.0 and parameters: {'x_0_0': 'ac', 'x_0_1': 'ad', 'x_0_2': 'bc', 'x_1_0': 'cd', 'x_1_1': 'bc', 'x_1_2': 'ad'}. Best is trial 17 with value: 1.0.
[I 2024-10-13 11:31:05,400] Trial 28 finished with value: 1.0 and parameters: {'x_0_0': 'ac', 'x_0_1': 'ad', 'x_0_2': 'bc', 'x_1_0': 'ab', 'x_1_1': 'bc', 'x_1_2': 'ad'}. Best is trial 17 with value: 1.0.
[I 2024-10-13 11:31:05,425] Trial 29 finished with value: 1.0 and parameters: {'x_0_0': 'ac', 'x_0_1': 'ad', 'x_0_2': 'bc', 'x_1_0': 'ab', 'x_1_1': 'bc', 'x_1_2': 'ad'}. Best is trial 17 with value: 1.0.
[I 2024-10-13 11:31:05,449] Trial 30 finished with value: 1.7777777777777777 and parameters: {'x_0_0': 'ab', 'x_0_1': 'ad', 'x_0_2': 'bc', 'x_1_0': 'ab', 'x_1_1': 'ab', 'x_1_2': 'bc'}. Best is trial 17 with value: 1.0.
[I 2024-10-13 11:31:05,473] Trial 31 finished with value: 1.0 and parameters: {'x_0_0': 'ac', 'x_0_1': 'ad', 'x_0_2': 'bc', 'x_1_0': 'ab', 'x_1_1': 'bc', 'x_1_2': 'ad'}. Best is trial 17 with value: 1.0.
[I 2024-10-13 11:31:05,499] Trial 32 finished with value: 1.0 and parameters: {'x_0_0': 'ac', 'x_0_1': 'ad', 'x_0_2': 'bc', 'x_1_0': 'ab', 'x_1_1': 'bc', 'x_1_2': 'ad'}. Best is trial 17 with value: 1.0.
[I 2024-10-13 11:31:05,526] Trial 33 finished with value: 1.4444444444444444 and parameters: {'x_0_0': 'ac', 'x_0_1': 'ad', 'x_0_2': 'bd', 'x_1_0': 'ab', 'x_1_1': 'ad', 'x_1_2': 'cd'}. Best is trial 17 with value: 1.0.
[I 2024-10-13 11:31:05,551] Trial 34 finished with value: 1.0 and parameters: {'x_0_0': 'bc', 'x_0_1': 'ad', 'x_0_2': 'bc', 'x_1_0': 'ab', 'x_1_1': 'bc', 'x_1_2': 'ac'}. Best is trial 17 with value: 1.0.
[I 2024-10-13 11:31:05,576] Trial 35 finished with value: 2.0 and parameters: {'x_0_0': 'cd', 'x_0_1': 'ac', 'x_0_2': 'ad', 'x_1_0': 'ac', 'x_1_1': 'ac', 'x_1_2': 'bd'}. Best is trial 17 with value: 1.0.
[I 2024-10-13 11:31:05,601] Trial 36 finished with value: 1.7999999999999998 and parameters: {'x_0_0': 'oo', 'x_0_1': 'cd', 'x_0_2': 'ab', 'x_1_0': 'cd', 'x_1_1': 'oo', 'x_1_2': 'ad'}. Best is trial 17 with value: 1.0.
[I 2024-10-13 11:31:05,628] Trial 37 finished with value: 1.4666666666666666 and parameters: {'x_0_0': 'ac', 'x_0_1': 'bc', 'x_0_2': 'cd', 'x_1_0': 'oo', 'x_1_1': 'bd', 'x_1_2': 'ad'}. Best is trial 17 with value: 1.0.
[I 2024-10-13 11:31:05,653] Trial 38 finished with value: 1.5555555555555556 and parameters: {'x_0_0': 'ac', 'x_0_1': 'ab', 'x_0_2': 'bc', 'x_1_0': 'bd', 'x_1_1': 'ac', 'x_1_2': 'ac'}. Best is trial 17 with value: 1.0.
[I 2024-10-13 11:31:05,676] Trial 39 finished with value: 1.2222222222222223 and parameters: {'x_0_0': 'bc', 'x_0_1': 'ad', 'x_0_2': 'ab', 'x_1_0': 'ab', 'x_1_1': 'bc', 'x_1_2': 'cd'}. Best is trial 17 with value: 1.0.
[I 2024-10-13 11:31:05,703] Trial 40 finished with value: 1.6666666666666665 and parameters: {'x_0_0': 'ad', 'x_0_1': 'cd', 'x_0_2': 'bd', 'x_1_0': 'ad', 'x_1_1': 'ad', 'x_1_2': 'ad'}. Best is trial 17 with value: 1.0.
[I 2024-10-13 11:31:05,728] Trial 41 finished with value: 1.0 and parameters: {'x_0_0': 'ac', 'x_0_1': 'ad', 'x_0_2': 'bc', 'x_1_0': 'ab', 'x_1_1': 'bc', 'x_1_2': 'ad'}. Best is trial 17 with value: 1.0.
[I 2024-10-13 11:31:05,758] Trial 42 finished with value: 1.0 and parameters: {'x_0_0': 'ac', 'x_0_1': 'ad', 'x_0_2': 'bc', 'x_1_0': 'ab', 'x_1_1': 'bc', 'x_1_2': 'ad'}. Best is trial 17 with value: 1.0.
[I 2024-10-13 11:31:05,789] Trial 43 finished with value: 1.0 and parameters: {'x_0_0': 'ac', 'x_0_1': 'ad', 'x_0_2': 'bc', 'x_1_0': 'ab', 'x_1_1': 'bc', 'x_1_2': 'ad'}. Best is trial 17 with value: 1.0.
[I 2024-10-13 11:31:05,817] Trial 44 finished with value: 1.4555555555555555 and parameters: {'x_0_0': 'bd', 'x_0_1': 'bc', 'x_0_2': 'oo', 'x_1_0': 'ab', 'x_1_1': 'ab', 'x_1_2': 'bc'}. Best is trial 17 with value: 1.0.
[I 2024-10-13 11:31:05,843] Trial 45 finished with value: 1.6666666666666665 and parameters: {'x_0_0': 'ac', 'x_0_1': 'bd', 'x_0_2': 'bc', 'x_1_0': 'bd', 'x_1_1': 'bc', 'x_1_2': 'ad'}. Best is trial 17 with value: 1.0.
[I 2024-10-13 11:31:05,871] Trial 46 finished with value: 1.9 and parameters: {'x_0_0': 'cd', 'x_0_1': 'ad', 'x_0_2': 'bc', 'x_1_0': 'ab', 'x_1_1': 'bc', 'x_1_2': 'oo'}. Best is trial 17 with value: 1.0.
[I 2024-10-13 11:31:05,898] Trial 47 finished with value: 1.6666666666666665 and parameters: {'x_0_0': 'ad', 'x_0_1': 'ad', 'x_0_2': 'ad', 'x_1_0': 'ad', 'x_1_1': 'cd', 'x_1_2': 'ab'}. Best is trial 17 with value: 1.0.
[I 2024-10-13 11:31:05,923] Trial 48 finished with value: 1.6777777777777778 and parameters: {'x_0_0': 'ab', 'x_0_1': 'ab', 'x_0_2': 'ac', 'x_1_0': 'bc', 'x_1_1': 'oo', 'x_1_2': 'bd'}. Best is trial 17 with value: 1.0.
[I 2024-10-13 11:31:05,949] Trial 49 finished with value: 1.2666666666666666 and parameters: {'x_0_0': 'bd', 'x_0_1': 'oo', 'x_0_2': 'bc', 'x_1_0': 'ac', 'x_1_1': 'bc', 'x_1_2': 'ad'}. Best is trial 17 with value: 1.0.
[I 2024-10-13 11:31:05,974] Trial 50 finished with value: 1.9 and parameters: {'x_0_0': 'oo', 'x_0_1': 'bd', 'x_0_2': 'cd', 'x_1_0': 'ab', 'x_1_1': 'ac', 'x_1_2': 'ad'}. Best is trial 17 with value: 1.0.
[I 2024-10-13 11:31:05,999] Trial 51 finished with value: 1.0 and parameters: {'x_0_0': 'ac', 'x_0_1': 'ad', 'x_0_2': 'bc', 'x_1_0': 'ab', 'x_1_1': 'bc', 'x_1_2': 'ad'}. Best is trial 17 with value: 1.0.
[I 2024-10-13 11:31:06,024] Trial 52 finished with value: 1.0 and parameters: {'x_0_0': 'ac', 'x_0_1': 'ad', 'x_0_2': 'bc', 'x_1_0': 'ab', 'x_1_1': 'bc', 'x_1_2': 'ad'}. Best is trial 17 with value: 1.0.
[I 2024-10-13 11:31:06,048] Trial 53 finished with value: 1.0 and parameters: {'x_0_0': 'ac', 'x_0_1': 'ad', 'x_0_2': 'bc', 'x_1_0': 'ab', 'x_1_1': 'bc', 'x_1_2': 'ad'}. Best is trial 17 with value: 1.0.
[I 2024-10-13 11:31:06,072] Trial 54 finished with value: 1.0444444444444443 and parameters: {'x_0_0': 'ac', 'x_0_1': 'ac', 'x_0_2': 'oo', 'x_1_0': 'oo', 'x_1_1': 'bd', 'x_1_2': 'oo'}. Best is trial 17 with value: 1.0.
[I 2024-10-13 11:31:06,096] Trial 55 finished with value: 1.1111111111111112 and parameters: {'x_0_0': 'ac', 'x_0_1': 'ad', 'x_0_2': 'bc', 'x_1_0': 'ab', 'x_1_1': 'bc', 'x_1_2': 'ab'}. Best is trial 17 with value: 1.0.
[I 2024-10-13 11:31:06,121] Trial 56 finished with value: 1.4444444444444444 and parameters: {'x_0_0': 'ac', 'x_0_1': 'ad', 'x_0_2': 'ab', 'x_1_0': 'cd', 'x_1_1': 'ad', 'x_1_2': 'ad'}. Best is trial 17 with value: 1.0.
[I 2024-10-13 11:31:06,145] Trial 57 finished with value: 1.6666666666666665 and parameters: {'x_0_0': 'ac', 'x_0_1': 'cd', 'x_0_2': 'bd', 'x_1_0': 'ab', 'x_1_1': 'bc', 'x_1_2': 'bc'}. Best is trial 17 with value: 1.0.
[I 2024-10-13 11:31:06,169] Trial 58 finished with value: 1.4444444444444444 and parameters: {'x_0_0': 'ac', 'x_0_1': 'ad', 'x_0_2': 'bc', 'x_1_0': 'bc', 'x_1_1': 'cd', 'x_1_2': 'ad'}. Best is trial 17 with value: 1.0.
[I 2024-10-13 11:31:06,194] Trial 59 finished with value: 1.3333333333333333 and parameters: {'x_0_0': 'bc', 'x_0_1': 'ad', 'x_0_2': 'ac', 'x_1_0': 'ab', 'x_1_1': 'ab', 'x_1_2': 'cd'}. Best is trial 17 with value: 1.0.
[I 2024-10-13 11:31:06,221] Trial 60 finished with value: 1.7777777777777777 and parameters: {'x_0_0': 'ab', 'x_0_1': 'bc', 'x_0_2': 'bc', 'x_1_0': 'bd', 'x_1_1': 'bc', 'x_1_2': 'ac'}. Best is trial 17 with value: 1.0.
[I 2024-10-13 11:31:06,246] Trial 61 finished with value: 1.0 and parameters: {'x_0_0': 'ac', 'x_0_1': 'ad', 'x_0_2': 'bc', 'x_1_0': 'ab', 'x_1_1': 'bc', 'x_1_2': 'ad'}. Best is trial 17 with value: 1.0.
[I 2024-10-13 11:31:06,284] Trial 62 finished with value: 1.0 and parameters: {'x_0_0': 'ac', 'x_0_1': 'ad', 'x_0_2': 'bc', 'x_1_0': 'ab', 'x_1_1': 'bc', 'x_1_2': 'ad'}. Best is trial 17 with value: 1.0.
[I 2024-10-13 11:31:06,309] Trial 63 finished with value: 1.0 and parameters: {'x_0_0': 'ac', 'x_0_1': 'ad', 'x_0_2': 'bc', 'x_1_0': 'ab', 'x_1_1': 'bc', 'x_1_2': 'ad'}. Best is trial 17 with value: 1.0.
[I 2024-10-13 11:31:06,335] Trial 64 finished with value: 1.2666666666666666 and parameters: {'x_0_0': 'ac', 'x_0_1': 'oo', 'x_0_2': 'bc', 'x_1_0': 'ab', 'x_1_1': 'bc', 'x_1_2': 'ad'}. Best is trial 17 with value: 1.0.
[I 2024-10-13 11:31:06,367] Trial 65 finished with value: 2.0 and parameters: {'x_0_0': 'cd', 'x_0_1': 'ad', 'x_0_2': 'bc', 'x_1_0': 'ab', 'x_1_1': 'bc', 'x_1_2': 'ad'}. Best is trial 17 with value: 1.0.
[I 2024-10-13 11:31:06,393] Trial 66 finished with value: 1.3444444444444446 and parameters: {'x_0_0': 'ac', 'x_0_1': 'ad', 'x_0_2': 'bc', 'x_1_0': 'ac', 'x_1_1': 'oo', 'x_1_2': 'bd'}. Best is trial 17 with value: 1.0.
[I 2024-10-13 11:31:06,418] Trial 67 finished with value: 1.9 and parameters: {'x_0_0': 'oo', 'x_0_1': 'ac', 'x_0_2': 'cd', 'x_1_0': 'ad', 'x_1_1': 'bc', 'x_1_2': 'ad'}. Best is trial 17 with value: 1.0.
[I 2024-10-13 11:31:06,444] Trial 68 finished with value: 1.5555555555555556 and parameters: {'x_0_0': 'ad', 'x_0_1': 'ad', 'x_0_2': 'ad', 'x_1_0': 'ab', 'x_1_1': 'bc', 'x_1_2': 'ad'}. Best is trial 17 with value: 1.0.
[I 2024-10-13 11:31:06,468] Trial 69 finished with value: 1.3555555555555556 and parameters: {'x_0_0': 'ac', 'x_0_1': 'ab', 'x_0_2': 'bc', 'x_1_0': 'oo', 'x_1_1': 'bd', 'x_1_2': 'ad'}. Best is trial 17 with value: 1.0.
[I 2024-10-13 11:31:06,493] Trial 70 finished with value: 1.011111111111111 and parameters: {'x_0_0': 'ac', 'x_0_1': 'ad', 'x_0_2': 'oo', 'x_1_0': 'cd', 'x_1_1': 'bc', 'x_1_2': 'ab'}. Best is trial 17 with value: 1.0.
[I 2024-10-13 11:31:06,519] Trial 71 finished with value: 1.0 and parameters: {'x_0_0': 'ac', 'x_0_1': 'ad', 'x_0_2': 'bc', 'x_1_0': 'ab', 'x_1_1': 'bc', 'x_1_2': 'ad'}. Best is trial 17 with value: 1.0.
[I 2024-10-13 11:31:06,543] Trial 72 finished with value: 1.0 and parameters: {'x_0_0': 'ac', 'x_0_1': 'ad', 'x_0_2': 'bc', 'x_1_0': 'ab', 'x_1_1': 'bc', 'x_1_2': 'ad'}. Best is trial 17 with value: 1.0.
[I 2024-10-13 11:31:06,569] Trial 73 finished with value: 1.5555555555555556 and parameters: {'x_0_0': 'bd', 'x_0_1': 'ad', 'x_0_2': 'bc', 'x_1_0': 'ab', 'x_1_1': 'bc', 'x_1_2': 'ad'}. Best is trial 17 with value: 1.0.
[I 2024-10-13 11:31:06,594] Trial 74 finished with value: 1.4444444444444444 and parameters: {'x_0_0': 'ac', 'x_0_1': 'ad', 'x_0_2': 'bc', 'x_1_0': 'ab', 'x_1_1': 'ac', 'x_1_2': 'ad'}. Best is trial 17 with value: 1.0.
[I 2024-10-13 11:31:06,618] Trial 75 finished with value: 1.3444444444444446 and parameters: {'x_0_0': 'ac', 'x_0_1': 'ad', 'x_0_2': 'bd', 'x_1_0': 'ab', 'x_1_1': 'ad', 'x_1_2': 'oo'}. Best is trial 17 with value: 1.0.
[I 2024-10-13 11:31:06,643] Trial 76 finished with value: 1.6666666666666665 and parameters: {'x_0_0': 'ac', 'x_0_1': 'bd', 'x_0_2': 'bc', 'x_1_0': 'ab', 'x_1_1': 'bc', 'x_1_2': 'bc'}. Best is trial 17 with value: 1.0.
[I 2024-10-13 11:31:06,668] Trial 77 finished with value: 1.6666666666666665 and parameters: {'x_0_0': 'bc', 'x_0_1': 'cd', 'x_0_2': 'ab', 'x_1_0': 'ab', 'x_1_1': 'ab', 'x_1_2': 'cd'}. Best is trial 17 with value: 1.0.
[I 2024-10-13 11:31:06,693] Trial 78 finished with value: 1.0 and parameters: {'x_0_0': 'ac', 'x_0_1': 'ad', 'x_0_2': 'bc', 'x_1_0': 'ab', 'x_1_1': 'bc', 'x_1_2': 'ac'}. Best is trial 17 with value: 1.0.
[I 2024-10-13 11:31:06,718] Trial 79 finished with value: 1.6666666666666665 and parameters: {'x_0_0': 'ac', 'x_0_1': 'bc', 'x_0_2': 'ac', 'x_1_0': 'bc', 'x_1_1': 'cd', 'x_1_2': 'ad'}. Best is trial 17 with value: 1.0.
[I 2024-10-13 11:31:06,742] Trial 80 finished with value: 1.7777777777777777 and parameters: {'x_0_0': 'ab', 'x_0_1': 'ad', 'x_0_2': 'bc', 'x_1_0': 'bd', 'x_1_1': 'bc', 'x_1_2': 'ad'}. Best is trial 17 with value: 1.0.
[I 2024-10-13 11:31:06,768] Trial 81 finished with value: 1.0 and parameters: {'x_0_0': 'ac', 'x_0_1': 'ad', 'x_0_2': 'bc', 'x_1_0': 'ab', 'x_1_1': 'bc', 'x_1_2': 'ad'}. Best is trial 17 with value: 1.0.
[I 2024-10-13 11:31:06,793] Trial 82 finished with value: 1.0 and parameters: {'x_0_0': 'ac', 'x_0_1': 'ad', 'x_0_2': 'bc', 'x_1_0': 'ab', 'x_1_1': 'bc', 'x_1_2': 'ad'}. Best is trial 17 with value: 1.0.
[I 2024-10-13 11:31:06,818] Trial 83 finished with value: 1.0 and parameters: {'x_0_0': 'ac', 'x_0_1': 'ad', 'x_0_2': 'bc', 'x_1_0': 'ab', 'x_1_1': 'bc', 'x_1_2': 'ad'}. Best is trial 17 with value: 1.0.
[I 2024-10-13 11:31:06,843] Trial 84 finished with value: 1.2666666666666666 and parameters: {'x_0_0': 'ac', 'x_0_1': 'oo', 'x_0_2': 'bc', 'x_1_0': 'ab', 'x_1_1': 'bc', 'x_1_2': 'ad'}. Best is trial 17 with value: 1.0.
[I 2024-10-13 11:31:06,869] Trial 85 finished with value: 2.0 and parameters: {'x_0_0': 'cd', 'x_0_1': 'ad', 'x_0_2': 'ad', 'x_1_0': 'ac', 'x_1_1': 'bc', 'x_1_2': 'bd'}. Best is trial 17 with value: 1.0.
[I 2024-10-13 11:31:06,895] Trial 86 finished with value: 1.5666666666666667 and parameters: {'x_0_0': 'ad', 'x_0_1': 'ad', 'x_0_2': 'bc', 'x_1_0': 'ad', 'x_1_1': 'oo', 'x_1_2': 'ad'}. Best is trial 17 with value: 1.0.
[I 2024-10-13 11:31:06,920] Trial 87 finished with value: 1.9 and parameters: {'x_0_0': 'oo', 'x_0_1': 'ab', 'x_0_2': 'cd', 'x_1_0': 'ab', 'x_1_1': 'bc', 'x_1_2': 'ad'}. Best is trial 17 with value: 1.0.
[I 2024-10-13 11:31:06,946] Trial 88 finished with value: 1.4444444444444444 and parameters: {'x_0_0': 'ac', 'x_0_1': 'ac', 'x_0_2': 'bc', 'x_1_0': 'ab', 'x_1_1': 'bd', 'x_1_2': 'ad'}. Best is trial 17 with value: 1.0.
[I 2024-10-13 11:31:06,972] Trial 89 finished with value: 0.7999999999999999 and parameters: {'x_0_0': 'ac', 'x_0_1': 'ad', 'x_0_2': 'bc', 'x_1_0': 'oo', 'x_1_1': 'bc', 'x_1_2': 'ad'}. Best is trial 89 with value: 0.7999999999999999.
[I 2024-10-13 11:31:06,999] Trial 90 finished with value: 1.4666666666666666 and parameters: {'x_0_0': 'bd', 'x_0_1': 'ad', 'x_0_2': 'bc', 'x_1_0': 'oo', 'x_1_1': 'bc', 'x_1_2': 'ad'}. Best is trial 89 with value: 0.7999999999999999.
[I 2024-10-13 11:31:07,027] Trial 91 finished with value: 0.7999999999999999 and parameters: {'x_0_0': 'ac', 'x_0_1': 'ad', 'x_0_2': 'bc', 'x_1_0': 'oo', 'x_1_1': 'bc', 'x_1_2': 'ad'}. Best is trial 89 with value: 0.7999999999999999.
[I 2024-10-13 11:31:07,054] Trial 92 finished with value: 0.7999999999999999 and parameters: {'x_0_0': 'ac', 'x_0_1': 'ad', 'x_0_2': 'bc', 'x_1_0': 'oo', 'x_1_1': 'bc', 'x_1_2': 'ad'}. Best is trial 89 with value: 0.7999999999999999.
[I 2024-10-13 11:31:07,079] Trial 93 finished with value: 0.7999999999999999 and parameters: {'x_0_0': 'ac', 'x_0_1': 'ad', 'x_0_2': 'bc', 'x_1_0': 'oo', 'x_1_1': 'bc', 'x_1_2': 'ad'}. Best is trial 89 with value: 0.7999999999999999.
[I 2024-10-13 11:31:07,106] Trial 94 finished with value: 0.7999999999999999 and parameters: {'x_0_0': 'ac', 'x_0_1': 'ad', 'x_0_2': 'bc', 'x_1_0': 'oo', 'x_1_1': 'bc', 'x_1_2': 'ad'}. Best is trial 89 with value: 0.7999999999999999.
[I 2024-10-13 11:31:07,132] Trial 95 finished with value: 0.7999999999999999 and parameters: {'x_0_0': 'ac', 'x_0_1': 'ad', 'x_0_2': 'bc', 'x_1_0': 'oo', 'x_1_1': 'bc', 'x_1_2': 'ad'}. Best is trial 89 with value: 0.7999999999999999.
[I 2024-10-13 11:31:07,158] Trial 96 finished with value: 0.7999999999999999 and parameters: {'x_0_0': 'ac', 'x_0_1': 'ad', 'x_0_2': 'bc', 'x_1_0': 'oo', 'x_1_1': 'bc', 'x_1_2': 'ad'}. Best is trial 89 with value: 0.7999999999999999.
[I 2024-10-13 11:31:07,183] Trial 97 finished with value: 0.7999999999999999 and parameters: {'x_0_0': 'ac', 'x_0_1': 'ad', 'x_0_2': 'bc', 'x_1_0': 'oo', 'x_1_1': 'bc', 'x_1_2': 'ad'}. Best is trial 89 with value: 0.7999999999999999.
