[I 2024-10-13 11:41:18,758] Trial 404 finished with value: 0.5 and parameters: {'x_0_0': 'ad', 'x_0_1': 'oo', 'x_0_2': 'oo', 'x_1_0': 'bc', 'x_1_1': 'ac', 'x_1_2': 'ac'}. Best is trial 100 with value: 0.5.
[I 2024-10-13 11:41:19,428] Trial 405 finished with value: 0.5 and parameters: {'x_0_0': 'ad', 'x_0_1': 'oo', 'x_0_2': 'oo', 'x_1_0': 'bc', 'x_1_1': 'ac', 'x_1_2': 'ac'}. Best is trial 100 with value: 0.5.
[I 2024-10-13 11:41:20,267] Trial 406 finished with value: 0.5 and parameters: {'x_0_0': 'bd', 'x_0_1': 'oo', 'x_0_2': 'oo', 'x_1_0': 'bc', 'x_1_1': 'ac', 'x_1_2': 'ac'}. Best is trial 100 with value: 0.5.
[I 2024-10-13 11:41:21,037] Trial 407 finished with value: 0.8333333333333333 and parameters: {'x_0_0': 'bd', 'x_0_1': 'oo', 'x_0_2': 'oo', 'x_1_0': 'bc', 'x_1_1': 'ab', 'x_1_2': 'ac'}. Best is trial 100 with value: 0.5.
[I 2024-10-13 11:41:21,798] Trial 408 finished with value: 0.5 and parameters: {'x_0_0': 'ad', 'x_0_1': 'oo', 'x_0_2': 'oo', 'x_1_0': 'bc', 'x_1_1': 'ac', 'x_1_2': 'ad'}. Best is trial 100 with value: 0.5.
[I 2024-10-13 11:41:22,598] Trial 409 finished with value: 0.6 and parameters: {'x_0_0': 'bd', 'x_0_1': 'oo', 'x_0_2': 'ac', 'x_1_0': 'bc', 'x_1_1': 'ac', 'x_1_2': 'ad'}. Best is trial 100 with value: 0.5.
[I 2024-10-13 11:41:23,334] Trial 410 finished with value: 0.5 and parameters: {'x_0_0': 'bd', 'x_0_1': 'oo', 'x_0_2': 'oo', 'x_1_0': 'bc', 'x_1_1': 'ac', 'x_1_2': 'ac'}. Best is trial 100 with value: 0.5.
[I 2024-10-13 11:41:24,028] Trial 411 finished with value: 0.5 and parameters: {'x_0_0': 'bd', 'x_0_1': 'oo', 'x_0_2': 'oo', 'x_1_0': 'bc', 'x_1_1': 'ac', 'x_1_2': 'ad'}. Best is trial 100 with value: 0.5.
[I 2024-10-13 11:41:24,764] Trial 412 finished with value: 0.5 and parameters: {'x_0_0': 'bd', 'x_0_1': 'oo', 'x_0_2': 'oo', 'x_1_0': 'bc', 'x_1_1': 'ac', 'x_1_2': 'ac'}. Best is trial 100 with value: 0.5.
[I 2024-10-13 11:41:25,567] Trial 413 finished with value: 0.5 and parameters: {'x_0_0': 'ad', 'x_0_1': 'oo', 'x_0_2': 'oo', 'x_1_0': 'bc', 'x_1_1': 'ac', 'x_1_2': 'ad'}. Best is trial 100 with value: 0.5.
[I 2024-10-13 11:41:26,198] Trial 414 finished with value: 0.5 and parameters: {'x_0_0': 'ad', 'x_0_1': 'oo', 'x_0_2': 'oo', 'x_1_0': 'bc', 'x_1_1': 'ac', 'x_1_2': 'ac'}. Best is trial 100 with value: 0.5.
[I 2024-10-13 11:41:26,967] Trial 415 finished with value: 0.5 and parameters: {'x_0_0': 'ad', 'x_0_1': 'oo', 'x_0_2': 'oo', 'x_1_0': 'bc', 'x_1_1': 'ac', 'x_1_2': 'ac'}. Best is trial 100 with value: 0.5.
[I 2024-10-13 11:41:27,458] Trial 416 finished with value: 0.5 and parameters: {'x_0_0': 'bd', 'x_0_1': 'oo', 'x_0_2': 'oo', 'x_1_0': 'bc', 'x_1_1': 'ac', 'x_1_2': 'ad'}. Best is trial 100 with value: 0.5.
[I 2024-10-13 11:41:28,155] Trial 417 finished with value: 0.5 and parameters: {'x_0_0': 'ad', 'x_0_1': 'oo', 'x_0_2': 'oo', 'x_1_0': 'bc', 'x_1_1': 'ac', 'x_1_2': 'ac'}. Best is trial 100 with value: 0.5.
[I 2024-10-13 11:41:28,890] Trial 418 finished with value: 0.5 and parameters: {'x_0_0': 'bd', 'x_0_1': 'oo', 'x_0_2': 'oo', 'x_1_0': 'bc', 'x_1_1': 'ac', 'x_1_2': 'ac'}. Best is trial 100 with value: 0.5.
[I 2024-10-13 11:41:29,506] Trial 419 finished with value: 0.5 and parameters: {'x_0_0': 'bd', 'x_0_1': 'oo', 'x_0_2': 'oo', 'x_1_0': 'bc', 'x_1_1': 'ac', 'x_1_2': 'ad'}. Best is trial 100 with value: 0.5.
[I 2024-10-13 11:41:30,212] Trial 420 finished with value: 0.5 and parameters: {'x_0_0': 'ad', 'x_0_1': 'oo', 'x_0_2': 'oo', 'x_1_0': 'bc', 'x_1_1': 'ac', 'x_1_2': 'ac'}. Best is trial 100 with value: 0.5.
[I 2024-10-13 11:41:30,862] Trial 421 finished with value: 0.8444444444444444 and parameters: {'x_0_0': 'ad', 'x_0_1': 'oo', 'x_0_2': 'oo', 'x_1_0': 'bd', 'x_1_1': 'bd', 'x_1_2': 'oo'}. Best is trial 100 with value: 0.5.
[I 2024-10-13 11:41:31,585] Trial 422 finished with value: 0.5 and parameters: {'x_0_0': 'bd', 'x_0_1': 'oo', 'x_0_2': 'oo', 'x_1_0': 'bc', 'x_1_1': 'ac', 'x_1_2': 'ad'}. Best is trial 100 with value: 0.5.
[I 2024-10-13 11:41:32,153] Trial 423 finished with value: 0.5 and parameters: {'x_0_0': 'ad', 'x_0_1': 'oo', 'x_0_2': 'oo', 'x_1_0': 'bc', 'x_1_1': 'ac', 'x_1_2': 'ac'}. Best is trial 100 with value: 0.5.
[I 2024-10-13 11:41:32,885] Trial 424 finished with value: 0.8999999999999999 and parameters: {'x_0_0': 'ad', 'x_0_1': 'ad', 'x_0_2': 'oo', 'x_1_0': 'bc', 'x_1_1': 'ac', 'x_1_2': 'ac'}. Best is trial 100 with value: 0.5.
[I 2024-10-13 11:41:33,538] Trial 425 finished with value: 1.0555555555555556 and parameters: {'x_0_0': 'ad', 'x_0_1': 'oo', 'x_0_2': 'oo', 'x_1_0': 'ab', 'x_1_1': 'ac', 'x_1_2': 'ac'}. Best is trial 100 with value: 0.5.
[I 2024-10-13 11:41:34,271] Trial 426 finished with value: 0.5 and parameters: {'x_0_0': 'ad', 'x_0_1': 'oo', 'x_0_2': 'oo', 'x_1_0': 'bc', 'x_1_1': 'ac', 'x_1_2': 'ac'}. Best is trial 100 with value: 0.5.
[I 2024-10-13 11:41:35,127] Trial 427 finished with value: 0.5 and parameters: {'x_0_0': 'bd', 'x_0_1': 'oo', 'x_0_2': 'oo', 'x_1_0': 'bc', 'x_1_1': 'ac', 'x_1_2': 'ad'}. Best is trial 100 with value: 0.5.
[I 2024-10-13 11:41:35,879] Trial 428 finished with value: 0.5 and parameters: {'x_0_0': 'ad', 'x_0_1': 'oo', 'x_0_2': 'oo', 'x_1_0': 'bc', 'x_1_1': 'ac', 'x_1_2': 'ac'}. Best is trial 100 with value: 0.5.
[I 2024-10-13 11:41:36,601] Trial 429 finished with value: 0.5 and parameters: {'x_0_0': 'ad', 'x_0_1': 'oo', 'x_0_2': 'oo', 'x_1_0': 'bc', 'x_1_1': 'ac', 'x_1_2': 'ac'}. Best is trial 100 with value: 0.5.
[I 2024-10-13 11:41:37,351] Trial 430 finished with value: 0.5 and parameters: {'x_0_0': 'ad', 'x_0_1': 'oo', 'x_0_2': 'oo', 'x_1_0': 'bc', 'x_1_1': 'ac', 'x_1_2': 'ac'}. Best is trial 100 with value: 0.5.
[I 2024-10-13 11:41:38,112] Trial 431 finished with value: 0.5 and parameters: {'x_0_0': 'ad', 'x_0_1': 'oo', 'x_0_2': 'oo', 'x_1_0': 'bc', 'x_1_1': 'ac', 'x_1_2': 'ad'}. Best is trial 100 with value: 0.5.
[I 2024-10-13 11:41:38,783] Trial 432 finished with value: 0.5 and parameters: {'x_0_0': 'ad', 'x_0_1': 'oo', 'x_0_2': 'oo', 'x_1_0': 'bc', 'x_1_1': 'ac', 'x_1_2': 'ac'}. Best is trial 100 with value: 0.5.
[I 2024-10-13 11:41:39,564] Trial 433 finished with value: 0.8444444444444444 and parameters: {'x_0_0': 'bd', 'x_0_1': 'oo', 'x_0_2': 'oo', 'x_1_0': 'bd', 'x_1_1': 'bc', 'x_1_2': 'oo'}. Best is trial 100 with value: 0.5.
[I 2024-10-13 11:41:40,386] Trial 434 finished with value: 1.0222222222222221 and parameters: {'x_0_0': 'ac', 'x_0_1': 'ad', 'x_0_2': 'oo', 'x_1_0': 'cd', 'x_1_1': 'bc', 'x_1_2': 'oo'}. Best is trial 100 with value: 0.5.
[I 2024-10-13 11:41:41,177] Trial 435 finished with value: 0.9666666666666667 and parameters: {'x_0_0': 'bc', 'x_0_1': 'oo', 'x_0_2': 'oo', 'x_1_0': 'ad', 'x_1_1': 'oo', 'x_1_2': 'oo'}. Best is trial 100 with value: 0.5.
[I 2024-10-13 11:41:42,037] Trial 436 finished with value: 0.5 and parameters: {'x_0_0': 'ad', 'x_0_1': 'oo', 'x_0_2': 'oo', 'x_1_0': 'bc', 'x_1_1': 'ac', 'x_1_2': 'ac'}. Best is trial 100 with value: 0.5.
[I 2024-10-13 11:41:42,696] Trial 437 finished with value: 0.5 and parameters: {'x_0_0': 'bd', 'x_0_1': 'oo', 'x_0_2': 'oo', 'x_1_0': 'bc', 'x_1_1': 'ac', 'x_1_2': 'ac'}. Best is trial 100 with value: 0.5.
[I 2024-10-13 11:41:43,513] Trial 438 finished with value: 0.5 and parameters: {'x_0_0': 'ad', 'x_0_1': 'oo', 'x_0_2': 'oo', 'x_1_0': 'bc', 'x_1_1': 'ac', 'x_1_2': 'ac'}. Best is trial 100 with value: 0.5.
[I 2024-10-13 11:41:44,276] Trial 439 finished with value: 0.5 and parameters: {'x_0_0': 'bd', 'x_0_1': 'oo', 'x_0_2': 'oo', 'x_1_0': 'bc', 'x_1_1': 'ac', 'x_1_2': 'ac'}. Best is trial 100 with value: 0.5.
[I 2024-10-13 11:41:45,295] Trial 440 finished with value: 1.1444444444444444 and parameters: {'x_0_0': 'ac', 'x_0_1': 'ad', 'x_0_2': 'oo', 'x_1_0': 'ad', 'x_1_1': 'oo', 'x_1_2': 'oo'}. Best is trial 100 with value: 0.5.
[I 2024-10-13 11:41:46,699] Trial 441 finished with value: 0.5 and parameters: {'x_0_0': 'bd', 'x_0_1': 'oo', 'x_0_2': 'oo', 'x_1_0': 'bc', 'x_1_1': 'ac', 'x_1_2': 'ad'}. Best is trial 100 with value: 0.5.
[I 2024-10-13 11:41:47,620] Trial 442 finished with value: 0.5 and parameters: {'x_0_0': 'bd', 'x_0_1': 'oo', 'x_0_2': 'oo', 'x_1_0': 'bc', 'x_1_1': 'ac', 'x_1_2': 'ad'}. Best is trial 100 with value: 0.5.
[I 2024-10-13 11:41:48,592] Trial 443 finished with value: 1.0666666666666667 and parameters: {'x_0_0': 'ac', 'x_0_1': 'oo', 'x_0_2': 'oo', 'x_1_0': 'cd', 'x_1_1': 'oo', 'x_1_2': 'ab'}. Best is trial 100 with value: 0.5.
[I 2024-10-13 11:41:49,414] Trial 444 finished with value: 0.5 and parameters: {'x_0_0': 'bd', 'x_0_1': 'oo', 'x_0_2': 'oo', 'x_1_0': 'bc', 'x_1_1': 'ac', 'x_1_2': 'ac'}. Best is trial 100 with value: 0.5.
[I 2024-10-13 11:41:50,277] Trial 445 finished with value: 0.5 and parameters: {'x_0_0': 'bd', 'x_0_1': 'oo', 'x_0_2': 'oo', 'x_1_0': 'bc', 'x_1_1': 'ac', 'x_1_2': 'ac'}. Best is trial 100 with value: 0.5.
[I 2024-10-13 11:41:51,108] Trial 446 finished with value: 0.5 and parameters: {'x_0_0': 'bd', 'x_0_1': 'oo', 'x_0_2': 'oo', 'x_1_0': 'bc', 'x_1_1': 'ac', 'x_1_2': 'ad'}. Best is trial 100 with value: 0.5.
[I 2024-10-13 11:41:52,034] Trial 447 finished with value: 0.5 and parameters: {'x_0_0': 'bd', 'x_0_1': 'oo', 'x_0_2': 'oo', 'x_1_0': 'bc', 'x_1_1': 'ac', 'x_1_2': 'ad'}. Best is trial 100 with value: 0.5.
[I 2024-10-13 11:41:52,990] Trial 448 finished with value: 0.5 and parameters: {'x_0_0': 'ad', 'x_0_1': 'oo', 'x_0_2': 'oo', 'x_1_0': 'bc', 'x_1_1': 'ac', 'x_1_2': 'ad'}. Best is trial 100 with value: 0.5.
[I 2024-10-13 11:41:54,064] Trial 449 finished with value: 0.5 and parameters: {'x_0_0': 'ad', 'x_0_1': 'oo', 'x_0_2': 'oo', 'x_1_0': 'bc', 'x_1_1': 'ac', 'x_1_2': 'ac'}. Best is trial 100 with value: 0.5.
[I 2024-10-13 11:41:55,006] Trial 450 finished with value: 0.5 and parameters: {'x_0_0': 'ad', 'x_0_1': 'oo', 'x_0_2': 'oo', 'x_1_0': 'bc', 'x_1_1': 'ac', 'x_1_2': 'ad'}. Best is trial 100 with value: 0.5.
[I 2024-10-13 11:41:55,875] Trial 451 finished with value: 0.5 and parameters: {'x_0_0': 'bd', 'x_0_1': 'oo', 'x_0_2': 'oo', 'x_1_0': 'bc', 'x_1_1': 'ac', 'x_1_2': 'ac'}. Best is trial 100 with value: 0.5.
[I 2024-10-13 11:41:56,538] Trial 452 finished with value: 0.8555555555555556 and parameters: {'x_0_0': 'bd', 'x_0_1': 'oo', 'x_0_2': 'oo', 'x_1_0': 'ab', 'x_1_1': 'oo', 'x_1_2': 'oo'}. Best is trial 100 with value: 0.5.
[I 2024-10-13 11:41:57,530] Trial 453 finished with value: 0.5 and parameters: {'x_0_0': 'bd', 'x_0_1': 'oo', 'x_0_2': 'oo', 'x_1_0': 'bc', 'x_1_1': 'ac', 'x_1_2': 'ad'}. Best is trial 100 with value: 0.5.
[I 2024-10-13 11:41:58,380] Trial 454 finished with value: 0.5 and parameters: {'x_0_0': 'ad', 'x_0_1': 'oo', 'x_0_2': 'oo', 'x_1_0': 'bc', 'x_1_1': 'ac', 'x_1_2': 'ac'}. Best is trial 100 with value: 0.5.
[I 2024-10-13 11:41:59,329] Trial 455 finished with value: 0.9666666666666667 and parameters: {'x_0_0': 'ac', 'x_0_1': 'oo', 'x_0_2': 'oo', 'x_1_0': 'ab', 'x_1_1': 'oo', 'x_1_2': 'oo'}. Best is trial 100 with value: 0.5.
[I 2024-10-13 11:42:00,249] Trial 456 finished with value: 0.8444444444444444 and parameters: {'x_0_0': 'bd', 'x_0_1': 'oo', 'x_0_2': 'oo', 'x_1_0': 'bd', 'x_1_1': 'bd', 'x_1_2': 'oo'}. Best is trial 100 with value: 0.5.
[I 2024-10-13 11:42:01,293] Trial 457 finished with value: 0.5 and parameters: {'x_0_0': 'bd', 'x_0_1': 'oo', 'x_0_2': 'oo', 'x_1_0': 'bc', 'x_1_1': 'ac', 'x_1_2': 'ac'}. Best is trial 100 with value: 0.5.
[I 2024-10-13 11:42:02,163] Trial 458 finished with value: 1.1444444444444444 and parameters: {'x_0_0': 'bd', 'x_0_1': 'ab', 'x_0_2': 'oo', 'x_1_0': 'bd', 'x_1_1': 'oo', 'x_1_2': 'oo'}. Best is trial 100 with value: 0.5.
[I 2024-10-13 11:42:03,162] Trial 459 finished with value: 0.5 and parameters: {'x_0_0': 'bd', 'x_0_1': 'oo', 'x_0_2': 'oo', 'x_1_0': 'bc', 'x_1_1': 'ac', 'x_1_2': 'ac'}. Best is trial 100 with value: 0.5.
[I 2024-10-13 11:42:04,044] Trial 460 finished with value: 0.5 and parameters: {'x_0_0': 'bd', 'x_0_1': 'oo', 'x_0_2': 'oo', 'x_1_0': 'bc', 'x_1_1': 'ac', 'x_1_2': 'ac'}. Best is trial 100 with value: 0.5.
[I 2024-10-13 11:42:04,830] Trial 461 finished with value: 0.5 and parameters: {'x_0_0': 'ad', 'x_0_1': 'oo', 'x_0_2': 'oo', 'x_1_0': 'bc', 'x_1_1': 'ac', 'x_1_2': 'ac'}. Best is trial 100 with value: 0.5.
[I 2024-10-13 11:42:05,761] Trial 462 finished with value: 0.5 and parameters: {'x_0_0': 'bd', 'x_0_1': 'oo', 'x_0_2': 'oo', 'x_1_0': 'bc', 'x_1_1': 'ac', 'x_1_2': 'ad'}. Best is trial 100 with value: 0.5.
[I 2024-10-13 11:42:06,655] Trial 463 finished with value: 0.5 and parameters: {'x_0_0': 'ad', 'x_0_1': 'oo', 'x_0_2': 'oo', 'x_1_0': 'bc', 'x_1_1': 'ac', 'x_1_2': 'ac'}. Best is trial 100 with value: 0.5.
[I 2024-10-13 11:42:07,530] Trial 464 finished with value: 1.1666666666666665 and parameters: {'x_0_0': 'bc', 'x_0_1': 'bc', 'x_0_2': 'oo', 'x_1_0': 'oo', 'x_1_1': 'oo', 'x_1_2': 'oo'}. Best is trial 100 with value: 0.5.
[I 2024-10-13 11:42:08,485] Trial 465 finished with value: 0.5 and parameters: {'x_0_0': 'ad', 'x_0_1': 'oo', 'x_0_2': 'oo', 'x_1_0': 'bc', 'x_1_1': 'ac', 'x_1_2': 'ac'}. Best is trial 100 with value: 0.5.
[I 2024-10-13 11:42:09,369] Trial 466 finished with value: 1.0222222222222221 and parameters: {'x_0_0': 'ad', 'x_0_1': 'ab', 'x_0_2': 'oo', 'x_1_0': 'bc', 'x_1_1': 'ad', 'x_1_2': 'oo'}. Best is trial 100 with value: 0.5.
[I 2024-10-13 11:42:10,388] Trial 467 finished with value: 0.5 and parameters: {'x_0_0': 'bd', 'x_0_1': 'oo', 'x_0_2': 'oo', 'x_1_0': 'bc', 'x_1_1': 'ac', 'x_1_2': 'ac'}. Best is trial 100 with value: 0.5.
[I 2024-10-13 11:42:11,351] Trial 468 finished with value: 0.5 and parameters: {'x_0_0': 'ad', 'x_0_1': 'oo', 'x_0_2': 'oo', 'x_1_0': 'bc', 'x_1_1': 'ac', 'x_1_2': 'ac'}. Best is trial 100 with value: 0.5.
[I 2024-10-13 11:42:12,256] Trial 469 finished with value: 0.5 and parameters: {'x_0_0': 'bd', 'x_0_1': 'oo', 'x_0_2': 'oo', 'x_1_0': 'bc', 'x_1_1': 'ac', 'x_1_2': 'ad'}. Best is trial 100 with value: 0.5.
[I 2024-10-13 11:42:13,178] Trial 470 finished with value: 0.5 and parameters: {'x_0_0': 'ad', 'x_0_1': 'oo', 'x_0_2': 'oo', 'x_1_0': 'bc', 'x_1_1': 'ac', 'x_1_2': 'ac'}. Best is trial 100 with value: 0.5.
[I 2024-10-13 11:42:14,163] Trial 471 finished with value: 0.5 and parameters: {'x_0_0': 'ad', 'x_0_1': 'oo', 'x_0_2': 'oo', 'x_1_0': 'bc', 'x_1_1': 'ac', 'x_1_2': 'ac'}. Best is trial 100 with value: 0.5.
[I 2024-10-13 11:42:14,897] Trial 472 finished with value: 0.5 and parameters: {'x_0_0': 'bd', 'x_0_1': 'oo', 'x_0_2': 'oo', 'x_1_0': 'bc', 'x_1_1': 'ac', 'x_1_2': 'ac'}. Best is trial 100 with value: 0.5.
[I 2024-10-13 11:42:15,855] Trial 473 finished with value: 0.5 and parameters: {'x_0_0': 'ad', 'x_0_1': 'oo', 'x_0_2': 'oo', 'x_1_0': 'bc', 'x_1_1': 'ac', 'x_1_2': 'ac'}. Best is trial 100 with value: 0.5.
[I 2024-10-13 11:42:16,700] Trial 474 finished with value: 0.5 and parameters: {'x_0_0': 'ad', 'x_0_1': 'oo', 'x_0_2': 'oo', 'x_1_0': 'bc', 'x_1_1': 'ac', 'x_1_2': 'ac'}. Best is trial 100 with value: 0.5.
[I 2024-10-13 11:42:17,631] Trial 475 finished with value: 1.4 and parameters: {'x_0_0': 'oo', 'x_0_1': 'oo', 'x_0_2': 'oo', 'x_1_0': 'bc', 'x_1_1': 'ac', 'x_1_2': 'ac'}. Best is trial 100 with value: 0.5.
[I 2024-10-13 11:42:18,638] Trial 476 finished with value: 0.5 and parameters: {'x_0_0': 'ad', 'x_0_1': 'oo', 'x_0_2': 'oo', 'x_1_0': 'bc', 'x_1_1': 'ac', 'x_1_2': 'ac'}. Best is trial 100 with value: 0.5.
[I 2024-10-13 11:42:19,662] Trial 477 finished with value: 0.5 and parameters: {'x_0_0': 'ad', 'x_0_1': 'oo', 'x_0_2': 'oo', 'x_1_0': 'bc', 'x_1_1': 'ac', 'x_1_2': 'ad'}. Best is trial 100 with value: 0.5.
[I 2024-10-13 11:42:20,550] Trial 478 finished with value: 0.5 and parameters: {'x_0_0': 'bd', 'x_0_1': 'oo', 'x_0_2': 'oo', 'x_1_0': 'bc', 'x_1_1': 'ac', 'x_1_2': 'ac'}. Best is trial 100 with value: 0.5.
[I 2024-10-13 11:42:21,435] Trial 479 finished with value: 0.5 and parameters: {'x_0_0': 'bd', 'x_0_1': 'oo', 'x_0_2': 'oo', 'x_1_0': 'bc', 'x_1_1': 'ac', 'x_1_2': 'ad'}. Best is trial 100 with value: 0.5.
[I 2024-10-13 11:42:22,333] Trial 480 finished with value: 1.0666666666666667 and parameters: {'x_0_0': 'bc', 'x_0_1': 'oo', 'x_0_2': 'oo', 'x_1_0': 'cd', 'x_1_1': 'ad', 'x_1_2': 'oo'}. Best is trial 100 with value: 0.5.
[I 2024-10-13 11:42:23,260] Trial 481 finished with value: 0.5 and parameters: {'x_0_0': 'bd', 'x_0_1': 'oo', 'x_0_2': 'oo', 'x_1_0': 'bc', 'x_1_1': 'ac', 'x_1_2': 'ac'}. Best is trial 100 with value: 0.5.
[I 2024-10-13 11:42:24,391] Trial 482 finished with value: 0.5 and parameters: {'x_0_0': 'bd', 'x_0_1': 'oo', 'x_0_2': 'oo', 'x_1_0': 'bc', 'x_1_1': 'ac', 'x_1_2': 'ad'}. Best is trial 100 with value: 0.5.
[I 2024-10-13 11:42:25,249] Trial 483 finished with value: 0.5 and parameters: {'x_0_0': 'bd', 'x_0_1': 'oo', 'x_0_2': 'oo', 'x_1_0': 'bc', 'x_1_1': 'ac', 'x_1_2': 'ac'}. Best is trial 100 with value: 0.5.
[I 2024-10-13 11:42:26,318] Trial 484 finished with value: 0.5 and parameters: {'x_0_0': 'ad', 'x_0_1': 'oo', 'x_0_2': 'oo', 'x_1_0': 'bc', 'x_1_1': 'ac', 'x_1_2': 'ac'}. Best is trial 100 with value: 0.5.
[I 2024-10-13 11:42:27,245] Trial 485 finished with value: 0.8444444444444444 and parameters: {'x_0_0': 'ad', 'x_0_1': 'oo', 'x_0_2': 'oo', 'x_1_0': 'bd', 'x_1_1': 'oo', 'x_1_2': 'ab'}. Best is trial 100 with value: 0.5.
[I 2024-10-13 11:42:28,198] Trial 486 finished with value: 0.8666666666666667 and parameters: {'x_0_0': 'ac', 'x_0_1': 'oo', 'x_0_2': 'oo', 'x_1_0': 'oo', 'x_1_1': 'ad', 'x_1_2': 'oo'}. Best is trial 100 with value: 0.5.
[I 2024-10-13 11:42:29,339] Trial 487 finished with value: 0.5 and parameters: {'x_0_0': 'bd', 'x_0_1': 'oo', 'x_0_2': 'oo', 'x_1_0': 'bc', 'x_1_1': 'ac', 'x_1_2': 'ac'}. Best is trial 100 with value: 0.5.
[I 2024-10-13 11:42:30,378] Trial 488 finished with value: 0.9666666666666667 and parameters: {'x_0_0': 'ac', 'x_0_1': 'oo', 'x_0_2': 'oo', 'x_1_0': 'ac', 'x_1_1': 'oo', 'x_1_2': 'oo'}. Best is trial 100 with value: 0.5.
[I 2024-10-13 11:42:31,416] Trial 489 finished with value: 0.5 and parameters: {'x_0_0': 'bd', 'x_0_1': 'oo', 'x_0_2': 'oo', 'x_1_0': 'bc', 'x_1_1': 'ac', 'x_1_2': 'ac'}. Best is trial 100 with value: 0.5.
[I 2024-10-13 11:42:32,436] Trial 490 finished with value: 0.5 and parameters: {'x_0_0': 'ad', 'x_0_1': 'oo', 'x_0_2': 'oo', 'x_1_0': 'bc', 'x_1_1': 'ac', 'x_1_2': 'ac'}. Best is trial 100 with value: 0.5.
[I 2024-10-13 11:42:33,470] Trial 491 finished with value: 0.5 and parameters: {'x_0_0': 'bd', 'x_0_1': 'oo', 'x_0_2': 'oo', 'x_1_0': 'bc', 'x_1_1': 'ac', 'x_1_2': 'ac'}. Best is trial 100 with value: 0.5.
[I 2024-10-13 11:42:34,413] Trial 492 finished with value: 0.5 and parameters: {'x_0_0': 'ad', 'x_0_1': 'oo', 'x_0_2': 'oo', 'x_1_0': 'bc', 'x_1_1': 'ac', 'x_1_2': 'ac'}. Best is trial 100 with value: 0.5.
[I 2024-10-13 11:42:35,509] Trial 493 finished with value: 0.5 and parameters: {'x_0_0': 'bd', 'x_0_1': 'oo', 'x_0_2': 'oo', 'x_1_0': 'bc', 'x_1_1': 'ac', 'x_1_2': 'ac'}. Best is trial 100 with value: 0.5.
[I 2024-10-13 11:42:36,537] Trial 494 finished with value: 0.5 and parameters: {'x_0_0': 'ad', 'x_0_1': 'oo', 'x_0_2': 'oo', 'x_1_0': 'bc', 'x_1_1': 'ac', 'x_1_2': 'ad'}. Best is trial 100 with value: 0.5.
[I 2024-10-13 11:42:37,490] Trial 495 finished with value: 0.5 and parameters: {'x_0_0': 'ad', 'x_0_1': 'oo', 'x_0_2': 'oo', 'x_1_0': 'bc', 'x_1_1': 'ac', 'x_1_2': 'ad'}. Best is trial 100 with value: 0.5.
[I 2024-10-13 11:42:38,446] Trial 496 finished with value: 0.5 and parameters: {'x_0_0': 'bd', 'x_0_1': 'oo', 'x_0_2': 'oo', 'x_1_0': 'bc', 'x_1_1': 'ac', 'x_1_2': 'ad'}. Best is trial 100 with value: 0.5.
[I 2024-10-13 11:42:39,335] Trial 497 finished with value: 0.8999999999999999 and parameters: {'x_0_0': 'bd', 'x_0_1': 'ac', 'x_0_2': 'oo', 'x_1_0': 'bc', 'x_1_1': 'ac', 'x_1_2': 'ac'}. Best is trial 100 with value: 0.5.
[I 2024-10-13 11:42:40,686] Trial 498 finished with value: 0.5 and parameters: {'x_0_0': 'ad', 'x_0_1': 'oo', 'x_0_2': 'oo', 'x_1_0': 'bc', 'x_1_1': 'ac', 'x_1_2': 'ad'}. Best is trial 100 with value: 0.5.
[I 2024-10-13 11:42:41,648] Trial 499 finished with value: 0.5 and parameters: {'x_0_0': 'bd', 'x_0_1': 'oo', 'x_0_2': 'oo', 'x_1_0': 'bc', 'x_1_1': 'ac', 'x_1_2': 'ac'}. Best is trial 100 with value: 0.5.
2024-10-13 11:42:41,679 - INFO - Best value: 0.5
2024-10-13 11:42:41,684 - INFO - Best params: {'x_0_0': 'ad', 'x_0_1': 'oo', 'x_0_2': 'oo', 'x_1_0': 'bc', 'x_1_1': 'ac', 'x_1_2': 'ac'}
2024-10-13 11:42:41,685 - INFO - Best Direction Matrix:
[['ad' 'oo' 'oo']
 ['bc' 'ac' 'ac']]
