[I 2024-10-13 11:29:23,228] Trial 187 finished with value: 1.4444444444444444 and parameters: {'x_0_0': 'ac', 'x_0_1': 'ad', 'x_0_2': 'ac', 'x_1_0': 'ac', 'x_1_1': 'ac', 'x_1_2': 'ac'}. Best is trial 2 with value: 0.9444444444444444.
[I 2024-10-13 11:29:23,248] Trial 188 finished with value: 1.6666666666666665 and parameters: {'x_0_0': 'ac', 'x_0_1': 'cd', 'x_0_2': 'cd', 'x_1_0': 'ad', 'x_1_1': 'ad', 'x_1_2': 'bd'}. Best is trial 2 with value: 0.9444444444444444.
[I 2024-10-13 11:29:23,275] Trial 189 finished with value: 1.4666666666666666 and parameters: {'x_0_0': 'bd', 'x_0_1': 'bc', 'x_0_2': 'cd', 'x_1_0': 'oo', 'x_1_1': 'bd', 'x_1_2': 'cd'}. Best is trial 2 with value: 0.9444444444444444.
[I 2024-10-13 11:29:23,296] Trial 190 finished with value: 1.7777777777777777 and parameters: {'x_0_0': 'ab', 'x_0_1': 'ad', 'x_0_2': 'bd', 'x_1_0': 'cd', 'x_1_1': 'cd', 'x_1_2': 'bc'}. Best is trial 2 with value: 0.9444444444444444.
[I 2024-10-13 11:29:23,316] Trial 191 finished with value: 1.8 and parameters: {'x_0_0': 'oo', 'x_0_1': 'bd', 'x_0_2': 'oo', 'x_1_0': 'cd', 'x_1_1': 'ac', 'x_1_2': 'bc'}. Best is trial 2 with value: 0.9444444444444444.
[I 2024-10-13 11:29:23,335] Trial 192 finished with value: 1.6666666666666665 and parameters: {'x_0_0': 'bd', 'x_0_1': 'cd', 'x_0_2': 'bc', 'x_1_0': 'ad', 'x_1_1': 'cd', 'x_1_2': 'bd'}. Best is trial 2 with value: 0.9444444444444444.
[I 2024-10-13 11:29:23,354] Trial 193 finished with value: 1.4666666666666666 and parameters: {'x_0_0': 'bc', 'x_0_1': 'cd', 'x_0_2': 'ab', 'x_1_0': 'oo', 'x_1_1': 'bc', 'x_1_2': 'cd'}. Best is trial 2 with value: 0.9444444444444444.
[I 2024-10-13 11:29:23,374] Trial 194 finished with value: 1.2666666666666666 and parameters: {'x_0_0': 'ad', 'x_0_1': 'oo', 'x_0_2': 'ab', 'x_1_0': 'cd', 'x_1_1': 'ad', 'x_1_2': 'ad'}. Best is trial 2 with value: 0.9444444444444444.
[I 2024-10-13 11:29:23,392] Trial 195 finished with value: 1.9 and parameters: {'x_0_0': 'oo', 'x_0_1': 'ab', 'x_0_2': 'cd', 'x_1_0': 'cd', 'x_1_1': 'cd', 'x_1_2': 'bc'}. Best is trial 2 with value: 0.9444444444444444.
[I 2024-10-13 11:29:23,411] Trial 196 finished with value: 1.7777777777777777 and parameters: {'x_0_0': 'ab', 'x_0_1': 'bc', 'x_0_2': 'cd', 'x_1_0': 'ad', 'x_1_1': 'ab', 'x_1_2': 'cd'}. Best is trial 2 with value: 0.9444444444444444.
[I 2024-10-13 11:29:23,430] Trial 197 finished with value: 1.1222222222222222 and parameters: {'x_0_0': 'ac', 'x_0_1': 'ad', 'x_0_2': 'oo', 'x_1_0': 'bc', 'x_1_1': 'bc', 'x_1_2': 'bc'}. Best is trial 2 with value: 0.9444444444444444.
[I 2024-10-13 11:29:23,449] Trial 198 finished with value: 1.5555555555555556 and parameters: {'x_0_0': 'bd', 'x_0_1': 'bc', 'x_0_2': 'ad', 'x_1_0': 'ab', 'x_1_1': 'ab', 'x_1_2': 'bd'}. Best is trial 2 with value: 0.9444444444444444.
[I 2024-10-13 11:29:23,467] Trial 199 finished with value: 1.7999999999999998 and parameters: {'x_0_0': 'oo', 'x_0_1': 'ad', 'x_0_2': 'ab', 'x_1_0': 'ab', 'x_1_1': 'oo', 'x_1_2': 'bc'}. Best is trial 2 with value: 0.9444444444444444.
[I 2024-10-13 11:29:23,487] Trial 200 finished with value: 1.4666666666666666 and parameters: {'x_0_0': 'bd', 'x_0_1': 'bc', 'x_0_2': 'ac', 'x_1_0': 'oo', 'x_1_1': 'bd', 'x_1_2': 'bc'}. Best is trial 2 with value: 0.9444444444444444.
[I 2024-10-13 11:29:23,506] Trial 201 finished with value: 1.5 and parameters: {'x_0_0': 'oo', 'x_0_1': 'oo', 'x_0_2': 'ad', 'x_1_0': 'ad', 'x_1_1': 'ac', 'x_1_2': 'cd'}. Best is trial 2 with value: 0.9444444444444444.
[I 2024-10-13 11:29:23,524] Trial 202 finished with value: 1.9 and parameters: {'x_0_0': 'oo', 'x_0_1': 'ab', 'x_0_2': 'bc', 'x_1_0': 'ad', 'x_1_1': 'ab', 'x_1_2': 'ab'}. Best is trial 2 with value: 0.9444444444444444.
[I 2024-10-13 11:29:23,545] Trial 203 finished with value: 1.3444444444444446 and parameters: {'x_0_0': 'ad', 'x_0_1': 'bc', 'x_0_2': 'ab', 'x_1_0': 'bd', 'x_1_1': 'cd', 'x_1_2': 'oo'}. Best is trial 2 with value: 0.9444444444444444.
[I 2024-10-13 11:29:23,564] Trial 204 finished with value: 1.6666666666666665 and parameters: {'x_0_0': 'bc', 'x_0_1': 'cd', 'x_0_2': 'bd', 'x_1_0': 'cd', 'x_1_1': 'ac', 'x_1_2': 'bc'}. Best is trial 2 with value: 0.9444444444444444.
[I 2024-10-13 11:29:23,583] Trial 205 finished with value: 1.2666666666666666 and parameters: {'x_0_0': 'bd', 'x_0_1': 'oo', 'x_0_2': 'ac', 'x_1_0': 'cd', 'x_1_1': 'ab', 'x_1_2': 'ad'}. Best is trial 2 with value: 0.9444444444444444.
[I 2024-10-13 11:29:23,601] Trial 206 finished with value: 1.9 and parameters: {'x_0_0': 'cd', 'x_0_1': 'ac', 'x_0_2': 'bd', 'x_1_0': 'cd', 'x_1_1': 'cd', 'x_1_2': 'oo'}. Best is trial 2 with value: 0.9444444444444444.
[I 2024-10-13 11:29:23,620] Trial 207 finished with value: 1.5555555555555556 and parameters: {'x_0_0': 'ad', 'x_0_1': 'ac', 'x_0_2': 'cd', 'x_1_0': 'ab', 'x_1_1': 'cd', 'x_1_2': 'bd'}. Best is trial 2 with value: 0.9444444444444444.
[I 2024-10-13 11:29:23,639] Trial 208 finished with value: 1.4666666666666666 and parameters: {'x_0_0': 'bd', 'x_0_1': 'ac', 'x_0_2': 'ab', 'x_1_0': 'oo', 'x_1_1': 'cd', 'x_1_2': 'ab'}. Best is trial 2 with value: 0.9444444444444444.
[I 2024-10-13 11:29:23,657] Trial 209 finished with value: 1.5666666666666667 and parameters: {'x_0_0': 'ad', 'x_0_1': 'bc', 'x_0_2': 'ac', 'x_1_0': 'ac', 'x_1_1': 'ac', 'x_1_2': 'oo'}. Best is trial 2 with value: 0.9444444444444444.
[I 2024-10-13 11:29:23,677] Trial 210 finished with value: 1.0333333333333332 and parameters: {'x_0_0': 'ac', 'x_0_1': 'ad', 'x_0_2': 'cd', 'x_1_0': 'oo', 'x_1_1': 'ab', 'x_1_2': 'oo'}. Best is trial 2 with value: 0.9444444444444444.
[I 2024-10-13 11:29:23,698] Trial 211 finished with value: 1.9 and parameters: {'x_0_0': 'oo', 'x_0_1': 'ab', 'x_0_2': 'bd', 'x_1_0': 'cd', 'x_1_1': 'ac', 'x_1_2': 'cd'}. Best is trial 2 with value: 0.9444444444444444.
[I 2024-10-13 11:29:23,718] Trial 212 finished with value: 1.5555555555555556 and parameters: {'x_0_0': 'bc', 'x_0_1': 'ab', 'x_0_2': 'ab', 'x_1_0': 'bc', 'x_1_1': 'ac', 'x_1_2': 'ad'}. Best is trial 2 with value: 0.9444444444444444.
[I 2024-10-13 11:29:23,741] Trial 213 finished with value: 1.3 and parameters: {'x_0_0': 'oo', 'x_0_1': 'oo', 'x_0_2': 'bc', 'x_1_0': 'oo', 'x_1_1': 'bd', 'x_1_2': 'cd'}. Best is trial 2 with value: 0.9444444444444444.
[I 2024-10-13 11:29:23,762] Trial 214 finished with value: 1.3333333333333333 and parameters: {'x_0_0': 'ac', 'x_0_1': 'ad', 'x_0_2': 'ac', 'x_1_0': 'bc', 'x_1_1': 'ab', 'x_1_2': 'ab'}. Best is trial 2 with value: 0.9444444444444444.
[I 2024-10-13 11:29:23,785] Trial 215 finished with value: 1.4444444444444444 and parameters: {'x_0_0': 'ac', 'x_0_1': 'ad', 'x_0_2': 'cd', 'x_1_0': 'bc', 'x_1_1': 'cd', 'x_1_2': 'bc'}. Best is trial 2 with value: 0.9444444444444444.
[I 2024-10-13 11:29:23,806] Trial 216 finished with value: 1.6666666666666665 and parameters: {'x_0_0': 'bc', 'x_0_1': 'cd', 'x_0_2': 'ab', 'x_1_0': 'bc', 'x_1_1': 'ab', 'x_1_2': 'cd'}. Best is trial 2 with value: 0.9444444444444444.
[I 2024-10-13 11:29:23,827] Trial 217 finished with value: 1.2222222222222223 and parameters: {'x_0_0': 'ad', 'x_0_1': 'ab', 'x_0_2': 'ac', 'x_1_0': 'bc', 'x_1_1': 'ad', 'x_1_2': 'ab'}. Best is trial 2 with value: 0.9444444444444444.
[I 2024-10-13 11:29:23,846] Trial 218 finished with value: 1.6666666666666665 and parameters: {'x_0_0': 'bd', 'x_0_1': 'ac', 'x_0_2': 'cd', 'x_1_0': 'ac', 'x_1_1': 'ab', 'x_1_2': 'ad'}. Best is trial 2 with value: 0.9444444444444444.
[I 2024-10-13 11:29:23,866] Trial 219 finished with value: 1.4555555555555557 and parameters: {'x_0_0': 'bd', 'x_0_1': 'bc', 'x_0_2': 'cd', 'x_1_0': 'ab', 'x_1_1': 'bc', 'x_1_2': 'oo'}. Best is trial 2 with value: 0.9444444444444444.
[I 2024-10-13 11:29:23,885] Trial 220 finished with value: 1.9 and parameters: {'x_0_0': 'oo', 'x_0_1': 'bc', 'x_0_2': 'bc', 'x_1_0': 'cd', 'x_1_1': 'ac', 'x_1_2': 'bc'}. Best is trial 2 with value: 0.9444444444444444.
[I 2024-10-13 11:29:23,909] Trial 221 finished with value: 1.5666666666666667 and parameters: {'x_0_0': 'ad', 'x_0_1': 'cd', 'x_0_2': 'bc', 'x_1_0': 'cd', 'x_1_1': 'ac', 'x_1_2': 'oo'}. Best is trial 2 with value: 0.9444444444444444.
[I 2024-10-13 11:29:23,929] Trial 222 finished with value: 1.6666666666666665 and parameters: {'x_0_0': 'bd', 'x_0_1': 'bd', 'x_0_2': 'ac', 'x_1_0': 'cd', 'x_1_1': 'bd', 'x_1_2': 'bc'}. Best is trial 2 with value: 0.9444444444444444.
[I 2024-10-13 11:29:23,950] Trial 223 finished with value: 1.4555555555555557 and parameters: {'x_0_0': 'ad', 'x_0_1': 'bc', 'x_0_2': 'ac', 'x_1_0': 'ab', 'x_1_1': 'bd', 'x_1_2': 'oo'}. Best is trial 2 with value: 0.9444444444444444.
[I 2024-10-13 11:29:23,970] Trial 224 finished with value: 1.3444444444444446 and parameters: {'x_0_0': 'bd', 'x_0_1': 'ad', 'x_0_2': 'ad', 'x_1_0': 'bc', 'x_1_1': 'oo', 'x_1_2': 'cd'}. Best is trial 2 with value: 0.9444444444444444.
[I 2024-10-13 11:29:23,991] Trial 225 finished with value: 1.7777777777777777 and parameters: {'x_0_0': 'ab', 'x_0_1': 'bc', 'x_0_2': 'ac', 'x_1_0': 'ab', 'x_1_1': 'ad', 'x_1_2': 'ac'}. Best is trial 2 with value: 0.9444444444444444.
[I 2024-10-13 11:29:24,014] Trial 226 finished with value: 1.4555555555555557 and parameters: {'x_0_0': 'bc', 'x_0_1': 'ab', 'x_0_2': 'ac', 'x_1_0': 'bd', 'x_1_1': 'oo', 'x_1_2': 'ad'}. Best is trial 2 with value: 0.9444444444444444.
[I 2024-10-13 11:29:24,035] Trial 227 finished with value: 1.3666666666666667 and parameters: {'x_0_0': 'bc', 'x_0_1': 'bc', 'x_0_2': 'ab', 'x_1_0': 'oo', 'x_1_1': 'ab', 'x_1_2': 'oo'}. Best is trial 2 with value: 0.9444444444444444.
[I 2024-10-13 11:29:24,054] Trial 228 finished with value: 1.6666666666666665 and parameters: {'x_0_0': 'ad', 'x_0_1': 'cd', 'x_0_2': 'bc', 'x_1_0': 'cd', 'x_1_1': 'cd', 'x_1_2': 'ac'}. Best is trial 2 with value: 0.9444444444444444.
[I 2024-10-13 11:29:24,075] Trial 229 finished with value: 1.7777777777777777 and parameters: {'x_0_0': 'ab', 'x_0_1': 'ad', 'x_0_2': 'cd', 'x_1_0': 'bd', 'x_1_1': 'cd', 'x_1_2': 'bd'}. Best is trial 2 with value: 0.9444444444444444.
[I 2024-10-13 11:29:24,095] Trial 230 finished with value: 1.4666666666666666 and parameters: {'x_0_0': 'bd', 'x_0_1': 'ab', 'x_0_2': 'bd', 'x_1_0': 'oo', 'x_1_1': 'ad', 'x_1_2': 'bc'}. Best is trial 2 with value: 0.9444444444444444.
[I 2024-10-13 11:29:24,114] Trial 231 finished with value: 1.5777777777777777 and parameters: {'x_0_0': 'ab', 'x_0_1': 'ad', 'x_0_2': 'ac', 'x_1_0': 'oo', 'x_1_1': 'ab', 'x_1_2': 'cd'}. Best is trial 2 with value: 0.9444444444444444.
[I 2024-10-13 11:29:24,133] Trial 232 finished with value: 2.0 and parameters: {'x_0_0': 'cd', 'x_0_1': 'ad', 'x_0_2': 'bd', 'x_1_0': 'bc', 'x_1_1': 'cd', 'x_1_2': 'ab'}. Best is trial 2 with value: 0.9444444444444444.
[I 2024-10-13 11:29:24,152] Trial 233 finished with value: 1.6 and parameters: {'x_0_0': 'cd', 'x_0_1': 'ac', 'x_0_2': 'oo', 'x_1_0': 'oo', 'x_1_1': 'ac', 'x_1_2': 'oo'}. Best is trial 2 with value: 0.9444444444444444.
[I 2024-10-13 11:29:24,171] Trial 234 finished with value: 1.6666666666666665 and parameters: {'x_0_0': 'bd', 'x_0_1': 'ad', 'x_0_2': 'ab', 'x_1_0': 'cd', 'x_1_1': 'ad', 'x_1_2': 'bc'}. Best is trial 2 with value: 0.9444444444444444.
[I 2024-10-13 11:29:24,191] Trial 235 finished with value: 1.5555555555555556 and parameters: {'x_0_0': 'bd', 'x_0_1': 'ab', 'x_0_2': 'ac', 'x_1_0': 'ab', 'x_1_1': 'ad', 'x_1_2': 'ac'}. Best is trial 2 with value: 0.9444444444444444.
[I 2024-10-13 11:29:24,210] Trial 236 finished with value: 1.6666666666666665 and parameters: {'x_0_0': 'ad', 'x_0_1': 'bd', 'x_0_2': 'bc', 'x_1_0': 'ad', 'x_1_1': 'ab', 'x_1_2': 'ac'}. Best is trial 2 with value: 0.9444444444444444.
[I 2024-10-13 11:29:24,229] Trial 237 finished with value: 1.4444444444444444 and parameters: {'x_0_0': 'ad', 'x_0_1': 'ad', 'x_0_2': 'cd', 'x_1_0': 'bc', 'x_1_1': 'cd', 'x_1_2': 'ad'}. Best is trial 2 with value: 0.9444444444444444.
[I 2024-10-13 11:29:24,247] Trial 238 finished with value: 1.5666666666666667 and parameters: {'x_0_0': 'bc', 'x_0_1': 'bc', 'x_0_2': 'cd', 'x_1_0': 'bd', 'x_1_1': 'cd', 'x_1_2': 'oo'}. Best is trial 2 with value: 0.9444444444444444.
[I 2024-10-13 11:29:24,266] Trial 239 finished with value: 1.5555555555555556 and parameters: {'x_0_0': 'bc', 'x_0_1': 'ab', 'x_0_2': 'bd', 'x_1_0': 'cd', 'x_1_1': 'ac', 'x_1_2': 'bd'}. Best is trial 2 with value: 0.9444444444444444.
[I 2024-10-13 11:29:24,286] Trial 240 finished with value: 1.1777777777777778 and parameters: {'x_0_0': 'ab', 'x_0_1': 'oo', 'x_0_2': 'bd', 'x_1_0': 'oo', 'x_1_1': 'ac', 'x_1_2': 'ab'}. Best is trial 2 with value: 0.9444444444444444.
[I 2024-10-13 11:29:24,305] Trial 241 finished with value: 1.6777777777777778 and parameters: {'x_0_0': 'ab', 'x_0_1': 'bc', 'x_0_2': 'ab', 'x_1_0': 'cd', 'x_1_1': 'oo', 'x_1_2': 'ac'}. Best is trial 2 with value: 0.9444444444444444.
[I 2024-10-13 11:29:24,323] Trial 242 finished with value: 1.6 and parameters: {'x_0_0': 'oo', 'x_0_1': 'bd', 'x_0_2': 'bd', 'x_1_0': 'oo', 'x_1_1': 'oo', 'x_1_2': 'bd'}. Best is trial 2 with value: 0.9444444444444444.
[I 2024-10-13 11:29:24,342] Trial 243 finished with value: 1.6666666666666665 and parameters: {'x_0_0': 'bd', 'x_0_1': 'cd', 'x_0_2': 'ad', 'x_1_0': 'ad', 'x_1_1': 'ac', 'x_1_2': 'ad'}. Best is trial 2 with value: 0.9444444444444444.
[I 2024-10-13 11:29:24,361] Trial 244 finished with value: 1.7777777777777777 and parameters: {'x_0_0': 'ab', 'x_0_1': 'cd', 'x_0_2': 'bd', 'x_1_0': 'bc', 'x_1_1': 'bc', 'x_1_2': 'cd'}. Best is trial 2 with value: 0.9444444444444444.
[I 2024-10-13 11:29:24,380] Trial 245 finished with value: 1.5555555555555556 and parameters: {'x_0_0': 'bc', 'x_0_1': 'ab', 'x_0_2': 'cd', 'x_1_0': 'ad', 'x_1_1': 'ac', 'x_1_2': 'ac'}. Best is trial 2 with value: 0.9444444444444444.
[I 2024-10-13 11:29:24,399] Trial 246 finished with value: 1.2222222222222223 and parameters: {'x_0_0': 'bc', 'x_0_1': 'ac', 'x_0_2': 'ad', 'x_1_0': 'ab', 'x_1_1': 'ad', 'x_1_2': 'ac'}. Best is trial 2 with value: 0.9444444444444444.
[I 2024-10-13 11:29:24,417] Trial 247 finished with value: 1.6777777777777776 and parameters: {'x_0_0': 'ab', 'x_0_1': 'bc', 'x_0_2': 'oo', 'x_1_0': 'ac', 'x_1_1': 'bc', 'x_1_2': 'ad'}. Best is trial 2 with value: 0.9444444444444444.
[I 2024-10-13 11:29:24,436] Trial 248 finished with value: 1.5 and parameters: {'x_0_0': 'oo', 'x_0_1': 'oo', 'x_0_2': 'ab', 'x_1_0': 'ad', 'x_1_1': 'cd', 'x_1_2': 'ac'}. Best is trial 2 with value: 0.9444444444444444.
[I 2024-10-13 11:29:24,455] Trial 249 finished with value: 1.1444444444444444 and parameters: {'x_0_0': 'ac', 'x_0_1': 'ac', 'x_0_2': 'oo', 'x_1_0': 'oo', 'x_1_1': 'ad', 'x_1_2': 'ad'}. Best is trial 2 with value: 0.9444444444444444.
[I 2024-10-13 11:29:24,474] Trial 250 finished with value: 1.6666666666666665 and parameters: {'x_0_0': 'bc', 'x_0_1': 'bd', 'x_0_2': 'ac', 'x_1_0': 'ac', 'x_1_1': 'ad', 'x_1_2': 'bc'}. Best is trial 2 with value: 0.9444444444444444.
[I 2024-10-13 11:29:24,493] Trial 251 finished with value: 1.5777777777777777 and parameters: {'x_0_0': 'ab', 'x_0_1': 'ac', 'x_0_2': 'ac', 'x_1_0': 'oo', 'x_1_1': 'cd', 'x_1_2': 'bd'}. Best is trial 2 with value: 0.9444444444444444.
[I 2024-10-13 11:29:24,512] Trial 252 finished with value: 1.1444444444444444 and parameters: {'x_0_0': 'ac', 'x_0_1': 'ad', 'x_0_2': 'oo', 'x_1_0': 'oo', 'x_1_1': 'cd', 'x_1_2': 'bc'}. Best is trial 2 with value: 0.9444444444444444.
[I 2024-10-13 11:29:24,531] Trial 253 finished with value: 1.6777777777777778 and parameters: {'x_0_0': 'ab', 'x_0_1': 'bc', 'x_0_2': 'ad', 'x_1_0': 'bd', 'x_1_1': 'oo', 'x_1_2': 'ad'}. Best is trial 2 with value: 0.9444444444444444.
[I 2024-10-13 11:29:24,550] Trial 254 finished with value: 1.5555555555555556 and parameters: {'x_0_0': 'ad', 'x_0_1': 'ac', 'x_0_2': 'ad', 'x_1_0': 'ab', 'x_1_1': 'ad', 'x_1_2': 'bd'}. Best is trial 2 with value: 0.9444444444444444.
[I 2024-10-13 11:29:24,569] Trial 255 finished with value: 1.5666666666666667 and parameters: {'x_0_0': 'bc', 'x_0_1': 'bd', 'x_0_2': 'cd', 'x_1_0': 'ad', 'x_1_1': 'ac', 'x_1_2': 'oo'}. Best is trial 2 with value: 0.9444444444444444.
[I 2024-10-13 11:29:24,587] Trial 256 finished with value: 1.6666666666666665 and parameters: {'x_0_0': 'ac', 'x_0_1': 'bc', 'x_0_2': 'cd', 'x_1_0': 'ac', 'x_1_1': 'ac', 'x_1_2': 'ad'}. Best is trial 2 with value: 0.9444444444444444.
[I 2024-10-13 11:29:24,636] Trial 257 finished with value: 1.4666666666666666 and parameters: {'x_0_0': 'bd', 'x_0_1': 'ac', 'x_0_2': 'oo', 'x_1_0': 'ad', 'x_1_1': 'bc', 'x_1_2': 'oo'}. Best is trial 2 with value: 0.9444444444444444.
[I 2024-10-13 11:29:24,655] Trial 258 finished with value: 1.5666666666666667 and parameters: {'x_0_0': 'ad', 'x_0_1': 'ab', 'x_0_2': 'bd', 'x_1_0': 'ad', 'x_1_1': 'ad', 'x_1_2': 'oo'}. Best is trial 2 with value: 0.9444444444444444.
[I 2024-10-13 11:29:24,675] Trial 259 finished with value: 1.3666666666666667 and parameters: {'x_0_0': 'bd', 'x_0_1': 'bd', 'x_0_2': 'ab', 'x_1_0': 'oo', 'x_1_1': 'oo', 'x_1_2': 'cd'}. Best is trial 2 with value: 0.9444444444444444.
[I 2024-10-13 11:29:24,694] Trial 260 finished with value: 1.7999999999999998 and parameters: {'x_0_0': 'oo', 'x_0_1': 'cd', 'x_0_2': 'bd', 'x_1_0': 'bd', 'x_1_1': 'bd', 'x_1_2': 'oo'}. Best is trial 2 with value: 0.9444444444444444.
[I 2024-10-13 11:29:24,713] Trial 261 finished with value: 1.9 and parameters: {'x_0_0': 'cd', 'x_0_1': 'cd', 'x_0_2': 'bd', 'x_1_0': 'bc', 'x_1_1': 'cd', 'x_1_2': 'oo'}. Best is trial 2 with value: 0.9444444444444444.
[I 2024-10-13 11:29:24,732] Trial 262 finished with value: 1.3666666666666667 and parameters: {'x_0_0': 'bd', 'x_0_1': 'ad', 'x_0_2': 'oo', 'x_1_0': 'oo', 'x_1_1': 'cd', 'x_1_2': 'bc'}. Best is trial 2 with value: 0.9444444444444444.
[I 2024-10-13 11:29:24,751] Trial 263 finished with value: 1.8 and parameters: {'x_0_0': 'cd', 'x_0_1': 'ab', 'x_0_2': 'bc', 'x_1_0': 'ac', 'x_1_1': 'oo', 'x_1_2': 'oo'}. Best is trial 2 with value: 0.9444444444444444.
[I 2024-10-13 11:29:24,769] Trial 264 finished with value: 1.1444444444444444 and parameters: {'x_0_0': 'ac', 'x_0_1': 'ac', 'x_0_2': 'oo', 'x_1_0': 'oo', 'x_1_1': 'cd', 'x_1_2': 'ac'}. Best is trial 2 with value: 0.9444444444444444.
[I 2024-10-13 11:29:24,789] Trial 265 finished with value: 1.2444444444444445 and parameters: {'x_0_0': 'bd', 'x_0_1': 'bc', 'x_0_2': 'bc', 'x_1_0': 'bd', 'x_1_1': 'oo', 'x_1_2': 'oo'}. Best is trial 2 with value: 0.9444444444444444.
[I 2024-10-13 11:29:24,808] Trial 266 finished with value: 1.4555555555555557 and parameters: {'x_0_0': 'bc', 'x_0_1': 'ab', 'x_0_2': 'ab', 'x_1_0': 'ac', 'x_1_1': 'oo', 'x_1_2': 'bd'}. Best is trial 2 with value: 0.9444444444444444.
[I 2024-10-13 11:29:24,827] Trial 267 finished with value: 1.9 and parameters: {'x_0_0': 'oo', 'x_0_1': 'cd', 'x_0_2': 'ad', 'x_1_0': 'bd', 'x_1_1': 'bc', 'x_1_2': 'ad'}. Best is trial 2 with value: 0.9444444444444444.
[I 2024-10-13 11:29:24,846] Trial 268 finished with value: 1.6777777777777778 and parameters: {'x_0_0': 'ab', 'x_0_1': 'bc', 'x_0_2': 'bc', 'x_1_0': 'bd', 'x_1_1': 'oo', 'x_1_2': 'ab'}. Best is trial 2 with value: 0.9444444444444444.
[I 2024-10-13 11:29:24,865] Trial 269 finished with value: 1.7777777777777777 and parameters: {'x_0_0': 'ab', 'x_0_1': 'bd', 'x_0_2': 'ad', 'x_1_0': 'bc', 'x_1_1': 'bd', 'x_1_2': 'ab'}. Best is trial 2 with value: 0.9444444444444444.
[I 2024-10-13 11:29:24,884] Trial 270 finished with value: 1.7777777777777777 and parameters: {'x_0_0': 'ab', 'x_0_1': 'bc', 'x_0_2': 'bc', 'x_1_0': 'ac', 'x_1_1': 'ad', 'x_1_2': 'bd'}. Best is trial 2 with value: 0.9444444444444444.
[I 2024-10-13 11:29:24,902] Trial 271 finished with value: 1.5666666666666667 and parameters: {'x_0_0': 'bd', 'x_0_1': 'bd', 'x_0_2': 'bc', 'x_1_0': 'ad', 'x_1_1': 'bc', 'x_1_2': 'oo'}. Best is trial 2 with value: 0.9444444444444444.
[I 2024-10-13 11:29:24,921] Trial 272 finished with value: 1.7999999999999998 and parameters: {'x_0_0': 'cd', 'x_0_1': 'ab', 'x_0_2': 'cd', 'x_1_0': 'oo', 'x_1_1': 'ac', 'x_1_2': 'bd'}. Best is trial 2 with value: 0.9444444444444444.
[I 2024-10-13 11:29:24,940] Trial 273 finished with value: 2.0 and parameters: {'x_0_0': 'cd', 'x_0_1': 'ab', 'x_0_2': 'bd', 'x_1_0': 'ac', 'x_1_1': 'ac', 'x_1_2': 'ab'}. Best is trial 2 with value: 0.9444444444444444.
[I 2024-10-13 11:29:24,959] Trial 274 finished with value: 1.6666666666666665 and parameters: {'x_0_0': 'bd', 'x_0_1': 'ab', 'x_0_2': 'bd', 'x_1_0': 'ac', 'x_1_1': 'bd', 'x_1_2': 'cd'}. Best is trial 2 with value: 0.9444444444444444.
[I 2024-10-13 11:29:24,979] Trial 275 finished with value: 1.4444444444444444 and parameters: {'x_0_0': 'ac', 'x_0_1': 'ac', 'x_0_2': 'bc', 'x_1_0': 'bd', 'x_1_1': 'ac', 'x_1_2': 'ab'}. Best is trial 2 with value: 0.9444444444444444.
[I 2024-10-13 11:29:24,997] Trial 276 finished with value: 1.7 and parameters: {'x_0_0': 'oo', 'x_0_1': 'bc', 'x_0_2': 'bd', 'x_1_0': 'oo', 'x_1_1': 'bd', 'x_1_2': 'ad'}. Best is trial 2 with value: 0.9444444444444444.
[I 2024-10-13 11:29:25,016] Trial 277 finished with value: 1.9 and parameters: {'x_0_0': 'cd', 'x_0_1': 'ac', 'x_0_2': 'oo', 'x_1_0': 'bd', 'x_1_1': 'bc', 'x_1_2': 'ac'}. Best is trial 2 with value: 0.9444444444444444.
[I 2024-10-13 11:29:25,034] Trial 278 finished with value: 2.0 and parameters: {'x_0_0': 'cd', 'x_0_1': 'bd', 'x_0_2': 'bc', 'x_1_0': 'bc', 'x_1_1': 'ad', 'x_1_2': 'ac'}. Best is trial 2 with value: 0.9444444444444444.
[I 2024-10-13 11:29:25,053] Trial 279 finished with value: 1.3444444444444446 and parameters: {'x_0_0': 'bd', 'x_0_1': 'ad', 'x_0_2': 'ac', 'x_1_0': 'bd', 'x_1_1': 'ab', 'x_1_2': 'oo'}. Best is trial 2 with value: 0.9444444444444444.
[I 2024-10-13 11:29:25,071] Trial 280 finished with value: 1.6666666666666665 and parameters: {'x_0_0': 'bd', 'x_0_1': 'cd', 'x_0_2': 'ad', 'x_1_0': 'ac', 'x_1_1': 'ad', 'x_1_2': 'ac'}. Best is trial 2 with value: 0.9444444444444444.
[I 2024-10-13 11:29:25,090] Trial 281 finished with value: 1.6666666666666665 and parameters: {'x_0_0': 'bc', 'x_0_1': 'cd', 'x_0_2': 'ad', 'x_1_0': 'bc', 'x_1_1': 'cd', 'x_1_2': 'ab'}. Best is trial 2 with value: 0.9444444444444444.
