[I 2024-10-13 11:30:18,402] Trial 184 finished with value: 0.9222222222222222 and parameters: {'x_0_0': 'bc', 'x_0_1': 'ad', 'x_0_2': 'ac', 'x_1_0': 'oo', 'x_1_1': 'bd', 'x_1_2': 'oo'}. Best is trial 107 with value: 0.9222222222222222.
[I 2024-10-13 11:30:18,431] Trial 185 finished with value: 1.2555555555555555 and parameters: {'x_0_0': 'bc', 'x_0_1': 'ab', 'x_0_2': 'ac', 'x_1_0': 'oo', 'x_1_1': 'bd', 'x_1_2': 'oo'}. Best is trial 107 with value: 0.9222222222222222.
[I 2024-10-13 11:30:18,460] Trial 186 finished with value: 1.5666666666666667 and parameters: {'x_0_0': 'bd', 'x_0_1': 'ad', 'x_0_2': 'ac', 'x_1_0': 'cd', 'x_1_1': 'bd', 'x_1_2': 'oo'}. Best is trial 107 with value: 0.9222222222222222.
[I 2024-10-13 11:30:18,487] Trial 187 finished with value: 0.9222222222222222 and parameters: {'x_0_0': 'bc', 'x_0_1': 'ad', 'x_0_2': 'ac', 'x_1_0': 'oo', 'x_1_1': 'bd', 'x_1_2': 'oo'}. Best is trial 107 with value: 0.9222222222222222.
[I 2024-10-13 11:30:18,516] Trial 188 finished with value: 0.9222222222222222 and parameters: {'x_0_0': 'bc', 'x_0_1': 'ad', 'x_0_2': 'ac', 'x_1_0': 'oo', 'x_1_1': 'bd', 'x_1_2': 'oo'}. Best is trial 107 with value: 0.9222222222222222.
[I 2024-10-13 11:30:18,544] Trial 189 finished with value: 1.2222222222222223 and parameters: {'x_0_0': 'bc', 'x_0_1': 'ad', 'x_0_2': 'ac', 'x_1_0': 'ac', 'x_1_1': 'bd', 'x_1_2': 'ac'}. Best is trial 107 with value: 0.9222222222222222.
[I 2024-10-13 11:30:18,573] Trial 190 finished with value: 0.9222222222222222 and parameters: {'x_0_0': 'bc', 'x_0_1': 'ad', 'x_0_2': 'ac', 'x_1_0': 'oo', 'x_1_1': 'bd', 'x_1_2': 'oo'}. Best is trial 107 with value: 0.9222222222222222.
[I 2024-10-13 11:30:18,601] Trial 191 finished with value: 0.9222222222222222 and parameters: {'x_0_0': 'bc', 'x_0_1': 'ad', 'x_0_2': 'ac', 'x_1_0': 'oo', 'x_1_1': 'bd', 'x_1_2': 'oo'}. Best is trial 107 with value: 0.9222222222222222.
[I 2024-10-13 11:30:18,627] Trial 192 finished with value: 0.9222222222222222 and parameters: {'x_0_0': 'bc', 'x_0_1': 'ad', 'x_0_2': 'ac', 'x_1_0': 'oo', 'x_1_1': 'bd', 'x_1_2': 'oo'}. Best is trial 107 with value: 0.9222222222222222.
[I 2024-10-13 11:30:18,654] Trial 193 finished with value: 0.9222222222222222 and parameters: {'x_0_0': 'bc', 'x_0_1': 'ad', 'x_0_2': 'ac', 'x_1_0': 'oo', 'x_1_1': 'bd', 'x_1_2': 'oo'}. Best is trial 107 with value: 0.9222222222222222.
[I 2024-10-13 11:30:18,679] Trial 194 finished with value: 0.9222222222222222 and parameters: {'x_0_0': 'bc', 'x_0_1': 'ad', 'x_0_2': 'ac', 'x_1_0': 'oo', 'x_1_1': 'bd', 'x_1_2': 'oo'}. Best is trial 107 with value: 0.9222222222222222.
[I 2024-10-13 11:30:18,705] Trial 195 finished with value: 1.0222222222222221 and parameters: {'x_0_0': 'bc', 'x_0_1': 'ad', 'x_0_2': 'ac', 'x_1_0': 'oo', 'x_1_1': 'bd', 'x_1_2': 'bd'}. Best is trial 107 with value: 0.9222222222222222.
[I 2024-10-13 11:30:18,732] Trial 196 finished with value: 1.1222222222222222 and parameters: {'x_0_0': 'bc', 'x_0_1': 'ad', 'x_0_2': 'ac', 'x_1_0': 'bd', 'x_1_1': 'bd', 'x_1_2': 'oo'}. Best is trial 107 with value: 0.9222222222222222.
[I 2024-10-13 11:30:18,758] Trial 197 finished with value: 1.3666666666666667 and parameters: {'x_0_0': 'ad', 'x_0_1': 'ad', 'x_0_2': 'bd', 'x_1_0': 'oo', 'x_1_1': 'bd', 'x_1_2': 'oo'}. Best is trial 107 with value: 0.9222222222222222.
[I 2024-10-13 11:30:18,785] Trial 198 finished with value: 1.3666666666666667 and parameters: {'x_0_0': 'bc', 'x_0_1': 'bc', 'x_0_2': 'ad', 'x_1_0': 'oo', 'x_1_1': 'cd', 'x_1_2': 'oo'}. Best is trial 107 with value: 0.9222222222222222.
[I 2024-10-13 11:30:18,812] Trial 199 finished with value: 1.2222222222222223 and parameters: {'x_0_0': 'bc', 'x_0_1': 'ad', 'x_0_2': 'ac', 'x_1_0': 'ab', 'x_1_1': 'bd', 'x_1_2': 'cd'}. Best is trial 107 with value: 0.9222222222222222.
[I 2024-10-13 11:30:18,839] Trial 200 finished with value: 1.1444444444444444 and parameters: {'x_0_0': 'bc', 'x_0_1': 'ad', 'x_0_2': 'ac', 'x_1_0': 'oo', 'x_1_1': 'ad', 'x_1_2': 'oo'}. Best is trial 107 with value: 0.9222222222222222.
[I 2024-10-13 11:30:18,869] Trial 201 finished with value: 0.9222222222222222 and parameters: {'x_0_0': 'bc', 'x_0_1': 'ad', 'x_0_2': 'ac', 'x_1_0': 'oo', 'x_1_1': 'bd', 'x_1_2': 'oo'}. Best is trial 107 with value: 0.9222222222222222.
[I 2024-10-13 11:30:18,896] Trial 202 finished with value: 0.9222222222222222 and parameters: {'x_0_0': 'bc', 'x_0_1': 'ad', 'x_0_2': 'ac', 'x_1_0': 'oo', 'x_1_1': 'bd', 'x_1_2': 'oo'}. Best is trial 107 with value: 0.9222222222222222.
[I 2024-10-13 11:30:18,923] Trial 203 finished with value: 0.9222222222222222 and parameters: {'x_0_0': 'bc', 'x_0_1': 'ad', 'x_0_2': 'ac', 'x_1_0': 'oo', 'x_1_1': 'bd', 'x_1_2': 'oo'}. Best is trial 107 with value: 0.9222222222222222.
[I 2024-10-13 11:30:18,950] Trial 204 finished with value: 0.9222222222222222 and parameters: {'x_0_0': 'bc', 'x_0_1': 'ad', 'x_0_2': 'ac', 'x_1_0': 'oo', 'x_1_1': 'bd', 'x_1_2': 'oo'}. Best is trial 107 with value: 0.9222222222222222.
[I 2024-10-13 11:30:18,976] Trial 205 finished with value: 1.6 and parameters: {'x_0_0': 'oo', 'x_0_1': 'ad', 'x_0_2': 'ac', 'x_1_0': 'oo', 'x_1_1': 'bd', 'x_1_2': 'oo'}. Best is trial 107 with value: 0.9222222222222222.
[I 2024-10-13 11:30:19,004] Trial 206 finished with value: 1.2666666666666666 and parameters: {'x_0_0': 'bc', 'x_0_1': 'cd', 'x_0_2': 'oo', 'x_1_0': 'oo', 'x_1_1': 'bd', 'x_1_2': 'oo'}. Best is trial 107 with value: 0.9222222222222222.
[I 2024-10-13 11:30:19,032] Trial 207 finished with value: 1.3333333333333333 and parameters: {'x_0_0': 'bc', 'x_0_1': 'ad', 'x_0_2': 'ac', 'x_1_0': 'bc', 'x_1_1': 'ab', 'x_1_2': 'ad'}. Best is trial 107 with value: 0.9222222222222222.
[I 2024-10-13 11:30:19,058] Trial 208 finished with value: 0.9222222222222222 and parameters: {'x_0_0': 'bc', 'x_0_1': 'ad', 'x_0_2': 'ac', 'x_1_0': 'oo', 'x_1_1': 'bd', 'x_1_2': 'oo'}. Best is trial 107 with value: 0.9222222222222222.
[I 2024-10-13 11:30:19,085] Trial 209 finished with value: 0.9222222222222222 and parameters: {'x_0_0': 'bc', 'x_0_1': 'ad', 'x_0_2': 'ac', 'x_1_0': 'oo', 'x_1_1': 'bd', 'x_1_2': 'oo'}. Best is trial 107 with value: 0.9222222222222222.
[I 2024-10-13 11:30:19,111] Trial 210 finished with value: 1.5777777777777777 and parameters: {'x_0_0': 'ab', 'x_0_1': 'ad', 'x_0_2': 'bc', 'x_1_0': 'oo', 'x_1_1': 'bd', 'x_1_2': 'ab'}. Best is trial 107 with value: 0.9222222222222222.
[I 2024-10-13 11:30:19,139] Trial 211 finished with value: 0.9222222222222222 and parameters: {'x_0_0': 'bc', 'x_0_1': 'ad', 'x_0_2': 'ac', 'x_1_0': 'oo', 'x_1_1': 'bd', 'x_1_2': 'oo'}. Best is trial 107 with value: 0.9222222222222222.
[I 2024-10-13 11:30:19,166] Trial 212 finished with value: 0.9222222222222222 and parameters: {'x_0_0': 'bc', 'x_0_1': 'ad', 'x_0_2': 'ac', 'x_1_0': 'oo', 'x_1_1': 'bd', 'x_1_2': 'oo'}. Best is trial 107 with value: 0.9222222222222222.
[I 2024-10-13 11:30:19,192] Trial 213 finished with value: 1.3666666666666667 and parameters: {'x_0_0': 'bc', 'x_0_1': 'bd', 'x_0_2': 'ac', 'x_1_0': 'oo', 'x_1_1': 'bd', 'x_1_2': 'oo'}. Best is trial 107 with value: 0.9222222222222222.
[I 2024-10-13 11:30:19,219] Trial 214 finished with value: 0.9222222222222222 and parameters: {'x_0_0': 'bc', 'x_0_1': 'ad', 'x_0_2': 'cd', 'x_1_0': 'oo', 'x_1_1': 'bd', 'x_1_2': 'oo'}. Best is trial 107 with value: 0.9222222222222222.
[I 2024-10-13 11:30:19,246] Trial 215 finished with value: 0.9222222222222222 and parameters: {'x_0_0': 'bc', 'x_0_1': 'ad', 'x_0_2': 'ac', 'x_1_0': 'oo', 'x_1_1': 'bd', 'x_1_2': 'oo'}. Best is trial 107 with value: 0.9222222222222222.
[I 2024-10-13 11:30:19,273] Trial 216 finished with value: 1.2444444444444445 and parameters: {'x_0_0': 'ac', 'x_0_1': 'ad', 'x_0_2': 'ac', 'x_1_0': 'oo', 'x_1_1': 'ac', 'x_1_2': 'bc'}. Best is trial 107 with value: 0.9222222222222222.
[I 2024-10-13 11:30:19,300] Trial 217 finished with value: 1.1222222222222222 and parameters: {'x_0_0': 'bc', 'x_0_1': 'ac', 'x_0_2': 'ac', 'x_1_0': 'ad', 'x_1_1': 'bd', 'x_1_2': 'oo'}. Best is trial 107 with value: 0.9222222222222222.
[I 2024-10-13 11:30:19,328] Trial 218 finished with value: 1.7 and parameters: {'x_0_0': 'cd', 'x_0_1': 'ad', 'x_0_2': 'ac', 'x_1_0': 'oo', 'x_1_1': 'bd', 'x_1_2': 'oo'}. Best is trial 107 with value: 0.9222222222222222.
[I 2024-10-13 11:30:19,354] Trial 219 finished with value: 0.9222222222222222 and parameters: {'x_0_0': 'bc', 'x_0_1': 'ad', 'x_0_2': 'ac', 'x_1_0': 'oo', 'x_1_1': 'bd', 'x_1_2': 'oo'}. Best is trial 107 with value: 0.9222222222222222.
[I 2024-10-13 11:30:19,381] Trial 220 finished with value: 1.2555555555555555 and parameters: {'x_0_0': 'bc', 'x_0_1': 'ab', 'x_0_2': 'ac', 'x_1_0': 'oo', 'x_1_1': 'bd', 'x_1_2': 'oo'}. Best is trial 107 with value: 0.9222222222222222.
[I 2024-10-13 11:30:19,407] Trial 221 finished with value: 0.9222222222222222 and parameters: {'x_0_0': 'bc', 'x_0_1': 'ad', 'x_0_2': 'ac', 'x_1_0': 'oo', 'x_1_1': 'bd', 'x_1_2': 'oo'}. Best is trial 107 with value: 0.9222222222222222.
[I 2024-10-13 11:30:19,433] Trial 222 finished with value: 0.9222222222222222 and parameters: {'x_0_0': 'bc', 'x_0_1': 'ad', 'x_0_2': 'ac', 'x_1_0': 'oo', 'x_1_1': 'bd', 'x_1_2': 'oo'}. Best is trial 107 with value: 0.9222222222222222.
[I 2024-10-13 11:30:19,460] Trial 223 finished with value: 0.9222222222222222 and parameters: {'x_0_0': 'bc', 'x_0_1': 'ad', 'x_0_2': 'ac', 'x_1_0': 'oo', 'x_1_1': 'bd', 'x_1_2': 'oo'}. Best is trial 107 with value: 0.9222222222222222.
[I 2024-10-13 11:30:19,486] Trial 224 finished with value: 0.9222222222222222 and parameters: {'x_0_0': 'bc', 'x_0_1': 'ad', 'x_0_2': 'ac', 'x_1_0': 'oo', 'x_1_1': 'bd', 'x_1_2': 'oo'}. Best is trial 107 with value: 0.9222222222222222.
[I 2024-10-13 11:30:19,512] Trial 225 finished with value: 0.9222222222222222 and parameters: {'x_0_0': 'bc', 'x_0_1': 'ad', 'x_0_2': 'ac', 'x_1_0': 'oo', 'x_1_1': 'bd', 'x_1_2': 'oo'}. Best is trial 107 with value: 0.9222222222222222.
[I 2024-10-13 11:30:19,539] Trial 226 finished with value: 0.9222222222222222 and parameters: {'x_0_0': 'bc', 'x_0_1': 'ad', 'x_0_2': 'ac', 'x_1_0': 'oo', 'x_1_1': 'bd', 'x_1_2': 'oo'}. Best is trial 107 with value: 0.9222222222222222.
[I 2024-10-13 11:30:19,565] Trial 227 finished with value: 0.9222222222222222 and parameters: {'x_0_0': 'bc', 'x_0_1': 'ad', 'x_0_2': 'ac', 'x_1_0': 'oo', 'x_1_1': 'bd', 'x_1_2': 'oo'}. Best is trial 107 with value: 0.9222222222222222.
[I 2024-10-13 11:30:19,592] Trial 228 finished with value: 1.2666666666666666 and parameters: {'x_0_0': 'bd', 'x_0_1': 'ad', 'x_0_2': 'ac', 'x_1_0': 'oo', 'x_1_1': 'oo', 'x_1_2': 'oo'}. Best is trial 107 with value: 0.9222222222222222.
[I 2024-10-13 11:30:19,620] Trial 229 finished with value: 1.2222222222222223 and parameters: {'x_0_0': 'bc', 'x_0_1': 'ad', 'x_0_2': 'ac', 'x_1_0': 'cd', 'x_1_1': 'bd', 'x_1_2': 'ac'}. Best is trial 107 with value: 0.9222222222222222.
[I 2024-10-13 11:30:19,647] Trial 230 finished with value: 0.9222222222222222 and parameters: {'x_0_0': 'bc', 'x_0_1': 'ad', 'x_0_2': 'ac', 'x_1_0': 'oo', 'x_1_1': 'bd', 'x_1_2': 'oo'}. Best is trial 107 with value: 0.9222222222222222.
[I 2024-10-13 11:30:19,675] Trial 231 finished with value: 0.9222222222222222 and parameters: {'x_0_0': 'bc', 'x_0_1': 'ad', 'x_0_2': 'ac', 'x_1_0': 'oo', 'x_1_1': 'bd', 'x_1_2': 'oo'}. Best is trial 107 with value: 0.9222222222222222.
[I 2024-10-13 11:30:19,702] Trial 232 finished with value: 0.9222222222222222 and parameters: {'x_0_0': 'bc', 'x_0_1': 'ad', 'x_0_2': 'ac', 'x_1_0': 'oo', 'x_1_1': 'bd', 'x_1_2': 'oo'}. Best is trial 107 with value: 0.9222222222222222.
[I 2024-10-13 11:30:19,729] Trial 233 finished with value: 0.9222222222222222 and parameters: {'x_0_0': 'bc', 'x_0_1': 'ad', 'x_0_2': 'ac', 'x_1_0': 'oo', 'x_1_1': 'bd', 'x_1_2': 'oo'}. Best is trial 107 with value: 0.9222222222222222.
[I 2024-10-13 11:30:19,757] Trial 234 finished with value: 0.9222222222222222 and parameters: {'x_0_0': 'bc', 'x_0_1': 'ad', 'x_0_2': 'ac', 'x_1_0': 'oo', 'x_1_1': 'bd', 'x_1_2': 'oo'}. Best is trial 107 with value: 0.9222222222222222.
[I 2024-10-13 11:30:19,784] Trial 235 finished with value: 1.1222222222222222 and parameters: {'x_0_0': 'bc', 'x_0_1': 'ad', 'x_0_2': 'ac', 'x_1_0': 'ac', 'x_1_1': 'bd', 'x_1_2': 'oo'}. Best is trial 107 with value: 0.9222222222222222.
[I 2024-10-13 11:30:19,811] Trial 236 finished with value: 0.9222222222222222 and parameters: {'x_0_0': 'bc', 'x_0_1': 'ad', 'x_0_2': 'ac', 'x_1_0': 'oo', 'x_1_1': 'bd', 'x_1_2': 'oo'}. Best is trial 107 with value: 0.9222222222222222.
[I 2024-10-13 11:30:19,838] Trial 237 finished with value: 1.3666666666666667 and parameters: {'x_0_0': 'bc', 'x_0_1': 'bc', 'x_0_2': 'ad', 'x_1_0': 'oo', 'x_1_1': 'bd', 'x_1_2': 'oo'}. Best is trial 107 with value: 0.9222222222222222.
[I 2024-10-13 11:30:19,864] Trial 238 finished with value: 1.4444444444444444 and parameters: {'x_0_0': 'bc', 'x_0_1': 'ad', 'x_0_2': 'bd', 'x_1_0': 'bd', 'x_1_1': 'cd', 'x_1_2': 'bd'}. Best is trial 107 with value: 0.9222222222222222.
[I 2024-10-13 11:30:19,892] Trial 239 finished with value: 1.3666666666666667 and parameters: {'x_0_0': 'ad', 'x_0_1': 'ad', 'x_0_2': 'ac', 'x_1_0': 'oo', 'x_1_1': 'bd', 'x_1_2': 'oo'}. Best is trial 107 with value: 0.9222222222222222.
[I 2024-10-13 11:30:19,919] Trial 240 finished with value: 0.9222222222222222 and parameters: {'x_0_0': 'bc', 'x_0_1': 'ad', 'x_0_2': 'ac', 'x_1_0': 'oo', 'x_1_1': 'bd', 'x_1_2': 'oo'}. Best is trial 107 with value: 0.9222222222222222.
[I 2024-10-13 11:30:19,946] Trial 241 finished with value: 0.9222222222222222 and parameters: {'x_0_0': 'bc', 'x_0_1': 'ad', 'x_0_2': 'ac', 'x_1_0': 'oo', 'x_1_1': 'bd', 'x_1_2': 'oo'}. Best is trial 107 with value: 0.9222222222222222.
[I 2024-10-13 11:30:19,973] Trial 242 finished with value: 0.9222222222222222 and parameters: {'x_0_0': 'bc', 'x_0_1': 'ad', 'x_0_2': 'ac', 'x_1_0': 'oo', 'x_1_1': 'bd', 'x_1_2': 'oo'}. Best is trial 107 with value: 0.9222222222222222.
[I 2024-10-13 11:30:20,000] Trial 243 finished with value: 0.9222222222222222 and parameters: {'x_0_0': 'bc', 'x_0_1': 'ad', 'x_0_2': 'ac', 'x_1_0': 'oo', 'x_1_1': 'bd', 'x_1_2': 'oo'}. Best is trial 107 with value: 0.9222222222222222.
[I 2024-10-13 11:30:20,026] Trial 244 finished with value: 0.9222222222222222 and parameters: {'x_0_0': 'bc', 'x_0_1': 'ad', 'x_0_2': 'ac', 'x_1_0': 'oo', 'x_1_1': 'bd', 'x_1_2': 'oo'}. Best is trial 107 with value: 0.9222222222222222.
[I 2024-10-13 11:30:20,053] Trial 245 finished with value: 0.9222222222222222 and parameters: {'x_0_0': 'bc', 'x_0_1': 'ad', 'x_0_2': 'ac', 'x_1_0': 'oo', 'x_1_1': 'bd', 'x_1_2': 'oo'}. Best is trial 107 with value: 0.9222222222222222.
[I 2024-10-13 11:30:20,080] Trial 246 finished with value: 0.9222222222222222 and parameters: {'x_0_0': 'bc', 'x_0_1': 'ad', 'x_0_2': 'ac', 'x_1_0': 'oo', 'x_1_1': 'bd', 'x_1_2': 'oo'}. Best is trial 107 with value: 0.9222222222222222.
[I 2024-10-13 11:30:20,107] Trial 247 finished with value: 1.3666666666666667 and parameters: {'x_0_0': 'bc', 'x_0_1': 'cd', 'x_0_2': 'oo', 'x_1_0': 'oo', 'x_1_1': 'ad', 'x_1_2': 'cd'}. Best is trial 107 with value: 0.9222222222222222.
[I 2024-10-13 11:30:20,135] Trial 248 finished with value: 1.1222222222222222 and parameters: {'x_0_0': 'bc', 'x_0_1': 'ad', 'x_0_2': 'ac', 'x_1_0': 'ab', 'x_1_1': 'bd', 'x_1_2': 'oo'}. Best is trial 107 with value: 0.9222222222222222.
[I 2024-10-13 11:30:20,162] Trial 249 finished with value: 1.7999999999999998 and parameters: {'x_0_0': 'oo', 'x_0_1': 'ad', 'x_0_2': 'ac', 'x_1_0': 'bc', 'x_1_1': 'bd', 'x_1_2': 'oo'}. Best is trial 107 with value: 0.9222222222222222.
[I 2024-10-13 11:30:20,189] Trial 250 finished with value: 1.0333333333333332 and parameters: {'x_0_0': 'bc', 'x_0_1': 'ad', 'x_0_2': 'bc', 'x_1_0': 'oo', 'x_1_1': 'ab', 'x_1_2': 'oo'}. Best is trial 107 with value: 0.9222222222222222.
[I 2024-10-13 11:30:20,217] Trial 251 finished with value: 1.0222222222222221 and parameters: {'x_0_0': 'bc', 'x_0_1': 'ad', 'x_0_2': 'ac', 'x_1_0': 'oo', 'x_1_1': 'bd', 'x_1_2': 'ad'}. Best is trial 107 with value: 0.9222222222222222.
[I 2024-10-13 11:30:20,244] Trial 252 finished with value: 1.1444444444444444 and parameters: {'x_0_0': 'bc', 'x_0_1': 'ac', 'x_0_2': 'cd', 'x_1_0': 'oo', 'x_1_1': 'bd', 'x_1_2': 'oo'}. Best is trial 107 with value: 0.9222222222222222.
[I 2024-10-13 11:30:20,274] Trial 253 finished with value: 1.3666666666666667 and parameters: {'x_0_0': 'bc', 'x_0_1': 'bd', 'x_0_2': 'ac', 'x_1_0': 'oo', 'x_1_1': 'bd', 'x_1_2': 'oo'}. Best is trial 107 with value: 0.9222222222222222.
[I 2024-10-13 11:30:20,301] Trial 254 finished with value: 1.0222222222222221 and parameters: {'x_0_0': 'bc', 'x_0_1': 'ad', 'x_0_2': 'ac', 'x_1_0': 'oo', 'x_1_1': 'bd', 'x_1_2': 'ab'}. Best is trial 107 with value: 0.9222222222222222.
[I 2024-10-13 11:30:20,328] Trial 255 finished with value: 0.9222222222222222 and parameters: {'x_0_0': 'bc', 'x_0_1': 'ad', 'x_0_2': 'ac', 'x_1_0': 'oo', 'x_1_1': 'bd', 'x_1_2': 'oo'}. Best is trial 107 with value: 0.9222222222222222.
[I 2024-10-13 11:30:20,355] Trial 256 finished with value: 1.4777777777777779 and parameters: {'x_0_0': 'ab', 'x_0_1': 'ad', 'x_0_2': 'ac', 'x_1_0': 'oo', 'x_1_1': 'bd', 'x_1_2': 'oo'}. Best is trial 107 with value: 0.9222222222222222.
[I 2024-10-13 11:30:20,382] Trial 257 finished with value: 1.2444444444444445 and parameters: {'x_0_0': 'ac', 'x_0_1': 'ad', 'x_0_2': 'ac', 'x_1_0': 'oo', 'x_1_1': 'ac', 'x_1_2': 'bc'}. Best is trial 107 with value: 0.9222222222222222.
[I 2024-10-13 11:30:20,409] Trial 258 finished with value: 1.7 and parameters: {'x_0_0': 'cd', 'x_0_1': 'ab', 'x_0_2': 'ac', 'x_1_0': 'oo', 'x_1_1': 'bd', 'x_1_2': 'oo'}. Best is trial 107 with value: 0.9222222222222222.
[I 2024-10-13 11:30:20,436] Trial 259 finished with value: 0.9222222222222222 and parameters: {'x_0_0': 'bc', 'x_0_1': 'ad', 'x_0_2': 'ac', 'x_1_0': 'oo', 'x_1_1': 'bd', 'x_1_2': 'oo'}. Best is trial 107 with value: 0.9222222222222222.
[I 2024-10-13 11:30:20,463] Trial 260 finished with value: 1.1222222222222222 and parameters: {'x_0_0': 'bc', 'x_0_1': 'ad', 'x_0_2': 'ac', 'x_1_0': 'ad', 'x_1_1': 'bd', 'x_1_2': 'oo'}. Best is trial 107 with value: 0.9222222222222222.
[I 2024-10-13 11:30:20,490] Trial 261 finished with value: 0.9222222222222222 and parameters: {'x_0_0': 'bc', 'x_0_1': 'ad', 'x_0_2': 'ac', 'x_1_0': 'oo', 'x_1_1': 'bd', 'x_1_2': 'oo'}. Best is trial 107 with value: 0.9222222222222222.
[I 2024-10-13 11:30:20,518] Trial 262 finished with value: 0.9222222222222222 and parameters: {'x_0_0': 'bc', 'x_0_1': 'ad', 'x_0_2': 'ac', 'x_1_0': 'oo', 'x_1_1': 'bd', 'x_1_2': 'oo'}. Best is trial 107 with value: 0.9222222222222222.
[I 2024-10-13 11:30:20,548] Trial 263 finished with value: 1.0444444444444443 and parameters: {'x_0_0': 'bc', 'x_0_1': 'ad', 'x_0_2': 'ac', 'x_1_0': 'oo', 'x_1_1': 'oo', 'x_1_2': 'oo'}. Best is trial 107 with value: 0.9222222222222222.
[I 2024-10-13 11:30:20,577] Trial 264 finished with value: 1.3666666666666667 and parameters: {'x_0_0': 'bd', 'x_0_1': 'ad', 'x_0_2': 'ac', 'x_1_0': 'oo', 'x_1_1': 'bd', 'x_1_2': 'oo'}. Best is trial 107 with value: 0.9222222222222222.
[I 2024-10-13 11:30:20,605] Trial 265 finished with value: 1.1222222222222222 and parameters: {'x_0_0': 'bc', 'x_0_1': 'ad', 'x_0_2': 'ac', 'x_1_0': 'cd', 'x_1_1': 'bd', 'x_1_2': 'oo'}. Best is trial 107 with value: 0.9222222222222222.
[I 2024-10-13 11:30:20,633] Trial 266 finished with value: 1.0222222222222221 and parameters: {'x_0_0': 'bc', 'x_0_1': 'ad', 'x_0_2': 'ac', 'x_1_0': 'oo', 'x_1_1': 'bd', 'x_1_2': 'ac'}. Best is trial 107 with value: 0.9222222222222222.
[I 2024-10-13 11:30:20,660] Trial 267 finished with value: 0.9222222222222222 and parameters: {'x_0_0': 'bc', 'x_0_1': 'ad', 'x_0_2': 'ac', 'x_1_0': 'oo', 'x_1_1': 'bd', 'x_1_2': 'oo'}. Best is trial 107 with value: 0.9222222222222222.
[I 2024-10-13 11:30:20,687] Trial 268 finished with value: 0.9222222222222222 and parameters: {'x_0_0': 'bc', 'x_0_1': 'ad', 'x_0_2': 'ac', 'x_1_0': 'oo', 'x_1_1': 'bd', 'x_1_2': 'oo'}. Best is trial 107 with value: 0.9222222222222222.
[I 2024-10-13 11:30:20,714] Trial 269 finished with value: 1.3666666666666667 and parameters: {'x_0_0': 'bc', 'x_0_1': 'bc', 'x_0_2': 'bd', 'x_1_0': 'oo', 'x_1_1': 'bd', 'x_1_2': 'oo'}. Best is trial 107 with value: 0.9222222222222222.
[I 2024-10-13 11:30:20,741] Trial 270 finished with value: 1.1444444444444444 and parameters: {'x_0_0': 'bc', 'x_0_1': 'ad', 'x_0_2': 'ad', 'x_1_0': 'oo', 'x_1_1': 'cd', 'x_1_2': 'oo'}. Best is trial 107 with value: 0.9222222222222222.
[I 2024-10-13 11:30:20,768] Trial 271 finished with value: 1.2222222222222223 and parameters: {'x_0_0': 'bc', 'x_0_1': 'ad', 'x_0_2': 'ac', 'x_1_0': 'ac', 'x_1_1': 'bd', 'x_1_2': 'bd'}. Best is trial 107 with value: 0.9222222222222222.
[I 2024-10-13 11:30:20,796] Trial 272 finished with value: 1.3444444444444446 and parameters: {'x_0_0': 'ad', 'x_0_1': 'ad', 'x_0_2': 'ac', 'x_1_0': 'bd', 'x_1_1': 'bd', 'x_1_2': 'oo'}. Best is trial 107 with value: 0.9222222222222222.
[I 2024-10-13 11:30:20,824] Trial 273 finished with value: 0.9222222222222222 and parameters: {'x_0_0': 'bc', 'x_0_1': 'ad', 'x_0_2': 'ac', 'x_1_0': 'oo', 'x_1_1': 'bd', 'x_1_2': 'oo'}. Best is trial 107 with value: 0.9222222222222222.
[I 2024-10-13 11:30:20,851] Trial 274 finished with value: 1.3666666666666667 and parameters: {'x_0_0': 'bc', 'x_0_1': 'cd', 'x_0_2': 'ac', 'x_1_0': 'oo', 'x_1_1': 'ad', 'x_1_2': 'oo'}. Best is trial 107 with value: 0.9222222222222222.
[I 2024-10-13 11:30:20,879] Trial 275 finished with value: 0.9222222222222222 and parameters: {'x_0_0': 'bc', 'x_0_1': 'ad', 'x_0_2': 'ac', 'x_1_0': 'oo', 'x_1_1': 'bd', 'x_1_2': 'oo'}. Best is trial 107 with value: 0.9222222222222222.
[I 2024-10-13 11:30:20,906] Trial 276 finished with value: 1.0222222222222221 and parameters: {'x_0_0': 'bc', 'x_0_1': 'ad', 'x_0_2': 'oo', 'x_1_0': 'ab', 'x_1_1': 'bd', 'x_1_2': 'oo'}. Best is trial 107 with value: 0.9222222222222222.
