[I 2024-10-13 11:30:53,041] Trial 193 finished with value: 0.7 and parameters: {'x_0_0': 'bc', 'x_0_1': 'ac', 'x_0_2': 'ad', 'x_1_0': 'oo', 'x_1_1': 'oo', 'x_1_2': 'bc'}. Best is trial 119 with value: 0.7.
[I 2024-10-13 11:30:53,093] Trial 194 finished with value: 0.7 and parameters: {'x_0_0': 'bc', 'x_0_1': 'ac', 'x_0_2': 'ad', 'x_1_0': 'oo', 'x_1_1': 'oo', 'x_1_2': 'bc'}. Best is trial 119 with value: 0.7.
[I 2024-10-13 11:30:53,162] Trial 195 finished with value: 1.4777777777777779 and parameters: {'x_0_0': 'ab', 'x_0_1': 'ad', 'x_0_2': 'ad', 'x_1_0': 'oo', 'x_1_1': 'oo', 'x_1_2': 'bc'}. Best is trial 119 with value: 0.7.
[I 2024-10-13 11:30:53,226] Trial 196 finished with value: 0.7 and parameters: {'x_0_0': 'bc', 'x_0_1': 'ac', 'x_0_2': 'ad', 'x_1_0': 'oo', 'x_1_1': 'oo', 'x_1_2': 'bc'}. Best is trial 119 with value: 0.7.
[I 2024-10-13 11:30:53,264] Trial 197 finished with value: 1.1444444444444444 and parameters: {'x_0_0': 'bc', 'x_0_1': 'ac', 'x_0_2': 'bc', 'x_1_0': 'oo', 'x_1_1': 'ac', 'x_1_2': 'oo'}. Best is trial 119 with value: 0.7.
[I 2024-10-13 11:30:53,305] Trial 198 finished with value: 0.7 and parameters: {'x_0_0': 'bc', 'x_0_1': 'ac', 'x_0_2': 'ad', 'x_1_0': 'oo', 'x_1_1': 'oo', 'x_1_2': 'bc'}. Best is trial 119 with value: 0.7.
[I 2024-10-13 11:30:53,344] Trial 199 finished with value: 0.7 and parameters: {'x_0_0': 'bc', 'x_0_1': 'ac', 'x_0_2': 'ad', 'x_1_0': 'oo', 'x_1_1': 'oo', 'x_1_2': 'bc'}. Best is trial 119 with value: 0.7.
[I 2024-10-13 11:30:53,379] Trial 200 finished with value: 0.9 and parameters: {'x_0_0': 'bc', 'x_0_1': 'ac', 'x_0_2': 'ad', 'x_1_0': 'bd', 'x_1_1': 'oo', 'x_1_2': 'bc'}. Best is trial 119 with value: 0.7.
[I 2024-10-13 11:30:53,417] Trial 201 finished with value: 0.7 and parameters: {'x_0_0': 'bc', 'x_0_1': 'ac', 'x_0_2': 'ad', 'x_1_0': 'oo', 'x_1_1': 'oo', 'x_1_2': 'bc'}. Best is trial 119 with value: 0.7.
[I 2024-10-13 11:30:53,467] Trial 202 finished with value: 0.7 and parameters: {'x_0_0': 'bc', 'x_0_1': 'ac', 'x_0_2': 'ad', 'x_1_0': 'oo', 'x_1_1': 'oo', 'x_1_2': 'bc'}. Best is trial 119 with value: 0.7.
[I 2024-10-13 11:30:53,522] Trial 203 finished with value: 0.7 and parameters: {'x_0_0': 'bc', 'x_0_1': 'ac', 'x_0_2': 'ad', 'x_1_0': 'oo', 'x_1_1': 'oo', 'x_1_2': 'bc'}. Best is trial 119 with value: 0.7.
[I 2024-10-13 11:30:53,567] Trial 204 finished with value: 0.7 and parameters: {'x_0_0': 'bc', 'x_0_1': 'ac', 'x_0_2': 'ad', 'x_1_0': 'oo', 'x_1_1': 'oo', 'x_1_2': 'bc'}. Best is trial 119 with value: 0.7.
[I 2024-10-13 11:30:53,603] Trial 205 finished with value: 0.9 and parameters: {'x_0_0': 'bc', 'x_0_1': 'ac', 'x_0_2': 'ad', 'x_1_0': 'bc', 'x_1_1': 'oo', 'x_1_2': 'bc'}. Best is trial 119 with value: 0.7.
[I 2024-10-13 11:30:53,636] Trial 206 finished with value: 0.9222222222222222 and parameters: {'x_0_0': 'bc', 'x_0_1': 'ac', 'x_0_2': 'ac', 'x_1_0': 'oo', 'x_1_1': 'oo', 'x_1_2': 'ac'}. Best is trial 119 with value: 0.7.
[I 2024-10-13 11:30:53,665] Trial 207 finished with value: 0.7 and parameters: {'x_0_0': 'bc', 'x_0_1': 'ac', 'x_0_2': 'ad', 'x_1_0': 'oo', 'x_1_1': 'oo', 'x_1_2': 'bc'}. Best is trial 119 with value: 0.7.
[I 2024-10-13 11:30:53,694] Trial 208 finished with value: 1.3666666666666667 and parameters: {'x_0_0': 'bc', 'x_0_1': 'bd', 'x_0_2': 'ad', 'x_1_0': 'oo', 'x_1_1': 'oo', 'x_1_2': 'ab'}. Best is trial 119 with value: 0.7.
[I 2024-10-13 11:30:53,722] Trial 209 finished with value: 1.1444444444444444 and parameters: {'x_0_0': 'bc', 'x_0_1': 'ac', 'x_0_2': 'cd', 'x_1_0': 'oo', 'x_1_1': 'oo', 'x_1_2': 'bc'}. Best is trial 119 with value: 0.7.
[I 2024-10-13 11:30:53,750] Trial 210 finished with value: 1.4666666666666666 and parameters: {'x_0_0': 'bd', 'x_0_1': 'bc', 'x_0_2': 'oo', 'x_1_0': 'ac', 'x_1_1': 'oo', 'x_1_2': 'bc'}. Best is trial 119 with value: 0.7.
[I 2024-10-13 11:30:53,782] Trial 211 finished with value: 0.7 and parameters: {'x_0_0': 'bc', 'x_0_1': 'ac', 'x_0_2': 'ad', 'x_1_0': 'oo', 'x_1_1': 'oo', 'x_1_2': 'bc'}. Best is trial 119 with value: 0.7.
[I 2024-10-13 11:30:53,813] Trial 212 finished with value: 0.7 and parameters: {'x_0_0': 'bc', 'x_0_1': 'ac', 'x_0_2': 'ad', 'x_1_0': 'oo', 'x_1_1': 'oo', 'x_1_2': 'bc'}. Best is trial 119 with value: 0.7.
[I 2024-10-13 11:30:53,841] Trial 213 finished with value: 0.7 and parameters: {'x_0_0': 'bc', 'x_0_1': 'ac', 'x_0_2': 'ad', 'x_1_0': 'oo', 'x_1_1': 'oo', 'x_1_2': 'bc'}. Best is trial 119 with value: 0.7.
[I 2024-10-13 11:30:53,875] Trial 214 finished with value: 0.7 and parameters: {'x_0_0': 'bc', 'x_0_1': 'ac', 'x_0_2': 'ad', 'x_1_0': 'oo', 'x_1_1': 'oo', 'x_1_2': 'bc'}. Best is trial 119 with value: 0.7.
[I 2024-10-13 11:30:53,908] Trial 215 finished with value: 1.3666666666666667 and parameters: {'x_0_0': 'bc', 'x_0_1': 'cd', 'x_0_2': 'ad', 'x_1_0': 'oo', 'x_1_1': 'oo', 'x_1_2': 'bc'}. Best is trial 119 with value: 0.7.
[I 2024-10-13 11:30:53,937] Trial 216 finished with value: 1.3666666666666667 and parameters: {'x_0_0': 'ad', 'x_0_1': 'ac', 'x_0_2': 'ad', 'x_1_0': 'oo', 'x_1_1': 'oo', 'x_1_2': 'ad'}. Best is trial 119 with value: 0.7.
[I 2024-10-13 11:30:53,968] Trial 217 finished with value: 0.7999999999999999 and parameters: {'x_0_0': 'bc', 'x_0_1': 'ac', 'x_0_2': 'ad', 'x_1_0': 'oo', 'x_1_1': 'bd', 'x_1_2': 'bc'}. Best is trial 119 with value: 0.7.
[I 2024-10-13 11:30:53,997] Trial 218 finished with value: 0.7 and parameters: {'x_0_0': 'bc', 'x_0_1': 'ac', 'x_0_2': 'ad', 'x_1_0': 'oo', 'x_1_1': 'oo', 'x_1_2': 'bc'}. Best is trial 119 with value: 0.7.
[I 2024-10-13 11:30:54,026] Trial 219 finished with value: 0.7 and parameters: {'x_0_0': 'bc', 'x_0_1': 'ac', 'x_0_2': 'ad', 'x_1_0': 'oo', 'x_1_1': 'oo', 'x_1_2': 'bc'}. Best is trial 119 with value: 0.7.
[I 2024-10-13 11:30:54,057] Trial 220 finished with value: 1.9 and parameters: {'x_0_0': 'cd', 'x_0_1': 'ac', 'x_0_2': 'ad', 'x_1_0': 'ad', 'x_1_1': 'oo', 'x_1_2': 'bc'}. Best is trial 119 with value: 0.7.
[I 2024-10-13 11:30:54,086] Trial 221 finished with value: 0.7 and parameters: {'x_0_0': 'bc', 'x_0_1': 'ac', 'x_0_2': 'ad', 'x_1_0': 'oo', 'x_1_1': 'oo', 'x_1_2': 'bc'}. Best is trial 119 with value: 0.7.
[I 2024-10-13 11:30:54,115] Trial 222 finished with value: 0.7 and parameters: {'x_0_0': 'bc', 'x_0_1': 'ac', 'x_0_2': 'ad', 'x_1_0': 'oo', 'x_1_1': 'oo', 'x_1_2': 'bc'}. Best is trial 119 with value: 0.7.
[I 2024-10-13 11:30:54,142] Trial 223 finished with value: 0.7999999999999999 and parameters: {'x_0_0': 'bc', 'x_0_1': 'ac', 'x_0_2': 'ad', 'x_1_0': 'oo', 'x_1_1': 'cd', 'x_1_2': 'bc'}. Best is trial 119 with value: 0.7.
[I 2024-10-13 11:30:54,170] Trial 224 finished with value: 0.7 and parameters: {'x_0_0': 'bc', 'x_0_1': 'ac', 'x_0_2': 'ad', 'x_1_0': 'oo', 'x_1_1': 'oo', 'x_1_2': 'bc'}. Best is trial 119 with value: 0.7.
[I 2024-10-13 11:30:54,199] Trial 225 finished with value: 0.7 and parameters: {'x_0_0': 'bc', 'x_0_1': 'ac', 'x_0_2': 'ad', 'x_1_0': 'oo', 'x_1_1': 'oo', 'x_1_2': 'bc'}. Best is trial 119 with value: 0.7.
[I 2024-10-13 11:30:54,228] Trial 226 finished with value: 0.7999999999999999 and parameters: {'x_0_0': 'bc', 'x_0_1': 'ac', 'x_0_2': 'ad', 'x_1_0': 'oo', 'x_1_1': 'ad', 'x_1_2': 'bc'}. Best is trial 119 with value: 0.7.
[I 2024-10-13 11:30:54,257] Trial 227 finished with value: 1.6 and parameters: {'x_0_0': 'oo', 'x_0_1': 'ab', 'x_0_2': 'ab', 'x_1_0': 'oo', 'x_1_1': 'oo', 'x_1_2': 'bc'}. Best is trial 119 with value: 0.7.
[I 2024-10-13 11:30:54,285] Trial 228 finished with value: 0.9 and parameters: {'x_0_0': 'bc', 'x_0_1': 'ac', 'x_0_2': 'ad', 'x_1_0': 'ab', 'x_1_1': 'oo', 'x_1_2': 'bc'}. Best is trial 119 with value: 0.7.
[I 2024-10-13 11:30:54,314] Trial 229 finished with value: 0.7 and parameters: {'x_0_0': 'bc', 'x_0_1': 'ac', 'x_0_2': 'ad', 'x_1_0': 'oo', 'x_1_1': 'oo', 'x_1_2': 'bc'}. Best is trial 119 with value: 0.7.
[I 2024-10-13 11:30:54,342] Trial 230 finished with value: 0.9222222222222222 and parameters: {'x_0_0': 'bc', 'x_0_1': 'ac', 'x_0_2': 'ad', 'x_1_0': 'oo', 'x_1_1': 'oo', 'x_1_2': 'cd'}. Best is trial 119 with value: 0.7.
[I 2024-10-13 11:30:54,370] Trial 231 finished with value: 0.7 and parameters: {'x_0_0': 'bc', 'x_0_1': 'ac', 'x_0_2': 'ad', 'x_1_0': 'oo', 'x_1_1': 'oo', 'x_1_2': 'bc'}. Best is trial 119 with value: 0.7.
[I 2024-10-13 11:30:54,398] Trial 232 finished with value: 0.7 and parameters: {'x_0_0': 'bc', 'x_0_1': 'ac', 'x_0_2': 'ad', 'x_1_0': 'oo', 'x_1_1': 'oo', 'x_1_2': 'bc'}. Best is trial 119 with value: 0.7.
[I 2024-10-13 11:30:54,425] Trial 233 finished with value: 0.7 and parameters: {'x_0_0': 'bc', 'x_0_1': 'ac', 'x_0_2': 'ad', 'x_1_0': 'oo', 'x_1_1': 'oo', 'x_1_2': 'bc'}. Best is trial 119 with value: 0.7.
[I 2024-10-13 11:30:54,453] Trial 234 finished with value: 0.7 and parameters: {'x_0_0': 'bc', 'x_0_1': 'ac', 'x_0_2': 'ad', 'x_1_0': 'oo', 'x_1_1': 'oo', 'x_1_2': 'bc'}. Best is trial 119 with value: 0.7.
[I 2024-10-13 11:30:54,481] Trial 235 finished with value: 0.9666666666666667 and parameters: {'x_0_0': 'bc', 'x_0_1': 'oo', 'x_0_2': 'ad', 'x_1_0': 'oo', 'x_1_1': 'oo', 'x_1_2': 'bc'}. Best is trial 119 with value: 0.7.
[I 2024-10-13 11:30:54,509] Trial 236 finished with value: 1.0 and parameters: {'x_0_0': 'bc', 'x_0_1': 'ac', 'x_0_2': 'ad', 'x_1_0': 'cd', 'x_1_1': 'ac', 'x_1_2': 'bc'}. Best is trial 119 with value: 0.7.
[I 2024-10-13 11:30:54,537] Trial 237 finished with value: 1.4777777777777779 and parameters: {'x_0_0': 'ab', 'x_0_1': 'ac', 'x_0_2': 'bd', 'x_1_0': 'oo', 'x_1_1': 'oo', 'x_1_2': 'bc'}. Best is trial 119 with value: 0.7.
[I 2024-10-13 11:30:54,564] Trial 238 finished with value: 0.7 and parameters: {'x_0_0': 'bc', 'x_0_1': 'ac', 'x_0_2': 'ad', 'x_1_0': 'oo', 'x_1_1': 'oo', 'x_1_2': 'bc'}. Best is trial 119 with value: 0.7.
[I 2024-10-13 11:30:54,591] Trial 239 finished with value: 1.0444444444444443 and parameters: {'x_0_0': 'bc', 'x_0_1': 'ad', 'x_0_2': 'ad', 'x_1_0': 'oo', 'x_1_1': 'oo', 'x_1_2': 'oo'}. Best is trial 119 with value: 0.7.
[I 2024-10-13 11:30:54,618] Trial 240 finished with value: 1.1444444444444444 and parameters: {'x_0_0': 'bc', 'x_0_1': 'ac', 'x_0_2': 'bc', 'x_1_0': 'oo', 'x_1_1': 'oo', 'x_1_2': 'bc'}. Best is trial 119 with value: 0.7.
[I 2024-10-13 11:30:54,646] Trial 241 finished with value: 0.7 and parameters: {'x_0_0': 'bc', 'x_0_1': 'ac', 'x_0_2': 'ad', 'x_1_0': 'oo', 'x_1_1': 'oo', 'x_1_2': 'bc'}. Best is trial 119 with value: 0.7.
[I 2024-10-13 11:30:54,674] Trial 242 finished with value: 0.7 and parameters: {'x_0_0': 'bc', 'x_0_1': 'ac', 'x_0_2': 'ad', 'x_1_0': 'oo', 'x_1_1': 'oo', 'x_1_2': 'bc'}. Best is trial 119 with value: 0.7.
[I 2024-10-13 11:30:54,702] Trial 243 finished with value: 0.7 and parameters: {'x_0_0': 'bc', 'x_0_1': 'ac', 'x_0_2': 'ad', 'x_1_0': 'oo', 'x_1_1': 'oo', 'x_1_2': 'bc'}. Best is trial 119 with value: 0.7.
[I 2024-10-13 11:30:54,728] Trial 244 finished with value: 0.7 and parameters: {'x_0_0': 'bc', 'x_0_1': 'ac', 'x_0_2': 'ad', 'x_1_0': 'oo', 'x_1_1': 'oo', 'x_1_2': 'bc'}. Best is trial 119 with value: 0.7.
[I 2024-10-13 11:30:54,755] Trial 245 finished with value: 0.7 and parameters: {'x_0_0': 'bc', 'x_0_1': 'ac', 'x_0_2': 'ad', 'x_1_0': 'oo', 'x_1_1': 'oo', 'x_1_2': 'bc'}. Best is trial 119 with value: 0.7.
[I 2024-10-13 11:30:54,783] Trial 246 finished with value: 0.7 and parameters: {'x_0_0': 'bc', 'x_0_1': 'ac', 'x_0_2': 'ad', 'x_1_0': 'oo', 'x_1_1': 'oo', 'x_1_2': 'bc'}. Best is trial 119 with value: 0.7.
[I 2024-10-13 11:30:54,811] Trial 247 finished with value: 0.9 and parameters: {'x_0_0': 'bc', 'x_0_1': 'ac', 'x_0_2': 'ad', 'x_1_0': 'bd', 'x_1_1': 'oo', 'x_1_2': 'bc'}. Best is trial 119 with value: 0.7.
[I 2024-10-13 11:30:54,839] Trial 248 finished with value: 0.7 and parameters: {'x_0_0': 'bc', 'x_0_1': 'ac', 'x_0_2': 'ad', 'x_1_0': 'oo', 'x_1_1': 'oo', 'x_1_2': 'bc'}. Best is trial 119 with value: 0.7.
[I 2024-10-13 11:30:54,870] Trial 249 finished with value: 0.7 and parameters: {'x_0_0': 'bc', 'x_0_1': 'ac', 'x_0_2': 'ad', 'x_1_0': 'oo', 'x_1_1': 'oo', 'x_1_2': 'bd'}. Best is trial 119 with value: 0.7.
[I 2024-10-13 11:30:54,900] Trial 250 finished with value: 1.5666666666666667 and parameters: {'x_0_0': 'bc', 'x_0_1': 'bc', 'x_0_2': 'ad', 'x_1_0': 'bc', 'x_1_1': 'oo', 'x_1_2': 'ac'}. Best is trial 119 with value: 0.7.
[I 2024-10-13 11:30:54,930] Trial 251 finished with value: 1.3666666666666667 and parameters: {'x_0_0': 'bd', 'x_0_1': 'ac', 'x_0_2': 'ac', 'x_1_0': 'oo', 'x_1_1': 'oo', 'x_1_2': 'bc'}. Best is trial 119 with value: 0.7.
[I 2024-10-13 11:30:54,959] Trial 252 finished with value: 1.3666666666666667 and parameters: {'x_0_0': 'bc', 'x_0_1': 'bd', 'x_0_2': 'cd', 'x_1_0': 'oo', 'x_1_1': 'oo', 'x_1_2': 'ab'}. Best is trial 119 with value: 0.7.
[I 2024-10-13 11:30:54,990] Trial 253 finished with value: 0.7 and parameters: {'x_0_0': 'bc', 'x_0_1': 'ac', 'x_0_2': 'ad', 'x_1_0': 'oo', 'x_1_1': 'oo', 'x_1_2': 'bc'}. Best is trial 119 with value: 0.7.
[I 2024-10-13 11:30:55,020] Trial 254 finished with value: 1.4666666666666666 and parameters: {'x_0_0': 'ad', 'x_0_1': 'ac', 'x_0_2': 'ad', 'x_1_0': 'oo', 'x_1_1': 'bd', 'x_1_2': 'bc'}. Best is trial 119 with value: 0.7.
[I 2024-10-13 11:30:55,047] Trial 255 finished with value: 1.2444444444444445 and parameters: {'x_0_0': 'bc', 'x_0_1': 'ac', 'x_0_2': 'oo', 'x_1_0': 'ac', 'x_1_1': 'oo', 'x_1_2': 'bc'}. Best is trial 119 with value: 0.7.
[I 2024-10-13 11:30:55,075] Trial 256 finished with value: 0.9222222222222222 and parameters: {'x_0_0': 'bc', 'x_0_1': 'ac', 'x_0_2': 'ad', 'x_1_0': 'oo', 'x_1_1': 'oo', 'x_1_2': 'ad'}. Best is trial 119 with value: 0.7.
[I 2024-10-13 11:30:55,103] Trial 257 finished with value: 0.7999999999999999 and parameters: {'x_0_0': 'bc', 'x_0_1': 'ac', 'x_0_2': 'ad', 'x_1_0': 'oo', 'x_1_1': 'cd', 'x_1_2': 'bc'}. Best is trial 119 with value: 0.7.
[I 2024-10-13 11:30:55,131] Trial 258 finished with value: 1.3666666666666667 and parameters: {'x_0_0': 'bc', 'x_0_1': 'cd', 'x_0_2': 'ad', 'x_1_0': 'oo', 'x_1_1': 'oo', 'x_1_2': 'bc'}. Best is trial 119 with value: 0.7.
[I 2024-10-13 11:30:55,161] Trial 259 finished with value: 0.7 and parameters: {'x_0_0': 'bc', 'x_0_1': 'ac', 'x_0_2': 'ad', 'x_1_0': 'oo', 'x_1_1': 'oo', 'x_1_2': 'bc'}. Best is trial 119 with value: 0.7.
[I 2024-10-13 11:30:55,191] Trial 260 finished with value: 1.0 and parameters: {'x_0_0': 'bc', 'x_0_1': 'ac', 'x_0_2': 'ad', 'x_1_0': 'ad', 'x_1_1': 'ad', 'x_1_2': 'bc'}. Best is trial 119 with value: 0.7.
[I 2024-10-13 11:30:55,218] Trial 261 finished with value: 1.7 and parameters: {'x_0_0': 'cd', 'x_0_1': 'ac', 'x_0_2': 'ad', 'x_1_0': 'oo', 'x_1_1': 'oo', 'x_1_2': 'bc'}. Best is trial 119 with value: 0.7.
[I 2024-10-13 11:30:55,247] Trial 262 finished with value: 0.7 and parameters: {'x_0_0': 'bc', 'x_0_1': 'ac', 'x_0_2': 'ad', 'x_1_0': 'oo', 'x_1_1': 'oo', 'x_1_2': 'bc'}. Best is trial 119 with value: 0.7.
[I 2024-10-13 11:30:55,277] Trial 263 finished with value: 0.7 and parameters: {'x_0_0': 'bc', 'x_0_1': 'ac', 'x_0_2': 'ad', 'x_1_0': 'oo', 'x_1_1': 'oo', 'x_1_2': 'bc'}. Best is trial 119 with value: 0.7.
[I 2024-10-13 11:30:55,305] Trial 264 finished with value: 1.6 and parameters: {'x_0_0': 'oo', 'x_0_1': 'ab', 'x_0_2': 'ab', 'x_1_0': 'oo', 'x_1_1': 'oo', 'x_1_2': 'bc'}. Best is trial 119 with value: 0.7.
[I 2024-10-13 11:30:55,333] Trial 265 finished with value: 0.7 and parameters: {'x_0_0': 'bc', 'x_0_1': 'ac', 'x_0_2': 'ad', 'x_1_0': 'oo', 'x_1_1': 'oo', 'x_1_2': 'bc'}. Best is trial 119 with value: 0.7.
[I 2024-10-13 11:30:55,398] Trial 266 finished with value: 1.1222222222222222 and parameters: {'x_0_0': 'bc', 'x_0_1': 'ac', 'x_0_2': 'ad', 'x_1_0': 'ab', 'x_1_1': 'oo', 'x_1_2': 'cd'}. Best is trial 119 with value: 0.7.
[I 2024-10-13 11:30:55,427] Trial 267 finished with value: 0.7999999999999999 and parameters: {'x_0_0': 'bc', 'x_0_1': 'ac', 'x_0_2': 'ad', 'x_1_0': 'oo', 'x_1_1': 'bc', 'x_1_2': 'bc'}. Best is trial 119 with value: 0.7.
[I 2024-10-13 11:30:55,456] Trial 268 finished with value: 1.0666666666666667 and parameters: {'x_0_0': 'bc', 'x_0_1': 'oo', 'x_0_2': 'ad', 'x_1_0': 'oo', 'x_1_1': 'ac', 'x_1_2': 'bc'}. Best is trial 119 with value: 0.7.
[I 2024-10-13 11:30:55,483] Trial 269 finished with value: 0.9 and parameters: {'x_0_0': 'bc', 'x_0_1': 'ac', 'x_0_2': 'ad', 'x_1_0': 'cd', 'x_1_1': 'oo', 'x_1_2': 'bc'}. Best is trial 119 with value: 0.7.
[I 2024-10-13 11:30:55,512] Trial 270 finished with value: 0.7 and parameters: {'x_0_0': 'bc', 'x_0_1': 'ac', 'x_0_2': 'ad', 'x_1_0': 'oo', 'x_1_1': 'oo', 'x_1_2': 'bc'}. Best is trial 119 with value: 0.7.
[I 2024-10-13 11:30:55,540] Trial 271 finished with value: 1.4777777777777779 and parameters: {'x_0_0': 'ab', 'x_0_1': 'ac', 'x_0_2': 'bd', 'x_1_0': 'oo', 'x_1_1': 'oo', 'x_1_2': 'bc'}. Best is trial 119 with value: 0.7.
[I 2024-10-13 11:30:55,567] Trial 272 finished with value: 0.7 and parameters: {'x_0_0': 'bc', 'x_0_1': 'ac', 'x_0_2': 'ad', 'x_1_0': 'oo', 'x_1_1': 'oo', 'x_1_2': 'bc'}. Best is trial 119 with value: 0.7.
[I 2024-10-13 11:30:55,595] Trial 273 finished with value: 1.0444444444444443 and parameters: {'x_0_0': 'bc', 'x_0_1': 'ac', 'x_0_2': 'bc', 'x_1_0': 'oo', 'x_1_1': 'oo', 'x_1_2': 'oo'}. Best is trial 119 with value: 0.7.
[I 2024-10-13 11:30:55,623] Trial 274 finished with value: 0.7 and parameters: {'x_0_0': 'bc', 'x_0_1': 'ac', 'x_0_2': 'ad', 'x_1_0': 'oo', 'x_1_1': 'oo', 'x_1_2': 'bc'}. Best is trial 119 with value: 0.7.
[I 2024-10-13 11:30:55,651] Trial 275 finished with value: 0.7 and parameters: {'x_0_0': 'bc', 'x_0_1': 'ac', 'x_0_2': 'ad', 'x_1_0': 'oo', 'x_1_1': 'oo', 'x_1_2': 'bc'}. Best is trial 119 with value: 0.7.
[I 2024-10-13 11:30:55,679] Trial 276 finished with value: 0.9 and parameters: {'x_0_0': 'bc', 'x_0_1': 'ac', 'x_0_2': 'ad', 'x_1_0': 'bd', 'x_1_1': 'oo', 'x_1_2': 'bc'}. Best is trial 119 with value: 0.7.
[I 2024-10-13 11:30:55,707] Trial 277 finished with value: 0.7 and parameters: {'x_0_0': 'bc', 'x_0_1': 'ac', 'x_0_2': 'ad', 'x_1_0': 'oo', 'x_1_1': 'oo', 'x_1_2': 'bd'}. Best is trial 119 with value: 0.7.
[I 2024-10-13 11:30:55,734] Trial 278 finished with value: 1.1444444444444444 and parameters: {'x_0_0': 'bc', 'x_0_1': 'ad', 'x_0_2': 'ad', 'x_1_0': 'oo', 'x_1_1': 'oo', 'x_1_2': 'bc'}. Best is trial 119 with value: 0.7.
[I 2024-10-13 11:30:55,762] Trial 279 finished with value: 1.3444444444444446 and parameters: {'x_0_0': 'bd', 'x_0_1': 'ac', 'x_0_2': 'ad', 'x_1_0': 'bc', 'x_1_1': 'oo', 'x_1_2': 'bc'}. Best is trial 119 with value: 0.7.
[I 2024-10-13 11:30:55,790] Trial 280 finished with value: 1.3666666666666667 and parameters: {'x_0_0': 'bc', 'x_0_1': 'bd', 'x_0_2': 'ac', 'x_1_0': 'oo', 'x_1_1': 'oo', 'x_1_2': 'ac'}. Best is trial 119 with value: 0.7.
[I 2024-10-13 11:30:55,818] Trial 281 finished with value: 1.1444444444444444 and parameters: {'x_0_0': 'ac', 'x_0_1': 'ac', 'x_0_2': 'cd', 'x_1_0': 'oo', 'x_1_1': 'oo', 'x_1_2': 'bc'}. Best is trial 119 with value: 0.7.
[I 2024-10-13 11:30:55,848] Trial 282 finished with value: 1.4666666666666666 and parameters: {'x_0_0': 'bc', 'x_0_1': 'bc', 'x_0_2': 'ad', 'x_1_0': 'oo', 'x_1_1': 'bd', 'x_1_2': 'bc'}. Best is trial 119 with value: 0.7.
[I 2024-10-13 11:30:55,878] Trial 283 finished with value: 0.8111111111111111 and parameters: {'x_0_0': 'bc', 'x_0_1': 'ac', 'x_0_2': 'ad', 'x_1_0': 'oo', 'x_1_1': 'oo', 'x_1_2': 'ab'}. Best is trial 119 with value: 0.7.
[I 2024-10-13 11:30:55,907] Trial 284 finished with value: 1.2666666666666666 and parameters: {'x_0_0': 'ad', 'x_0_1': 'ac', 'x_0_2': 'oo', 'x_1_0': 'oo', 'x_1_1': 'oo', 'x_1_2': 'bc'}. Best is trial 119 with value: 0.7.
[I 2024-10-13 11:30:55,936] Trial 285 finished with value: 0.7999999999999999 and parameters: {'x_0_0': 'bc', 'x_0_1': 'ac', 'x_0_2': 'ad', 'x_1_0': 'oo', 'x_1_1': 'cd', 'x_1_2': 'bc'}. Best is trial 119 with value: 0.7.
[I 2024-10-13 11:30:55,964] Trial 286 finished with value: 1.3666666666666667 and parameters: {'x_0_0': 'bc', 'x_0_1': 'cd', 'x_0_2': 'ad', 'x_1_0': 'oo', 'x_1_1': 'oo', 'x_1_2': 'ad'}. Best is trial 119 with value: 0.7.
[I 2024-10-13 11:30:55,992] Trial 287 finished with value: 0.7 and parameters: {'x_0_0': 'bc', 'x_0_1': 'ac', 'x_0_2': 'ad', 'x_1_0': 'oo', 'x_1_1': 'oo', 'x_1_2': 'bc'}. Best is trial 119 with value: 0.7.
[I 2024-10-13 11:30:56,029] Trial 288 finished with value: 1.0 and parameters: {'x_0_0': 'bc', 'x_0_1': 'ac', 'x_0_2': 'ad', 'x_1_0': 'ac', 'x_1_1': 'ad', 'x_1_2': 'bc'}. Best is trial 119 with value: 0.7.
[I 2024-10-13 11:30:56,058] Trial 289 finished with value: 1.9 and parameters: {'x_0_0': 'cd', 'x_0_1': 'ac', 'x_0_2': 'ad', 'x_1_0': 'ad', 'x_1_1': 'oo', 'x_1_2': 'bc'}. Best is trial 119 with value: 0.7.
[I 2024-10-13 11:30:56,086] Trial 290 finished with value: 0.7 and parameters: {'x_0_0': 'bc', 'x_0_1': 'ac', 'x_0_2': 'ad', 'x_1_0': 'oo', 'x_1_1': 'oo', 'x_1_2': 'bc'}. Best is trial 119 with value: 0.7.
[I 2024-10-13 11:30:56,113] Trial 291 finished with value: 0.7 and parameters: {'x_0_0': 'bc', 'x_0_1': 'ac', 'x_0_2': 'ad', 'x_1_0': 'oo', 'x_1_1': 'oo', 'x_1_2': 'bc'}. Best is trial 119 with value: 0.7.
[I 2024-10-13 11:30:56,142] Trial 292 finished with value: 0.7 and parameters: {'x_0_0': 'bc', 'x_0_1': 'ac', 'x_0_2': 'ad', 'x_1_0': 'oo', 'x_1_1': 'oo', 'x_1_2': 'bc'}. Best is trial 119 with value: 0.7.
[I 2024-10-13 11:30:56,169] Trial 293 finished with value: 0.7999999999999999 and parameters: {'x_0_0': 'bc', 'x_0_1': 'ac', 'x_0_2': 'ad', 'x_1_0': 'oo', 'x_1_1': 'bc', 'x_1_2': 'bc'}. Best is trial 119 with value: 0.7.
[I 2024-10-13 11:30:56,196] Trial 294 finished with value: 0.7 and parameters: {'x_0_0': 'bc', 'x_0_1': 'ac', 'x_0_2': 'ad', 'x_1_0': 'oo', 'x_1_1': 'oo', 'x_1_2': 'bc'}. Best is trial 119 with value: 0.7.
[I 2024-10-13 11:30:56,228] Trial 295 finished with value: 1.3555555555555556 and parameters: {'x_0_0': 'bc', 'x_0_1': 'ab', 'x_0_2': 'ab', 'x_1_0': 'oo', 'x_1_1': 'ac', 'x_1_2': 'cd'}. Best is trial 119 with value: 0.7.
